id,date,to user account,to user account id,to eth address,from user account,from user account id,from eth address,reason,source id,source name,score 1,score 2,score 3,duplicate id 1,duplicate id 2,duplicate id 3,dismissed 1,dismissed 2,dismissed 3,quantifier 1 username,quantifier 1 eth address,quantifier 2 username,quantifier 2 eth address,quantifier 3 username,quantifier 3 eth address,avg score
652dd997b58fa9e8aaa00b2b,2023-10-17T00:47:19.045000Z,whyldwanderer#0,63332c97144cdd9b89d1295c,0xed8DB37778804A913670d9367aAf4F043AAd938b,danidiabella#0,6334862c144cdd9b89d1bd1a,0x5D28FE1e9F895464aab52287d85Ebff32B351674,"for being Johnny-on-the-spots in Giveth Discord channels bottom to top, I say Waaaaa and they say Awwww and give  helpful tips to try when doing it myself just isn't getting it done!",DISCORD:679428761438912522:1027946282863562792,DISCORD:Giveth:%F0%9F%8F%86%E2%94%8Brewards,8,13,13,,,,false,false,false,divine_comedian,0x826976d7C600d45FB8287CA1d7c76FC8eb732030,hanners717,0x711CDABCFdEDEf2c82D9dA533268D8bB6b7468f8,cuidadopeligro,0x8132505BAeDbAa7320b8F2340F65976Edc0e8fBc,11.3333333333333
652dd997b58fa9e8aaa00b2a,2023-10-17T00:47:19.045000Z,giantkin#0,63332451144cdd9b89d1258f,0xff75E131c711e4310C045317779d39B3B4f718C4,danidiabella#0,6334862c144cdd9b89d1bd1a,0x5D28FE1e9F895464aab52287d85Ebff32B351674,"for being Johnny-on-the-spots in Giveth Discord channels bottom to top, I say Waaaaa and they say Awwww and give  helpful tips to try when doing it myself just isn't getting it done!",DISCORD:679428761438912522:1027946282863562792,DISCORD:Giveth:%F0%9F%8F%86%E2%94%8Brewards,8,21,13,,,,false,false,false,divine_comedian,0x826976d7C600d45FB8287CA1d7c76FC8eb732030,nicbals,0xd9D5d85B2682830aC58A78c279E0C177953738b4,cuidadopeligro,0x8132505BAeDbAa7320b8F2340F65976Edc0e8fBc,14
652ded5db58fa9e8aaa011ee,2023-10-17T02:11:41.835000Z,parrachia#0,6490456235a11ee830abcd04,0x144c4E5027B69f7798B2B162D924BcAE5c149f15,freshelle,63345c87144cdd9b89d1aaae,0x38f80f8f76B1C44B2beeFB63bb561F570fb6ddB6,for having the initiative to make it easier for new users to activate their praise account!,DISCORD:679428761438912522:823570903219568700,DISCORD:Giveth:%F0%9F%92%9C%E2%94%8Bpraise,8,8,8,,,,false,false,false,divine_comedian,0x826976d7C600d45FB8287CA1d7c76FC8eb732030,nicbals,0xd9D5d85B2682830aC58A78c279E0C177953738b4,cuidadopeligro,0x8132505BAeDbAa7320b8F2340F65976Edc0e8fBc,8
652ded75b58fa9e8aaa012b3,2023-10-17T02:12:05.945000Z,elita8665,652d95a4b58fa9e8aa9f800a,,freshelle,63345c87144cdd9b89d1aaae,0x38f80f8f76B1C44B2beeFB63bb561F570fb6ddB6,for create an easy to follow Praise guide on how to activate account and start using Praise!,DISCORD:679428761438912522:823570903219568700,DISCORD:Giveth:%F0%9F%92%9C%E2%94%8Bpraise,34,5,8,,,,false,false,false,almondoyealmond,0x0D22735DE6d34DC2ed5efDbC2f30D7Aa8e2B9F8e,nicbals,0xd9D5d85B2682830aC58A78c279E0C177953738b4,danibelle_the_uno_and_only,0x5D28FE1e9F895464aab52287d85Ebff32B351674,15.6666666666667
652ded94b58fa9e8aaa01373,2023-10-17T02:12:36.666000Z,giantkin#0,63332451144cdd9b89d1258f,0xff75E131c711e4310C045317779d39B3B4f718C4,freshelle,63345c87144cdd9b89d1aaae,0x38f80f8f76B1C44B2beeFB63bb561F570fb6ddB6,for the constant support on users having trouble with using Praise,DISCORD:679428761438912522:823570903219568700,DISCORD:Giveth:%F0%9F%92%9C%E2%94%8Bpraise,5,8,21,,,,false,false,false,divine_comedian,0x826976d7C600d45FB8287CA1d7c76FC8eb732030,nicbals,0xd9D5d85B2682830aC58A78c279E0C177953738b4,cuidadopeligro,0x8132505BAeDbAa7320b8F2340F65976Edc0e8fBc,11.3333333333333
652dee7bb58fa9e8aaa01438,2023-10-17T02:16:27.158000Z,karmaticacid#0,63333aed144cdd9b89d12f9d,0xC46c67Bb7E84490D7EbdD0b8ecDaca68Cf3823F4,freshelle,63345c87144cdd9b89d1aaae,0x38f80f8f76B1C44B2beeFB63bb561F570fb6ddB6,for all the coordination work and catherding on hoodie sizes and design for our GivConnect retreat!,DISCORD:679428761438912522:823570903219568700,DISCORD:Giveth:%F0%9F%92%9C%E2%94%8Bpraise,34,8,5,,,,false,false,false,almondoyealmond,0x0D22735DE6d34DC2ed5efDbC2f30D7Aa8e2B9F8e,nicbals,0xd9D5d85B2682830aC58A78c279E0C177953738b4,danibelle_the_uno_and_only,0x5D28FE1e9F895464aab52287d85Ebff32B351674,15.6666666666667
652dee9cb58fa9e8aaa014fb,2023-10-17T02:17:00.936000Z,missgene#0,6335b15e8622e4e2bd1f1712,0xbE6f56Ed9E10E5F58876F7bDF1C83EeDaa721fbc,freshelle,63345c87144cdd9b89d1aaae,0x38f80f8f76B1C44B2beeFB63bb561F570fb6ddB6,for catherding and reminding everyone to fill out important forms for our GivConnect retreat!!,DISCORD:679428761438912522:823570903219568700,DISCORD:Giveth:%F0%9F%92%9C%E2%94%8Bpraise,55,13,21,,,,false,false,false,almondoyealmond,0x0D22735DE6d34DC2ed5efDbC2f30D7Aa8e2B9F8e,hanners717,0x711CDABCFdEDEf2c82D9dA533268D8bB6b7468f8,cuidadopeligro,0x8132505BAeDbAa7320b8F2340F65976Edc0e8fBc,29.6666666666667
652ed37eb58fa9e8aaa19f91,2023-10-17T18:33:34.318000Z,divine_comedian#0,63330f21144cdd9b89d11bff,0x826976d7C600d45FB8287CA1d7c76FC8eb732030,mohammad_ranjbar_z#0,6334498b144cdd9b89d1a1a2,0x2Ea846Dc38C6b6451909F1E7ff2bF613a96DC1F3,For having a productive call and explain something about smart contracts to me,DISCORD:679428761438912522:823570903219568700,DISCORD:Giveth:%F0%9F%92%9C%E2%94%8Bpraise,13,5,3,,,,false,false,false,almondoyealmond,0x0D22735DE6d34DC2ed5efDbC2f30D7Aa8e2B9F8e,nicbals,0xd9D5d85B2682830aC58A78c279E0C177953738b4,danibelle_the_uno_and_only,0x5D28FE1e9F895464aab52287d85Ebff32B351674,7
652efc7ab58fa9e8aaa1a697,2023-10-17T21:28:26.585000Z,divine_comedian#0,63330f21144cdd9b89d11bff,0x826976d7C600d45FB8287CA1d7c76FC8eb732030,danidiabella#0,6334862c144cdd9b89d1bd1a,0x5D28FE1e9F895464aab52287d85Ebff32B351674,"for governance mastery, coding wizardry, and proactive ministry to write solutions that work when other tools fail to do so.",DISCORD:679428761438912522:762764762164887562,DISCORD:Giveth:%F0%9F%91%8D%E2%94%8Bgovernance,34,21,13,,,,false,false,false,almondoyealmond,0x0D22735DE6d34DC2ed5efDbC2f30D7Aa8e2B9F8e,nicbals,0xd9D5d85B2682830aC58A78c279E0C177953738b4,danibelle_the_uno_and_only,0x5D28FE1e9F895464aab52287d85Ebff32B351674,22.6666666666667
652f2ca9b58fa9e8aaa1da17,2023-10-18T00:54:01.278000Z,NicoBals#2154,6335aa8b8622e4e2bd1f134f,0xd9D5d85B2682830aC58A78c279E0C177953738b4,MAYE#1208,6405f62654231627779fd9fe,0xF41b98a4C32bB61468C8001E0C69Ef64ce6DEa57,For my onboarding and ansswering patiently all of my questions :),DISCORD:679428761438912522:823570903219568700,DISCORD:Giveth:%F0%9F%92%9C%E2%94%8Bpraise,13,13,8,,,,false,false,false,divine_comedian,0x826976d7C600d45FB8287CA1d7c76FC8eb732030,hanners717,0x711CDABCFdEDEf2c82D9dA533268D8bB6b7468f8,cuidadopeligro,0x8132505BAeDbAa7320b8F2340F65976Edc0e8fBc,11.3333333333333
652f2cf4b58fa9e8aaa1dadb,2023-10-18T00:55:16.085000Z,cotabe,63345e59144cdd9b89d1ab9e,0xe64113140960528f6AF928d7cA4f45d192286a7a,MAYE#1208,6405f62654231627779fd9fe,0xF41b98a4C32bB61468C8001E0C69Ef64ce6DEa57,"for thinking of me when trying to set up tasks tat noone else may have bandwith, I love being able to help and fill my hours into making Giveth a total success",DISCORD:679428761438912522:823570903219568700,DISCORD:Giveth:%F0%9F%92%9C%E2%94%8Bpraise,0,13,8,,,,true,false,false,divine_comedian,0x826976d7C600d45FB8287CA1d7c76FC8eb732030,hanners717,0x711CDABCFdEDEf2c82D9dA533268D8bB6b7468f8,cuidadopeligro,0x8132505BAeDbAa7320b8F2340F65976Edc0e8fBc,7
652f2d3db58fa9e8aaa1db9f,2023-10-18T00:56:29.397000Z,whyldwanderer#0,63332c97144cdd9b89d1295c,0xed8DB37778804A913670d9367aAf4F043AAd938b,MAYE#1208,6405f62654231627779fd9fe,0xF41b98a4C32bB61468C8001E0C69Ef64ce6DEa57,"For taking into account my ideas in the Community building call, it really make sme feel a part of the team!",DISCORD:679428761438912522:823570903219568700,DISCORD:Giveth:%F0%9F%92%9C%E2%94%8Bpraise,5,8,8,,,,false,false,false,divine_comedian,0x826976d7C600d45FB8287CA1d7c76FC8eb732030,hanners717,0x711CDABCFdEDEf2c82D9dA533268D8bB6b7468f8,cuidadopeligro,0x8132505BAeDbAa7320b8F2340F65976Edc0e8fBc,7
652f2d61b58fa9e8aaa1dc63,2023-10-18T00:57:05.887000Z,hanners717#0,6335b56e8622e4e2bd1f1bff,0x711CDABCFdEDEf2c82D9dA533268D8bB6b7468f8,MAYE#1208,6405f62654231627779fd9fe,0xF41b98a4C32bB61468C8001E0C69Ef64ce6DEa57,For my onboarding and taking time to answer all my qeusstions. The guidance and kind suggesstions makes a difference!,DISCORD:679428761438912522:823570903219568700,DISCORD:Giveth:%F0%9F%92%9C%E2%94%8Bpraise,8,5,5,,,,false,false,false,divine_comedian,0x826976d7C600d45FB8287CA1d7c76FC8eb732030,nicbals,0xd9D5d85B2682830aC58A78c279E0C177953738b4,danibelle_the_uno_and_only,0x5D28FE1e9F895464aab52287d85Ebff32B351674,6
652f2d9ab58fa9e8aaa1dd25,2023-10-18T00:58:02.840000Z,danidiabella#0,6334862c144cdd9b89d1bd1a,0x5D28FE1e9F895464aab52287d85Ebff32B351674,MAYE#1208,6405f62654231627779fd9fe,0xF41b98a4C32bB61468C8001E0C69Ef64ce6DEa57,"For making me part of the Devconnect organizing team, I really love doing this kind of work!! It's been really fun and enlighhtning",DISCORD:679428761438912522:823570903219568700,DISCORD:Giveth:%F0%9F%92%9C%E2%94%8Bpraise,5,8,8,,,,false,false,false,divine_comedian,0x826976d7C600d45FB8287CA1d7c76FC8eb732030,hanners717,0x711CDABCFdEDEf2c82D9dA533268D8bB6b7468f8,cuidadopeligro,0x8132505BAeDbAa7320b8F2340F65976Edc0e8fBc,7
652f2de1b58fa9e8aaa1ddeb,2023-10-18T00:59:13.096000Z,giantkin#0,63332451144cdd9b89d1258f,0xff75E131c711e4310C045317779d39B3B4f718C4,MAYE#1208,6405f62654231627779fd9fe,0xF41b98a4C32bB61468C8001E0C69Ef64ce6DEa57,For all the great help when setting up the TG and for being aleays pressent even when he feels like crap! hahaha It's great knowing he is such a team player,DISCORD:679428761438912522:823570903219568700,DISCORD:Giveth:%F0%9F%92%9C%E2%94%8Bpraise,13,13,21,,,,false,false,false,divine_comedian,0x826976d7C600d45FB8287CA1d7c76FC8eb732030,nicbals,0xd9D5d85B2682830aC58A78c279E0C177953738b4,cuidadopeligro,0x8132505BAeDbAa7320b8F2340F65976Edc0e8fBc,15.6666666666667
652f2e27b58fa9e8aaa1deae,2023-10-18T01:00:23.530000Z,griffgreen#0,633339fe144cdd9b89d12f30,0x839395e20bbB182fa440d08F850E6c7A8f6F0780,MAYE#1208,6405f62654231627779fd9fe,0xF41b98a4C32bB61468C8001E0C69Ef64ce6DEa57,For allowing us newbies to become part of the Istambul retreat thiss year by providing help with out  flight tickets and all the amazing week planned for us to gather and connect with each other!,DISCORD:679428761438912522:823570903219568700,DISCORD:Giveth:%F0%9F%92%9C%E2%94%8Bpraise,5,13,21,,,,false,false,false,divine_comedian,0x826976d7C600d45FB8287CA1d7c76FC8eb732030,hanners717,0x711CDABCFdEDEf2c82D9dA533268D8bB6b7468f8,cuidadopeligro,0x8132505BAeDbAa7320b8F2340F65976Edc0e8fBc,13
652f2e71b58fa9e8aaa1df6d,2023-10-18T01:01:37.449000Z,MAYE#1208,6405f62654231627779fd9fe,0xF41b98a4C32bB61468C8001E0C69Ef64ce6DEa57,MAYE#1208,6405f62654231627779fd9fe,0xF41b98a4C32bB61468C8001E0C69Ef64ce6DEa57,"Myself for being brave enough to participate and become a member of such an incredible org as Giveth, it really is a great strp towards my evolution and knowledge!",DISCORD:679428761438912522:823570903219568700,DISCORD:Giveth:%F0%9F%92%9C%E2%94%8Bpraise,1,8,13,,,,false,false,false,divine_comedian,0x826976d7C600d45FB8287CA1d7c76FC8eb732030,hanners717,0x711CDABCFdEDEf2c82D9dA533268D8bB6b7468f8,cuidadopeligro,0x8132505BAeDbAa7320b8F2340F65976Edc0e8fBc,7.33333333333333
652f2f88b58fa9e8aaa1e037,2023-10-18T01:06:16.946000Z,MAYE#1208,6405f62654231627779fd9fe,0xF41b98a4C32bB61468C8001E0C69Ef64ce6DEa57,danidiabella#0,6334862c144cdd9b89d1bd1a,0x5D28FE1e9F895464aab52287d85Ebff32B351674,"for jumping into the organizing tasks for GIVconnect to gatheri information to share, and then sharing it!",DISCORD:679428761438912522:823570903219568700,DISCORD:Giveth:%F0%9F%92%9C%E2%94%8Bpraise,8,13,21,,,,false,false,false,divine_comedian,0x826976d7C600d45FB8287CA1d7c76FC8eb732030,hanners717,0x711CDABCFdEDEf2c82D9dA533268D8bB6b7468f8,cuidadopeligro,0x8132505BAeDbAa7320b8F2340F65976Edc0e8fBc,14
652f4ea9b58fa9e8aaa1e6ed,2023-10-18T03:19:05.510000Z,cotabe,63345e59144cdd9b89d1ab9e,0xe64113140960528f6AF928d7cA4f45d192286a7a,freshelle,63345c87144cdd9b89d1aaae,0x38f80f8f76B1C44B2beeFB63bb561F570fb6ddB6,"for bringing in REVENUE through their services provided to General Magic last month. Your ability to manage multiple projects and remain flexible is commendable! Giveth earned a whoooping $14,298.99 for SEPTEMBER 2023. AMAZING! 🙌🏼",DISCORD:679428761438912522:762764762164887562,DISCORD:Giveth:%F0%9F%91%8D%E2%94%8Bgovernance,34,13,13,,,,false,false,false,divine_comedian,0x826976d7C600d45FB8287CA1d7c76FC8eb732030,hanners717,0x711CDABCFdEDEf2c82D9dA533268D8bB6b7468f8,cuidadopeligro,0x8132505BAeDbAa7320b8F2340F65976Edc0e8fBc,20
652f4ea9b58fa9e8aaa1e6ec,2023-10-18T03:19:05.510000Z,Amin#2164,63344aa8144cdd9b89d1a234,0xF23eA0b5F14afcbe532A1df273F7B233EBe41C78,freshelle,63345c87144cdd9b89d1aaae,0x38f80f8f76B1C44B2beeFB63bb561F570fb6ddB6,"for bringing in REVENUE through their services provided to General Magic last month. Your ability to manage multiple projects and remain flexible is commendable! Giveth earned a whoooping $14,298.99 for SEPTEMBER 2023. AMAZING! 🙌🏼",DISCORD:679428761438912522:762764762164887562,DISCORD:Giveth:%F0%9F%91%8D%E2%94%8Bgovernance,55,89,5,,,,false,false,false,divine_comedian,0x826976d7C600d45FB8287CA1d7c76FC8eb732030,nicbals,0xd9D5d85B2682830aC58A78c279E0C177953738b4,danibelle_the_uno_and_only,0x5D28FE1e9F895464aab52287d85Ebff32B351674,49.6666666666667
652f4ea9b58fa9e8aaa1e6f1,2023-10-18T03:19:05.511000Z,cuidadopeligro#0,6334448a144cdd9b89d19f4c,0x8132505BAeDbAa7320b8F2340F65976Edc0e8fBc,freshelle,63345c87144cdd9b89d1aaae,0x38f80f8f76B1C44B2beeFB63bb561F570fb6ddB6,"for bringing in REVENUE through their services provided to General Magic last month. Your ability to manage multiple projects and remain flexible is commendable! Giveth earned a whoooping $14,298.99 for SEPTEMBER 2023. AMAZING! 🙌🏼",DISCORD:679428761438912522:762764762164887562,DISCORD:Giveth:%F0%9F%91%8D%E2%94%8Bgovernance,8,13,0,,,,false,false,false,almondoyealmond,0x0D22735DE6d34DC2ed5efDbC2f30D7Aa8e2B9F8e,hanners717,0x711CDABCFdEDEf2c82D9dA533268D8bB6b7468f8,danibelle_the_uno_and_only,0x5D28FE1e9F895464aab52287d85Ebff32B351674,7
652f4ea9b58fa9e8aaa1e6ee,2023-10-18T03:19:05.511000Z,mateodazab#0,6335afb18622e4e2bd1f15cb,0x00d18ca9782bE1CaEF611017c2Fbc1a39779A57C,freshelle,63345c87144cdd9b89d1aaae,0x38f80f8f76B1C44B2beeFB63bb561F570fb6ddB6,"for bringing in REVENUE through their services provided to General Magic last month. Your ability to manage multiple projects and remain flexible is commendable! Giveth earned a whoooping $14,298.99 for SEPTEMBER 2023. AMAZING! 🙌🏼",DISCORD:679428761438912522:762764762164887562,DISCORD:Giveth:%F0%9F%91%8D%E2%94%8Bgovernance,8,89,21,,,,false,false,false,almondoyealmond,0x0D22735DE6d34DC2ed5efDbC2f30D7Aa8e2B9F8e,nicbals,0xd9D5d85B2682830aC58A78c279E0C177953738b4,cuidadopeligro,0x8132505BAeDbAa7320b8F2340F65976Edc0e8fBc,39.3333333333333
652f4ea9b58fa9e8aaa1e6f0,2023-10-18T03:19:05.511000Z,moenick,63335999144cdd9b89d13d4a,0xA4D506434445Bb7303eA34A07bc38484cdC64a95,freshelle,63345c87144cdd9b89d1aaae,0x38f80f8f76B1C44B2beeFB63bb561F570fb6ddB6,"for bringing in REVENUE through their services provided to General Magic last month. Your ability to manage multiple projects and remain flexible is commendable! Giveth earned a whoooping $14,298.99 for SEPTEMBER 2023. AMAZING! 🙌🏼",DISCORD:679428761438912522:762764762164887562,DISCORD:Giveth:%F0%9F%91%8D%E2%94%8Bgovernance,55,89,0,,,,false,false,false,divine_comedian,0x826976d7C600d45FB8287CA1d7c76FC8eb732030,nicbals,0xd9D5d85B2682830aC58A78c279E0C177953738b4,danibelle_the_uno_and_only,0x5D28FE1e9F895464aab52287d85Ebff32B351674,48
652f4ea9b58fa9e8aaa1e6ef,2023-10-18T03:19:05.511000Z,mosaeedi#0,633448af144cdd9b89d1a12f,0x17C8020dE84d4097b01387823f9D33Ff8E62577c,freshelle,63345c87144cdd9b89d1aaae,0x38f80f8f76B1C44B2beeFB63bb561F570fb6ddB6,"for bringing in REVENUE through their services provided to General Magic last month. Your ability to manage multiple projects and remain flexible is commendable! Giveth earned a whoooping $14,298.99 for SEPTEMBER 2023. AMAZING! 🙌🏼",DISCORD:679428761438912522:762764762164887562,DISCORD:Giveth:%F0%9F%91%8D%E2%94%8Bgovernance,55,89,21,,,,false,false,false,divine_comedian,0x826976d7C600d45FB8287CA1d7c76FC8eb732030,nicbals,0xd9D5d85B2682830aC58A78c279E0C177953738b4,cuidadopeligro,0x8132505BAeDbAa7320b8F2340F65976Edc0e8fBc,55
652f4ea9b58fa9e8aaa1e6f2,2023-10-18T03:19:05.511000Z,ramramez#0,63344d5e144cdd9b89d1a3ab,0x10a84b835C5df26f2A380B3E00bCC84A66cD2d34,freshelle,63345c87144cdd9b89d1aaae,0x38f80f8f76B1C44B2beeFB63bb561F570fb6ddB6,"for bringing in REVENUE through their services provided to General Magic last month. Your ability to manage multiple projects and remain flexible is commendable! Giveth earned a whoooping $14,298.99 for SEPTEMBER 2023. AMAZING! 🙌🏼",DISCORD:679428761438912522:762764762164887562,DISCORD:Giveth:%F0%9F%91%8D%E2%94%8Bgovernance,8,89,0,,,,false,false,false,almondoyealmond,0x0D22735DE6d34DC2ed5efDbC2f30D7Aa8e2B9F8e,nicbals,0xd9D5d85B2682830aC58A78c279E0C177953738b4,danibelle_the_uno_and_only,0x5D28FE1e9F895464aab52287d85Ebff32B351674,32.3333333333333
652f81afb58fa9e8aaa1f47f,2023-10-18T06:56:47.309000Z,MAYE#1208,6405f62654231627779fd9fe,0xF41b98a4C32bB61468C8001E0C69Ef64ce6DEa57,hanners717#0,6335b56e8622e4e2bd1f1bff,0x711CDABCFdEDEf2c82D9dA533268D8bB6b7468f8,"for really setting up to assist in planning DevConnect. I love all of the group messages, updates, and planning a Giveth off-site event at Dreamers unconference. Your star is shining so bright ⭐️",DISCORD:679428761438912522:823570903219568700,DISCORD:Giveth:%F0%9F%92%9C%E2%94%8Bpraise,13,13,0,,,652f2f88b58fa9e8aaa1e037,false,false,false,divine_comedian,0x826976d7C600d45FB8287CA1d7c76FC8eb732030,hanners717,0x711CDABCFdEDEf2c82D9dA533268D8bB6b7468f8,cuidadopeligro,0x8132505BAeDbAa7320b8F2340F65976Edc0e8fBc,8.66666666666667
652f8201b58fa9e8aaa1f546,2023-10-18T06:58:09.743000Z,rolazo,64d0d46e49fdcebef2bb8df5,0xd929F5975A58E086D76229Bdb384627408b38D96,hanners717#0,6335b56e8622e4e2bd1f1bff,0x711CDABCFdEDEf2c82D9dA533268D8bB6b7468f8,for our HR update call as you passed your trial period. So happy to have you on our team as an official contributor 🤗,DISCORD:679428761438912522:823570903219568700,DISCORD:Giveth:%F0%9F%92%9C%E2%94%8Bpraise,5,21,13,,,,false,false,false,almondoyealmond,0x0D22735DE6d34DC2ed5efDbC2f30D7Aa8e2B9F8e,nicbals,0xd9D5d85B2682830aC58A78c279E0C177953738b4,cuidadopeligro,0x8132505BAeDbAa7320b8F2340F65976Edc0e8fBc,13
652f885fb58fa9e8aaa1f71d,2023-10-18T07:25:19.838000Z,MAYE#1208,6405f62654231627779fd9fe,0xF41b98a4C32bB61468C8001E0C69Ef64ce6DEa57,hanners717#0,6335b56e8622e4e2bd1f1bff,0x711CDABCFdEDEf2c82D9dA533268D8bB6b7468f8,for being a supportive and proactive DevConnect planning team. I can leave on to my retreat knowing that everything and everyone is in safe hands. I love you all 🥹,DISCORD:679428761438912522:823570903219568700,DISCORD:Giveth:%F0%9F%92%9C%E2%94%8Bpraise,5,13,0,,,652f2f88b58fa9e8aaa1e037,false,false,false,divine_comedian,0x826976d7C600d45FB8287CA1d7c76FC8eb732030,hanners717,0x711CDABCFdEDEf2c82D9dA533268D8bB6b7468f8,cuidadopeligro,0x8132505BAeDbAa7320b8F2340F65976Edc0e8fBc,6
652f885fb58fa9e8aaa1f71e,2023-10-18T07:25:19.838000Z,missgene#0,6335b15e8622e4e2bd1f1712,0xbE6f56Ed9E10E5F58876F7bDF1C83EeDaa721fbc,hanners717#0,6335b56e8622e4e2bd1f1bff,0x711CDABCFdEDEf2c82D9dA533268D8bB6b7468f8,for being a supportive and proactive DevConnect planning team. I can leave on to my retreat knowing that everything and everyone is in safe hands. I love you all 🥹,DISCORD:679428761438912522:823570903219568700,DISCORD:Giveth:%F0%9F%92%9C%E2%94%8Bpraise,13,13,21,,,,false,false,false,almondoyealmond,0x0D22735DE6d34DC2ed5efDbC2f30D7Aa8e2B9F8e,hanners717,0x711CDABCFdEDEf2c82D9dA533268D8bB6b7468f8,cuidadopeligro,0x8132505BAeDbAa7320b8F2340F65976Edc0e8fBc,15.6666666666667
652f885fb58fa9e8aaa1f71f,2023-10-18T07:25:19.838000Z,danidiabella#0,6334862c144cdd9b89d1bd1a,0x5D28FE1e9F895464aab52287d85Ebff32B351674,hanners717#0,6335b56e8622e4e2bd1f1bff,0x711CDABCFdEDEf2c82D9dA533268D8bB6b7468f8,for being a supportive and proactive DevConnect planning team. I can leave on to my retreat knowing that everything and everyone is in safe hands. I love you all 🥹,DISCORD:679428761438912522:823570903219568700,DISCORD:Giveth:%F0%9F%92%9C%E2%94%8Bpraise,34,13,34,,,,false,false,false,divine_comedian,0x826976d7C600d45FB8287CA1d7c76FC8eb732030,hanners717,0x711CDABCFdEDEf2c82D9dA533268D8bB6b7468f8,cuidadopeligro,0x8132505BAeDbAa7320b8F2340F65976Edc0e8fBc,27
652f88b1b58fa9e8aaa1f7f7,2023-10-18T07:26:41.754000Z,griffgreen#0,633339fe144cdd9b89d12f30,0x839395e20bbB182fa440d08F850E6c7A8f6F0780,hanners717#0,6335b56e8622e4e2bd1f1bff,0x711CDABCFdEDEf2c82D9dA533268D8bB6b7468f8,for our insightful buddy call last week. I’m always growing with new challenges and insights. Thanks for being there for me.,DISCORD:679428761438912522:823570903219568700,DISCORD:Giveth:%F0%9F%92%9C%E2%94%8Bpraise,13,21,13,,,,false,false,false,divine_comedian,0x826976d7C600d45FB8287CA1d7c76FC8eb732030,hanners717,0x711CDABCFdEDEf2c82D9dA533268D8bB6b7468f8,cuidadopeligro,0x8132505BAeDbAa7320b8F2340F65976Edc0e8fBc,15.6666666666667
652f890fb58fa9e8aaa1f8bd,2023-10-18T07:28:15.946000Z,divine_comedian#0,63330f21144cdd9b89d11bff,0x826976d7C600d45FB8287CA1d7c76FC8eb732030,mohammad_ranjbar_z#0,6334498b144cdd9b89d1a1a2,0x2Ea846Dc38C6b6451909F1E7ff2bF613a96DC1F3,For providing EVM vote it was cool and easier than Aragon UI,DISCORD:679428761438912522:762764762164887562,DISCORD:Giveth:%F0%9F%91%8D%E2%94%8Bgovernance,89,8,3,,,,false,false,false,almondoyealmond,0x0D22735DE6d34DC2ed5efDbC2f30D7Aa8e2B9F8e,nicbals,0xd9D5d85B2682830aC58A78c279E0C177953738b4,danibelle_the_uno_and_only,0x5D28FE1e9F895464aab52287d85Ebff32B351674,33.3333333333333
652f94f0b58fa9e8aaa2060c,2023-10-18T08:18:56.726000Z,geleeroyale,63330ed2144cdd9b89d11bc7,0x701d0ECB3BA780De7b2b36789aEC4493A426010a,moeshehab#0,6335665be8278ae0cf33c8ff,0xd49B1e6F160F55d5Bb68a146269446D70B577faF,For checking GiVEconomy Issues late at night. Troubleshooting and finding bugs. During your sleeping hours. Thanks buddy :),DISCORD:679428761438912522:955413352224555069,DISCORD:Giveth:%F0%9F%A4%96%E2%94%8Bdevops,89,13,21,,,,false,false,false,divine_comedian,0x826976d7C600d45FB8287CA1d7c76FC8eb732030,nicbals,0xd9D5d85B2682830aC58A78c279E0C177953738b4,cuidadopeligro,0x8132505BAeDbAa7320b8F2340F65976Edc0e8fBc,41
652fa08ab58fa9e8aaa20a48,2023-10-18T09:08:26.695000Z,geleeroyale,63330ed2144cdd9b89d11bc7,0x701d0ECB3BA780De7b2b36789aEC4493A426010a,moenick,63335999144cdd9b89d13d4a,0xA4D506434445Bb7303eA34A07bc38484cdC64a95,"for being responsive when we have problems, troubleshooting and doing their best to keep our solutions alive!",DISCORD:679428761438912522:955413352224555069,DISCORD:Giveth:%F0%9F%A4%96%E2%94%8Bdevops,13,13,0,,,652f94f0b58fa9e8aaa2060c,false,false,false,divine_comedian,0x826976d7C600d45FB8287CA1d7c76FC8eb732030,nicbals,0xd9D5d85B2682830aC58A78c279E0C177953738b4,cuidadopeligro,0x8132505BAeDbAa7320b8F2340F65976Edc0e8fBc,8.66666666666667
652fa08ab58fa9e8aaa20a49,2023-10-18T09:08:26.695000Z,moeshehab#0,6335665be8278ae0cf33c8ff,0xd49B1e6F160F55d5Bb68a146269446D70B577faF,moenick,63335999144cdd9b89d13d4a,0xA4D506434445Bb7303eA34A07bc38484cdC64a95,"for being responsive when we have problems, troubleshooting and doing their best to keep our solutions alive!",DISCORD:679428761438912522:955413352224555069,DISCORD:Giveth:%F0%9F%A4%96%E2%94%8Bdevops,13,8,13,,,,false,false,false,almondoyealmond,0x0D22735DE6d34DC2ed5efDbC2f30D7Aa8e2B9F8e,nicbals,0xd9D5d85B2682830aC58A78c279E0C177953738b4,cuidadopeligro,0x8132505BAeDbAa7320b8F2340F65976Edc0e8fBc,11.3333333333333
652fff5eb58fa9e8aaa25e74,2023-10-18T15:53:02.145000Z,danidiabella#0,6334862c144cdd9b89d1bd1a,0x5D28FE1e9F895464aab52287d85Ebff32B351674,missgene#0,6335b15e8622e4e2bd1f1712,0xbE6f56Ed9E10E5F58876F7bDF1C83EeDaa721fbc,"for all the new updates for Giveth Pretreat and DevConnect 2023, as well as in discussing the items in the agenda for the DevCon call thoroughly! Thank you for all your efforts.",DISCORD:679428761438912522:823570903219568700,DISCORD:Giveth:%F0%9F%92%9C%E2%94%8Bpraise,55,13,89,,,,false,false,false,divine_comedian,0x826976d7C600d45FB8287CA1d7c76FC8eb732030,hanners717,0x711CDABCFdEDEf2c82D9dA533268D8bB6b7468f8,cuidadopeligro,0x8132505BAeDbAa7320b8F2340F65976Edc0e8fBc,52.3333333333333
652fff84b58fa9e8aaa25f37,2023-10-18T15:53:40.806000Z,NicoBals#2154,6335aa8b8622e4e2bd1f134f,0xd9D5d85B2682830aC58A78c279E0C177953738b4,missgene#0,6335b15e8622e4e2bd1f1712,0xbE6f56Ed9E10E5F58876F7bDF1C83EeDaa721fbc,for reminding everyone of the DevConnect call today and sharing the link of the unicorn channel.,DISCORD:679428761438912522:823570903219568700,DISCORD:Giveth:%F0%9F%92%9C%E2%94%8Bpraise,5,13,8,,,,false,false,false,divine_comedian,0x826976d7C600d45FB8287CA1d7c76FC8eb732030,hanners717,0x711CDABCFdEDEf2c82D9dA533268D8bB6b7468f8,cuidadopeligro,0x8132505BAeDbAa7320b8F2340F65976Edc0e8fBc,8.66666666666667
652ffffdb58fa9e8aaa25ff9,2023-10-18T15:55:41.285000Z,cotabe,63345e59144cdd9b89d1ab9e,0xe64113140960528f6AF928d7cA4f45d192286a7a,missgene#0,6335b15e8622e4e2bd1f1712,0xbE6f56Ed9E10E5F58876F7bDF1C83EeDaa721fbc,for finishing some of the Octant-related outreach tasks!,DISCORD:679428761438912522:823570903219568700,DISCORD:Giveth:%F0%9F%92%9C%E2%94%8Bpraise,13,8,13,,,,false,false,false,divine_comedian,0x826976d7C600d45FB8287CA1d7c76FC8eb732030,hanners717,0x711CDABCFdEDEf2c82D9dA533268D8bB6b7468f8,cuidadopeligro,0x8132505BAeDbAa7320b8F2340F65976Edc0e8fBc,11.3333333333333
