,index,ID,DATE,TO USER ACCOUNT,FROM USER ACCOUNT,REASON,DISMISSED 1,DISMISSED 2,DISMISSED 3,QUANTIFIER 1 USERNAME,QUANTIFIER 2 USERNAME,QUANTIFIER 3 USERNAME,AVG SCORE,MAX SCORE,DISMISSAL AGREED,ORIGINAL MSG
23,217,6765df656e973bde5ecb28fe,2024-12-20T21:19:33.281000Z,ae2079,hanners717#0,"for always sending me candidate referrals! Your help makes the hiring process so much easier and you know so many extraordinary people, I wish we could hire them all!",False,False,True,freshelle,cherrywiner,ramin,25.3333333333333,55,False,"for always sending me candidate referrals! Your help makes the hiring process so much easier and you know so many extraordinary people, I wish we could hire them all!"
84,227,6767e218cb8b3ef5d8a3a9eb,2024-12-22T09:55:36.726000Z,zeptimusq#0,Maryjaf#2478,for working hard on pairwise project to deliver product with high quality,True,False,False,freshelle,nicbals,whyldwanderer,15.6666666666667,34,False,for working hard on pairwise project to deliver product with high quality
85,98,67567f085a2363a973c3d495,2024-12-09T05:24:24.277000Z,ae2079,greenbee9327,for making consistent progress on QACC arb bot along with Qacc webapp bugs,False,False,True,freshelle,cherrywiner,ramin,18.3333333333333,34,False,for making consistent progress on QACC arb bot along with Qacc webapp bugs
90,90,6752fed65741f6b27563c340,2024-12-06T13:40:38.133000Z,ae2079,karmaticacid#0,for joining the q/acc launch testing party to make sure that the product is bug free and smooth before we announced publicy and opened the flood gates,False,False,True,freshelle,cherrywiner,ramin,18.3333333333333,34,False,for joining the q/acc launch testing party to make sure that the product is bug free and smooth before we announced publicy and opened the flood gates
96,73,6752fd8b5741f6b27563ba43,2024-12-06T13:35:07.210000Z,ae2079,karmaticacid#0,"for fantastic collaboration on q/acc devleopment, burning the midnight oil working extra time and even time on the weekends to make last minute changes and get everything working smooth",False,False,True,freshelle,cherrywiner,ramin,22.6666666666667,34,False,"for fantastic collaboration on q/acc devleopment, burning the midnight oil working extra time and even time on the weekends to make last minute changes and get everything working smooth"
151,176,6764383b8d35b0a9e270e894,2024-12-19T15:14:03.310000Z,ae2079,Amin#2164,for their great work on qacc,False,False,True,freshelle,cherrywiner,ramin,9.66666666666667,21,False,for their great work on qacc
152,30,675076292fbdf51a3f86ebcc,2024-12-04T15:32:57.219000Z,forestkeeperio,NicoBals#2154,for joining our first ever MGFA event!!! It was so fun hanging out with you guys in the call!!! Hope to see you guys again!!! ❤️,True,False,False,divine_comedian,nicbals,whyldwanderer,11.3333333333333,21,False,for joining our first ever MGFA event!!! It was so fun hanging out with you guys in the call!!! Hope to see you guys again!!! ❤️
224,231,6767e218cb8b3ef5d8a3a9ee,2024-12-22T09:55:36.727000Z,skayaz,Maryjaf#2478,for working hard on pairwise project to deliver product with high quality,True,False,False,freshelle,cherrywiner,ramin,6.0,13,False,for working hard on pairwise project to deliver product with high quality
