index,ID,DATE,TO USER ACCOUNT,FROM USER ACCOUNT,REASON,SCORE 1,SCORE 2,SCORE 3,DUPLICATE ID 1,DUPLICATE ID 2,DUPLICATE ID 3,DISMISSED 1,DISMISSED 2,DISMISSED 3,QUANTIFIER 1 USERNAME,QUANTIFIER 2 USERNAME,QUANTIFIER 3 USERNAME,AVG SCORE,SPREAD
439,66343db95a2df19a78401805,2024-05-03T01:28:25.056000Z,divine_comedian#0,greenbee9327,"for your patience and understanding as the team debugged and fixed performance issues. Thanks for dropping by , checking in on the status and communicating the delay caused by technical issues to the users.",21.0,8,89,,,,False,False,False,nikola_creatrix,whyldwanderer,almondoyealmond,39.3333333333333,81.0
1040,666865e8ff1f4b2e6e4b731a,2024-06-11T14:57:44.839000Z,divine_comedian#0,nikolacreatrix#0,"for amazing work on DeVouch attestations! Love seeing the development of the app, excited to start using and experimenting!!! This is gonna be pretty major for us to have in the future, thanks for pioneering this!!!🎉",8.0,13,89,,66670d5eff1f4b2e6e4abf4a,,False,False,False,nikola_creatrix,whyldwanderer,almondoyealmond,32.3333333333333,81.0
435,663437395a2df19a78401186,2024-05-03T01:00:41.625000Z,rolazo,greenbee9327,for implementing statement timeouts for improving performance 👏🏻👏🏻,89.0,8,8,663435bb5a2df19a78400ee6,,,False,False,False,divine_comedian,cherrywiner,paslar,5.33333333333333,81.0
977,6661af5fff1f4b2e6e48218e,2024-06-06T12:45:19.765000Z,divine_comedian#0,snakey_jakey.,"for helping me to finish up the CELO KYC from April 2023... ""some things are worth the wait"" or something like that",8.0,13,89,,,,False,False,False,nikola_creatrix,whyldwanderer,almondoyealmond,36.6666666666667,81.0
497,6639da035a2df19a78440527,2024-05-07T07:36:35.147000Z,divine_comedian#0,snakey_jakey.,for all their amazing speed and hard work to get the dApp up and running this past weekend.  Just brilliant work and you are all the superhero's of Giveth,8.0,8,89,,,,False,False,False,nikola_creatrix,whyldwanderer,almondoyealmond,35.0,81.0
728,6648d6979a2014b939422133,2024-05-18T16:25:59.325000Z,_cherik#0,greenbee9327,"for escalating and resolving production issues during the weekend with braindtorming as a team, quick decisions and actions 👏🏻",55.0,8,89,6639da035a2df19a7844052c,,,False,False,False,chuygarcia.eth,forestkeeperio,koday.eth,32.3333333333333,81.0
212,66271793d769970d09858e91,2024-04-23T02:06:11.427000Z,carlos096,rolazo,for being an awesome teammate and solve the problem regardles to the database slow issue :D,89.0,55,8,,,,False,False,False,divine_comedian,juan_work,mateodaza,50.6666666666667,81.0
713,6645c1ff9a2014b93940a6fc,2024-05-16T08:21:19.937000Z,_cherik#0,kkechy#2713,for great mentorship and fast answer with guidelines ;),8.0,13,89,663ce3465a2df19a784730e1,,,False,False,False,chuygarcia.eth,forestkeeperio,koday.eth,34.0,81.0
674,66421a149a2014b9393df170,2024-05-13T13:48:04.869000Z,divine_comedian#0,snakey_jakey.,for finding time and being the final reviewers for all the weekly fundraising grants we are putting together and submitting. Really appreciate your eyes and thoughts on each one,8.0,13,89,,,,False,False,False,nikola_creatrix,whyldwanderer,almondoyealmond,36.6666666666667,81.0
717,664647389a2014b93940e8be,2024-05-16T17:49:44.131000Z,whyldwanderer#0,koday.eth,For being the mastermind behind tracking GIVbacks and coming up with creative solutions for problems we run into!,13.0,8,89,,,,False,False,False,missgene,cherrywiner,paslar,36.6666666666667,81.0
1156,66797a564ed52c91f5a71b9a,2024-06-24T13:53:26.689000Z,mohammad_ranjbar_z,greenbee9327,for integrating and releasing zkevm in such short timeline 👏🏻👏🏻,89.0,8,21,,,,False,False,False,chuygarcia.eth,nicbals,mateodaza,39.3333333333333,81.0
177,661e7687641e997eec4ff134,2024-04-16T13:00:55.028000Z,divine_comedian#0,snakey_jakey.,for coming back with some fire and pushing out the hot topics for the DApp this week. I wasn't at the meeting yesterday but saw the items that needed stearing,8.0,8,89,,,,False,False,False,nikola_creatrix,whyldwanderer,almondoyealmond,35.0,81.0
823,664e10279a2014b93945ffd8,2024-05-22T15:32:55.940000Z,whyldwanderer#0,karmaticacid#0,for putting together a LOVELY list of environment projects that we can pass to sponsors can get their recommendations around,8.0,13,89,,,,False,False,False,missgene,cherrywiner,paslar,36.6666666666667,81.0
1200,667d83eb4ed52c91f5a978e3,2024-06-27T15:23:23.558000Z,divine_comedian#0,wmb81321,His support on signing Agrrement and KYB process with Market Makert for LBank USDT/GIV: Skynet Trading are new partners,8.0,8,89,,,,False,False,False,nikola_creatrix,whyldwanderer,almondoyealmond,35.0,81.0
1151,6675e39a4ed52c91f5a56d0b,2024-06-21T20:33:30.629000Z,divine_comedian#0,karmaticacid#0,for major support on the giveconomy WG proposal helping me walk through each of the proposed time estimates & costs & figure out a projection!,8.0,21,89,,,,False,False,False,nikola_creatrix,whyldwanderer,almondoyealmond,39.3333333333333,81.0
1175,667d7d124ed52c91f5a9545f,2024-06-27T14:54:10.070000Z,divine_comedian#0,greenbee9327,for taking time to experiemnt with GitHub project as an alternative to zenhub and offering to onboard everyone,8.0,13,89,,,,False,False,False,nikola_creatrix,whyldwanderer,almondoyealmond,36.6666666666667,81.0
652,6641be979a2014b9393d83a8,2024-05-13T07:17:43.478000Z,_cherik#0,kkechy#2713,for all help in development and introducing FE code for me ;),8.0,8,89,663ce3465a2df19a784730e1,,,False,False,False,chuygarcia.eth,forestkeeperio,koday.eth,32.3333333333333,81.0
93,6617071c641e997eec4a4320,2024-04-10T21:39:40.350000Z,giantkin#0,oyealmond#0,"for giving me great advice on the Rose (Telegram ) bot explaining me everything I ask, and help me with commands.",13.0,8,89,,,,False,False,False,nikola_creatrix,forestkeeperio,steffansteetweets9260,36.6666666666667,81.0
319,662a76e7d769970d09890800,2024-04-25T15:29:43.931000Z,_cherik#0,divine_comedian#0,for their dedicated work and meeting with me so often to kick-start the back-end development of DeVouch,34.0,8,89,,,,False,False,False,chuygarcia.eth,forestkeeperio,koday.eth,43.6666666666667,81.0
857,6655baff9a2014b9394995ee,2024-05-28T11:07:43.033000Z,_cherik#0,greenbee9327,for finishing the big ticket items in DeVouch and sharing the demo link.,34.0,13,89,662a76e7d769970d09890800,,,False,False,False,chuygarcia.eth,forestkeeperio,koday.eth,34.0,76.0
1058,666cb578ff1f4b2e6e4dba75,2024-06-14T21:26:16.875000Z,_cherik#0,divine_comedian#0,"for doing a ton of development and testing on DeVouch, we had a very successful launch and they followed up great with many post MVP issues to get the product looking VERY polished",55.0,13,89,6660dab0ff1f4b2e6e47ca16,,,False,False,False,chuygarcia.eth,forestkeeperio,koday.eth,34.0,76.0
1153,667967f64ed52c91f5a70797,2024-06-24T12:35:02.819000Z,_cherik#0,greenbee9327,for resolving conflicts and unblocking zkevm release,21.0,13,89,,,,False,False,False,chuygarcia.eth,forestkeeperio,koday.eth,41.0,76.0
77,6615547b641e997eec48cde3,2024-04-09T14:45:15.086000Z,greenbee9327,snakey_jakey.,for continuing to bring what is really needed to her Dev circle. She is doing a killer job with the team management and its been a real joy to have that skill in our galaxy,89.0,21,13,,,,False,False,False,nikola_creatrix,cherrywiner,paslar,41.0,76.0
1042,666865e8ff1f4b2e6e4b731c,2024-06-11T14:57:44.839000Z,_cherik#0,nikolacreatrix#0,"for amazing work on DeVouch attestations! Love seeing the development of the app, excited to start using and experimenting!!! This is gonna be pretty major for us to have in the future, thanks for pioneering this!!!🎉",55.0,13,89,6660dab0ff1f4b2e6e47ca16,,,False,False,False,chuygarcia.eth,forestkeeperio,koday.eth,34.0,76.0
544,663a60165a2df19a78449815,2024-05-07T17:08:38.870000Z,ramramez#0,greenbee9327,for troubleshooting broken verification service as a truly distributed yet well coordinated team ; then deploying possible solution and fixing verification service in prod 👍🏻,21.0,89,13,,,,False,False,False,hanners717,juan_work,mateodaza,41.0,76.0
1033,66670da7ff1f4b2e6e4ac06d,2024-06-10T14:28:55.548000Z,bmeriem,greenbee9327,for debugging and shipping so many QF fixes back to back along with new model changes 👏🏻👏🏻,13.0,21,89,,66605e1eff1f4b2e6e478d19,,False,False,False,missgene,whyldwanderer,steffansteetweets9260,34.0,76.0
1030,66670d5eff1f4b2e6e4abf4c,2024-06-10T14:27:42.613000Z,_cherik#0,greenbee9327,for getting deVouch released in time and coordinating so well 🙌,55.0,13,89,6660dab0ff1f4b2e6e47ca16,,,False,False,False,chuygarcia.eth,forestkeeperio,koday.eth,34.0,76.0
365,662fbbe5d769970d098d1e3d,2024-04-29T15:25:25.724000Z,divine_comedian#0,nikolacreatrix#0,"for getting out the last vesting! You have done an excellent job getting out the vesting benefits to us contributors consistently and timely and I see a great value provided to the community throughout the time! Thanks, Mitch 🫶",13.0,34,89,,,,False,False,False,nikola_creatrix,whyldwanderer,almondoyealmond,45.3333333333333,76.0
282,662904a5d769970d0987d13b,2024-04-24T13:09:57.319000Z,Amin#2164,_cherik#0,for helping me start working with subsquid and run project,13.0,89,34,,,,False,False,False,karmaticacid,juan_work,freshelle,45.3333333333333,76.0
1162,667989544ed52c91f5a728b2,2024-06-24T14:57:24.989000Z,mohammad_ranjbar_z,divine_comedian#0,for their great work in finishing the polygon zkEVM integration feature right on time! Great work on another chain integration,89.0,21,13,66797a564ed52c91f5a71b9a,,,False,False,False,chuygarcia.eth,nicbals,mateodaza,11.3333333333333,76.0
944,665f3019ff1f4b2e6e46fb5a,2024-06-04T15:17:45.094000Z,_cherik#0,moenick,for their help on branch management and merging / conflict removal for Base Integration.,34.0,13,89,,,,False,False,False,chuygarcia.eth,forestkeeperio,koday.eth,45.3333333333333,76.0
909,665dc22eff1f4b2e6e463631,2024-06-03T13:16:30.484000Z,_cherik#0,greenbee9327,for progressing on deVouch and coordinating together for finishing by June 6,34.0,13,89,662a76e7d769970d09890800,,,False,False,False,chuygarcia.eth,forestkeeperio,koday.eth,34.0,76.0
248,662799edd769970d09866d2f,2024-04-23T11:22:21.441000Z,_cherik#0,greenbee9327,"for back to back fixes in Frontend for Superfluid and QF. Despite the speedy fixes, there is not compromise in the code quality and he ensures to use the best JS constructs available to optimise the code.",21.0,13,89,66124196dc75ca6645c2ac7c,,,False,False,False,chuygarcia.eth,forestkeeperio,koday.eth,34.0,76.0
250,66279af5d769970d09867044,2024-04-23T11:26:45.846000Z,ramramez#0,greenbee9327,"for jumping on to high priority issues and being flexible working on both frontend and backend as the need arises. At momemnts he has also worked across time zones, which shows his grit and dedication for Giveth. Its amazing to see him share PR after PR on tangentials features 👏🏻",21.0,89,13,,,,False,False,False,hanners717,juan_work,mateodaza,41.0,76.0
722,66487dd89a2014b93941f777,2024-05-18T10:07:20.849000Z,_cherik#0,griffgreen#0,for being responsive on a saturday for 500 errors ont e website,55.0,13,89,6639da035a2df19a7844052c,,,False,False,False,chuygarcia.eth,forestkeeperio,koday.eth,34.0,76.0
571,663b30ac5a2df19a784562ed,2024-05-08T07:58:36.997000Z,divine_comedian#0,snakey_jakey.,"for the amazing comms around the dApp latency issues and getting them resolved. As a man of proactive updates / comms, it brings a single tear to my eye",21.0,13,89,663a9d5e5a2df19a7844fa1e,663a9d5e5a2df19a7844fa1e,,False,False,False,nikola_creatrix,whyldwanderer,almondoyealmond,29.6666666666667,76.0
916,665dc7f2ff1f4b2e6e464216,2024-06-03T13:41:06.344000Z,_cherik#0,Amin#2164,for implementing project fetching from multiple sourced in devouch backend,34.0,13,89,662a76e7d769970d09890800,,,False,False,False,chuygarcia.eth,forestkeeperio,koday.eth,34.0,76.0
744,664b40d49a2014b939435d5d,2024-05-20T12:23:48.093000Z,rodricast#0,snakey_jakey.,"for taking every little QForcer doc tweak and update we suggest and jumping right on it, as well as I needed some MS word background template and boom it was done in seconds. LEGEND",34.0,13,89,662756d0d769970d09862693,66354de65a2df19a7840e257,,False,False,False,karmaticacid,whyldwanderer,almondoyealmond,29.6666666666667,76.0
855,66543db69a2014b93948d664,2024-05-27T08:00:54.633000Z,mohammad_ranjbar_z,greenbee9327,for supporting the team during last 2 weeks on production issues on FE and BE respectively. They have also passed on summary of oncall issues during this time to next oncalls. Thanks for your active presence and support 👏,21.0,89,13,6644da909a2014b939401ad5,,,False,False,False,chuygarcia.eth,nicbals,mateodaza,34.0,76.0
569,663a9d5e5a2df19a7844fa1e,2024-05-07T21:30:06.046000Z,divine_comedian#0,karmaticacid#0,for providing daily updates about the dapp issues we are solving to keep everyone in the loop. I am personally SO GRATEFUL for these updates as they help me then lead and direct so many things trickling down,21.0,13,89,,,,False,False,False,nikola_creatrix,whyldwanderer,almondoyealmond,41.0,76.0
117,6617fedb641e997eec4b0c50,2024-04-11T15:16:43.272000Z,_cherik#0,greenbee9327,"for presenting demos of Superfluid, Dune Dasboard and Unicorn Account Abstracted Wallet ✨",21.0,13,89,66124196dc75ca6645c2ac7c,,,False,False,False,chuygarcia.eth,forestkeeperio,koday.eth,34.0,76.0
324,662a7c51d769970d098910b9,2024-04-25T15:52:49.591000Z,_cherik#0,greenbee9327,"for debugging, following up and fixing supefluid downgrade eth issue. 👏🏻👏🏻",21.0,13,89,66124196dc75ca6645c2ac7c,,,False,False,False,chuygarcia.eth,forestkeeperio,koday.eth,34.0,76.0
616,663ddc235a2df19a78481207,2024-05-10T08:34:43.752000Z,oyealmond#0,griffgreen#0,"For taking on Comms lead and all the horrible bureacracy that comes with it. Not only are you such a fantastic executor, you also handle the responsibilities of managing contributors very well... the good, the bad and the ugly. Thank you!",89.0,13,55,,,,False,False,False,karmaticacid,cherrywiner,freshelle,52.3333333333333,76.0
963,6660da7aff1f4b2e6e47c915,2024-06-05T21:36:58.596000Z,mateodazab#0,divine_comedian#0,"for their work this week on getting DeVouch closer and closer to the finish line, their work developing and testing this new product has been very dedicated and we'll hopefully be launching very soon!",55.0,13,89,,,,False,False,False,divine_comedian,whyldwanderer,freshelle,52.3333333333333,76.0
53,6613ba8b641e997eec476938,2024-04-08T09:36:11.416000Z,moenick,greenbee9327,for operating the Superfluid war room on Sunday and preparing the release further.,89.0,21,13,660d99b4dc75ca6645bf2d99,,,False,False,False,divine_comedian,forestkeeperio,paslar,11.3333333333333,76.0
353,662f41d3d769970d098cc7b2,2024-04-29T06:44:35.984000Z,divine_comedian#0,snakey_jakey.,for starting to deep dive into a BASE integration this week. Can't wait to see BASE on Giveth and then get some retroactive funding for it 🤣 <:GIVETH:923641348798693416>,13.0,21,89,,,,False,False,False,nikola_creatrix,whyldwanderer,almondoyealmond,41.0,76.0
25,660d4b79dc75ca6645bef169,2024-04-03T12:28:41.660000Z,geleeroyale,freshelle,for their hard work and collaboration on making buddy bot happen. I received my first notification today about giving a feedback to someone!! 🤩 So happy to see this live and really looking forward to future iterations and automating buddy review sessions more. The current implementation is already a great accomplishment! 🙌🏽🌟,21.0,13,89,,,,False,False,False,karmaticacid,forestkeeperio,almondoyealmond,41.0,76.0
137,6619b54c641e997eec4c7c7c,2024-04-12T22:27:24.735000Z,rodricast#0,karmaticacid#0,"for all his work on quick, beautiful & super informed designs! he is incredible at taking some random ideas thrown together and turning them into art that is super on brand!",13.0,34,89,,,,False,False,False,karmaticacid,whyldwanderer,almondoyealmond,45.3333333333333,76.0
49,661241e8dc75ca6645c2af2a,2024-04-07T06:49:12.206000Z,moenick,mohammad_ranjbar_z,For taking responsibility of coordinating superfluid in absence of Mitch,89.0,21,13,660d99b4dc75ca6645bf2d99,,,False,False,False,divine_comedian,forestkeeperio,paslar,11.3333333333333,76.0
725,6648d5ef9a2014b939421fcb,2024-05-18T16:23:11.809000Z,_cherik#0,greenbee9327,for his availability and supporting production issues so well during his first oncall week 👏🏻,13.0,13,89,,,,False,False,False,chuygarcia.eth,forestkeeperio,koday.eth,38.3333333333333,76.0
1170,667ad1d24ed52c91f5a7e5ed,2024-06-25T14:18:58.330000Z,mohammad_ranjbar_z,moenick,for doing both backend and frontend of zkEVM integration. All the credits is for him!,89.0,13,21,66797a564ed52c91f5a71b9a,,,False,False,False,chuygarcia.eth,nicbals,mateodaza,11.3333333333333,76.0
422,6633ec755a2df19a783fd13a,2024-05-02T19:41:41.937000Z,geleeroyale,griffgreen#0,for emergency response work DEEP into their evening to get Giveth going for the QF round.,34.0,13,89,,,,False,False,False,karmaticacid,forestkeeperio,almondoyealmond,45.3333333333333,76.0
540,6639de655a2df19a78441ec2,2024-05-07T07:55:17.844000Z,freshelle,snakey_jakey.,for her super helpful back n forth over the month. Everything she provides is always in a super nice and respectful manner. Always looking out for me and ensuring comms is always on point. We are extremely lucky to have her running point on any of her MANY items,13.0,21,89,,,,False,False,False,nikola_creatrix,forestkeeperio,mateodaza,41.0,76.0
352,662f41a6d769970d098cc6bf,2024-04-29T06:43:50.742000Z,markop#2007,snakey_jakey.,for being my BS knowledge bomb. Cant wait to crush the event with the help of your continued support. Lets see some Biz Dev & Fundraising successes that week,34.0,13,89,,,,False,False,False,chuygarcia.eth,forestkeeperio,steffansteetweets9260,45.3333333333333,76.0
234,66275669d769970d0986224d,2024-04-23T06:34:17.818000Z,giantkin#0,snakey_jakey.,"for ensuring I am set up on ALL the, what seems like millions, of multisig bot items. You're amazing with how thorough and accurate you want to be with items like that",13.0,21,89,,,,False,False,False,nikola_creatrix,forestkeeperio,steffansteetweets9260,41.0,76.0
294,66297067d769970d098821da,2024-04-24T20:49:43.097000Z,wmb81321,karmaticacid#0,"for absolutely incredible work tracking the GIV token liquity, auditing how GIV appears accross various DEXs, submitting an update request to coin gecko over and over and just being a madly independent self starter making tons of value adds to the GIVeconomy - so excited to have you on the team!",55.0,13,89,,,,False,False,False,divine_comedian,forestkeeperio,steffansteetweets9260,52.3333333333333,76.0
964,6660da7aff1f4b2e6e47c914,2024-06-05T21:36:58.596000Z,_cherik#0,divine_comedian#0,"for their work this week on getting DeVouch closer and closer to the finish line, their work developing and testing this new product has been very dedicated and we'll hopefully be launching very soon!",34.0,21,89,662a76e7d769970d09890800,,,False,False,False,chuygarcia.eth,forestkeeperio,koday.eth,36.6666666666667,68.0
122,66195b19641e997eec4c1724,2024-04-12T16:02:33.199000Z,divine_comedian#0,nikolacreatrix#0,"for producing very meaningful, and inspirational GIVtalk space. I found it very interesting, great information sharing flow from Anna, amazing insights into other orgs and challenges they face. Great perspectives shared and very resourceful for giveth project owners!!! Super valuable space you held that's so important for Giveth! Rockstars",21.0,89,89,,,,False,False,False,nikola_creatrix,whyldwanderer,almondoyealmond,66.3333333333333,68.0
449,6634fd1a5a2df19a7840a867,2024-05-03T15:04:58.403000Z,mateodazab#0,karmaticacid#0,"for working tirelessly to solve the crazy latency & 404 issues we had yesterday with the dapp. you guys stayed up soo late and worked so hard to get things up and running as quickly as possible, and this is HUGE effort annd makes a big difference for all our projects & donors - thank you!",34.0,21,89,,,,False,False,False,divine_comedian,whyldwanderer,freshelle,48.0,68.0
470,6635094a5a2df19a7840b8de,2024-05-03T15:56:58.731000Z,snakey_jakey.,divine_comedian#0,"for raising the alarm bell and sending tons of DMs in response to the octant whale's pushing Giveth out of the round, his quick response managed to get us back into the qualifying range and salvaged a cool 13 ETH to get sent to Giveth",34.0,21,89,,,,False,False,False,chuygarcia.eth,cherrywiner,steffansteetweets9260,48.0,68.0
381,66324602d769970d098f60f0,2024-05-01T13:39:14.377000Z,mohammad_ranjbar_z,greenbee9327,for debugging and monitoring logs for identifying latency issues of Giveth. Later they coordinated and tested newly implemented connection pooling and additional perf issues which are being looked at now. Appreciate their prompt action !!,34.0,89,21,,,,False,False,False,chuygarcia.eth,nicbals,mateodaza,48.0,68.0
279,6628fa85d769970d0987c7f5,2024-04-24T12:26:45.708000Z,_cherik#0,greenbee9327,"for syncing up to estimate timelines while thinking through the tasks in the predictable scope and adding date of completion for each of the development, deployment and QA tasks.",21.0,21,89,,,,False,False,False,chuygarcia.eth,forestkeeperio,koday.eth,43.6666666666667,68.0
401,66329ee55a2df19a783e1f39,2024-05-01T19:58:29.928000Z,mohammad_ranjbar_z,hanners717#0,for doing so many peer technical interviews with living coding. I appreciate your gentle emails when you meet new candidates and your notes aftwards. All of this hard work will help us find a new fullstack dev!,21.0,89,21,,,,False,False,False,chuygarcia.eth,nicbals,mateodaza,43.6666666666667,68.0
965,6660dab0ff1f4b2e6e47ca16,2024-06-05T21:37:52.412000Z,_cherik#0,divine_comedian#0,"special praise for going above and beyond with extreme dedication to developing the devouch FE, he's put in 100's of hours into this project and he is working long and hard on developing the front-end and back-end",55.0,21,89,,,,False,False,False,chuygarcia.eth,forestkeeperio,koday.eth,55.0,68.0
284,66292a97d769970d0987eb11,2024-04-24T15:51:51.823000Z,Amin#2164,karmaticacid#0,for walking me through setting up the notify reward bots to extend GIVpower rewards another 6 months!,21.0,89,34,,,,False,False,False,karmaticacid,juan_work,freshelle,48.0,68.0
631,663e66de5a2df19a78489375,2024-05-10T18:26:38.971000Z,snakey_jakey.,griffgreen#0,"For the fantastic work coordinating with sponsors for the Galactic Giving round and making sure they feel the love. I was really worried about it cause i put my personal relationships on the line bringing these sponsors in, and I think they all would speak wonders about this experience! I am excited to see if we have repeat sponsors :-D",89.0,21,34,,,,False,False,False,chuygarcia.eth,cherrywiner,steffansteetweets9260,48.0,68.0
452,6634fd1a5a2df19a7840a864,2024-05-03T15:04:58.403000Z,geleeroyale,karmaticacid#0,"for working tirelessly to solve the crazy latency & 404 issues we had yesterday with the dapp. you guys stayed up soo late and worked so hard to get things up and running as quickly as possible, and this is HUGE effort annd makes a big difference for all our projects & donors - thank you!",34.0,34,89,,,,False,False,False,karmaticacid,forestkeeperio,almondoyealmond,52.3333333333333,55.0
55,661476fa641e997eec4807a0,2024-04-08T23:00:10.246000Z,krmet,karmaticacid#0,for the GREAT work taking GIVeconomy marketing ideas & running with them! he did loads of research on memecoin communities & came up with some great ideas of things we could try to boost our comms,0.0,13,55,,,,True,False,False,divine_comedian,cherrywiner,paslar,22.6666666666667,55.0
1012,666709f0ff1f4b2e6e4aaed0,2024-06-10T14:13:04.886000Z,mohammad_ranjbar_z,greenbee9327,for spending time migrating subgraphs one bye one last 2 weeks and successfully completing it with proper documentation on open questions. This was critical and urgent. Else we would have been rate limited by the Graph . Thanks for your efforts in getting this to completion 👏🏻👏🏻👏🏻,34.0,89,89,665dd29bff1f4b2e6e464acd,,,False,False,False,chuygarcia.eth,nicbals,mateodaza,59.3333333333333,55.0
715,6646333c9a2014b93940df17,2024-05-16T16:24:28.009000Z,krmet,karmaticacid#0,"for being proactive about getting invovled in GIVeconomy marketing, and working with me to build some great ideas - like how we can optimize our site & blog to pull people into the GIV token (as a world changing crypto) in addition existing SEO ideas like Giveth as the best donation platform",0.0,34,55,,,,True,False,False,divine_comedian,cherrywiner,paslar,29.6666666666667,55.0
457,663508455a2df19a7840b3c4,2024-05-03T15:52:37.588000Z,geleeroyale,divine_comedian#0,for working some serious overtime yesterday on debugging the dapp issuess regarding latency and crashes.  They worked as a team to look at all possible areas where we could be facing trouble and finding solutions to try.,55.0,34,89,,,,False,False,False,karmaticacid,forestkeeperio,almondoyealmond,59.3333333333333,55.0
111,6617fd12641e997eec4b0afa,2024-04-11T15:09:06.918000Z,mohammad_ranjbar_z,greenbee9327,"for consistently progressing on Superfluid integration, taking care of open issues, preparing for release readiness and prioritizing what matters for the user's experience. Testing and implementing this feature has been truly enlightening as something like this never existed before in Giveth. Great work! Eagerly waiting for the release on Wednesday!!",34.0,89,55,,,,False,False,False,chuygarcia.eth,nicbals,mateodaza,59.3333333333333,55.0
450,6634fd1a5a2df19a7840a865,2024-05-03T15:04:58.403000Z,Amin#2164,karmaticacid#0,"for working tirelessly to solve the crazy latency & 404 issues we had yesterday with the dapp. you guys stayed up soo late and worked so hard to get things up and running as quickly as possible, and this is HUGE effort annd makes a big difference for all our projects & donors - thank you!",89.0,144,89,,,,False,False,False,karmaticacid,juan_work,freshelle,107.333333333333,55.0
