index,ID,DATE,TO USER ACCOUNT,FROM USER ACCOUNT,REASON,SCORE 1,SCORE 2,SCORE 3,DUPLICATE ID 1,DUPLICATE ID 2,DUPLICATE ID 3,DISMISSED 1,DISMISSED 2,DISMISSED 3,QUANTIFIER 1 USERNAME,QUANTIFIER 2 USERNAME,QUANTIFIER 3 USERNAME,AVG SCORE,SPREAD
872,66575e13ff1f4b2e6e42a847,2024-05-29T16:55:47.119000Z,whyldwanderer#0,andresforigua.eth,"for giving full clarification on QF applications and explaining the importance and how to add other Blockchain Addresses to the project. She also shared helpful material in the AMA session, best onboarding ever☺️ ✨",8.0,3,34,,,,False,False,False,missgene,cherrywiner,paslar,15.0,31.0
691,664248279a2014b9393e20d9,2024-05-13T17:04:39.093000Z,moeshehab#0,geleeroyale,for manually importing pending donations ❤️,34.0,3,34,,,,False,False,False,karmaticacid,ramin,steffansteetweets9260,23.6666666666667,31.0
849,66501fb59a2014b939471475,2024-05-24T05:03:49.396000Z,nikolacreatrix#0,freshelle,"for the team work on updating DAO Ops WG slides, and having a great and productive DAO Ops WG call - covering Giveth's credit card, leadership forms, finalizing equity preference typeform, and many more!",3.0,8,34,,,,False,False,False,karmaticacid,whyldwanderer,freshelle,15.0,31.0
573,663b40d75a2df19a78456fa7,2024-05-08T09:07:35.255000Z,moeshehab#0,Amin#2164,for his commitment and responsiveness. Also for his dedication to fix perfomance issues,8.0,3,34,,,,False,False,False,karmaticacid,ramin,steffansteetweets9260,15.0,31.0
293,6629702dd769970d098820fb,2024-04-24T20:48:45.592000Z,whyldwanderer#0,karmaticacid#0,"for incredible work managing the QF round curation, tracking all the projects, keeping givers in the loop on which are IN. it's just amazing to have her managing all that and really puts my mind at ease",13.0,3,34,,,,False,False,False,missgene,cherrywiner,paslar,16.6666666666667,31.0
326,662a7c79d769970d098911a3,2024-04-25T15:53:29.200000Z,moeshehab#0,greenbee9327,for quickly taking a look at backend deployment issues,13.0,3,34,,,,False,False,False,karmaticacid,ramin,steffansteetweets9260,16.6666666666667,31.0
936,665e2ef1ff1f4b2e6e467f10,2024-06-03T21:00:33.648000Z,koday.eth,karmaticacid#0,"for getting the forum post up about the galactic giving QF round and for all the work and effort that went into COCM data analysis. you really did a wonderful job on this, and I'm so happy also to see the follow up comms. Major praise for really taking the reigns more and more on QF, I'm totally feeling a lot of great ""passing the baton"" lately and am hugely gratful for you",34.0,3,34,,,,False,False,False,nikola_creatrix,ramin,paslar,23.6666666666667,31.0
1233,667d9b954ed52c91f5a99223,2024-06-27T17:04:21.833000Z,oyealmond#0,koday.eth,For joining the meme party and creating some 🔥 🔥  memes!,5.0,3,34,,,,False,False,False,karmaticacid,cherrywiner,freshelle,14.0,31.0
94,6617072d641e997eec4a4412,2024-04-10T21:39:57.785000Z,whyldwanderer#0,oyealmond#0,for being great Giveth Telegram moderators!,8.0,3,34,,,,False,False,False,missgene,cherrywiner,paslar,15.0,31.0
986,6661d343ff1f4b2e6e4841cb,2024-06-06T15:18:27.623000Z,nikolacreatrix#0,nikolacreatrix#0,"for great vibes during our DAO oops call, turning on your cameras, and being super graceful yet productive as usual. Our calls always leave me with the feeling of great coherence, synergy, and support. I love working with you.",3.0,5,34,,,,False,False,False,karmaticacid,whyldwanderer,freshelle,14.0,31.0
387,663269175a2df19a783de79a,2024-05-01T16:08:55.729000Z,koday.eth,griffgreen#0,for all the great work interfacing with Gitcoiners! Talking to Ben West about future Arbitrum QF rounds and Umar about clustermapping... having this bridge to their expertise is HUGE!!,34.0,3,21,,,,False,False,False,nikola_creatrix,ramin,paslar,19.3333333333333,31.0
445,6634a37b5a2df19a78405a9d,2024-05-03T08:42:35.066000Z,NicoBals#2154,freshelle,for all the support he's been providing for our accounting admin and PTO computations needs. Thank you for being so reliable! I always appreciate our weekly calls (which now turned to bi-monthly) and for just being a great friend! 🫶🏼,3.0,8,34,,,,False,False,False,chuygarcia.eth,forestkeeperio,mateodaza,15.0,31.0
805,664d40669a2014b939454e87,2024-05-22T00:46:30.860000Z,snakey_jakey.,karmaticacid#0,"for the huge comms push today to boost the qacc annoucement, saw so much great hype thanks to you!",21.0,3,34,,,,False,False,False,chuygarcia.eth,cherrywiner,steffansteetweets9260,19.3333333333333,31.0
806,664d40de9a2014b939455275,2024-05-22T00:48:30.171000Z,Maryjaf#2478,karmaticacid#0,"for incredible coordination devving, reviewing, fixing and testing countless major qf issues. So glad to see these getting pushed and prioritized so we can continue making a big impact w qf rounds",21.0,3,34,,,,False,False,False,missgene,cherrywiner,paslar,19.3333333333333,31.0
774,664b76f39a2014b93943a3f5,2024-05-20T16:14:43.375000Z,nikolacreatrix#0,oyealmond#0,For joining the GIVTalk with Metagame and Giveth conversation! 😻 You're all great.,3.0,13,34,,,,False,False,False,karmaticacid,whyldwanderer,freshelle,16.6666666666667,31.0
966,666180f9ff1f4b2e6e480c4a,2024-06-06T09:27:21.059000Z,moeshehab#0,greenbee9327,for helping resolving my GM account login issues,5.0,3,34,,,,False,False,False,karmaticacid,ramin,steffansteetweets9260,14.0,31.0
462,663508745a2df19a7840b4e2,2024-05-03T15:53:24.937000Z,oyealmond#0,divine_comedian#0,"for creating, executing  & coordinating the superfluid release communications this week and last week!",34.0,3,34,,,,False,False,False,karmaticacid,cherrywiner,freshelle,23.6666666666667,31.0
280,6628fa85d769970d0987c7f6,2024-04-24T12:26:45.708000Z,moeshehab#0,greenbee9327,"for syncing up to estimate timelines while thinking through the tasks in the predictable scope and adding date of completion for each of the development, deployment and QA tasks.",5.0,3,34,,,,False,False,False,karmaticacid,ramin,steffansteetweets9260,14.0,31.0
597,663bc7f55a2df19a7845f9bb,2024-05-08T18:44:05.019000Z,oyealmond#0,griffgreen#0,For the crazy awesome coordination in the alldevs channel and other channels to attack all the issues on production. The app is getting better and better every day!,3.0,5,34,,,,False,False,False,karmaticacid,cherrywiner,freshelle,14.0,31.0
984,6661d343ff1f4b2e6e4841c7,2024-06-06T15:18:27.622000Z,cherrywiner,nikolacreatrix#0,"for great vibes during our DAO oops call, turning on your cameras, and being super graceful yet productive as usual. Our calls always leave me with the feeling of great coherence, synergy, and support. I love working with you.",3.0,5,34,,,,False,False,False,missgene,whyldwanderer,freshelle,14.0,31.0
276,6628f974d769970d0987c5c7,2024-04-24T12:22:12.514000Z,moeshehab#0,greenbee9327,for jumping on to debug staging availability and perf issues quickly and resolving it within minutes !!,8.0,3,34,,,,False,False,False,karmaticacid,ramin,steffansteetweets9260,15.0,31.0
1125,6673d9b44ed52c91f5a46757,2024-06-20T07:26:44.367000Z,moeshehab#0,greenbee9327,for deploying Pairwise Landing Page and webapp by coordinating so well and in a timely manner 👏👏,8.0,3,34,,,,False,False,False,karmaticacid,ramin,steffansteetweets9260,15.0,31.0
410,66339e0e5a2df19a783f8073,2024-05-02T14:07:10.899000Z,rachelopolis,karmaticacid#0,for hosting Lets GROW live twitter spaces as Giveth!,8.0,34,3,,,,False,False,False,nikola_creatrix,forestkeeperio,steffansteetweets9260,15.0,31.0
1063,666cb6a3ff1f4b2e6e4dbf28,2024-06-14T21:31:15.077000Z,moeshehab#0,divine_comedian#0,"for their continued work on improving the dapp performance and stability, still more work to go but I know they are finding solutions and iteratively testing and making improvements so our dapp runs fast and information is up to date for our users",13.0,3,34,,,,False,False,False,karmaticacid,ramin,steffansteetweets9260,16.6666666666667,31.0
960,6660d162ff1f4b2e6e47c3fe,2024-06-05T20:58:10.872000Z,koday.eth,karmaticacid#0,"for driving forward our thankARB proposal and bringing it to the FINISH line! we were actually selected which  could mean 150k ARB for QF rounds. he had to make a lot of judegement calls and last mintue decisions, and we may have to now make some changes, but powering through and getting it to this point shows HUGE initiative and PM power 🪨",34.0,3,21,,,,False,False,False,nikola_creatrix,ramin,paslar,19.3333333333333,31.0
758,664b43e89a2014b939436725,2024-05-20T12:36:56.458000Z,cotabe,snakey_jakey.,for being super great and fun buddies to work with. Love our weekly chats and each interaction brings simple joy to my day 🌞,3.0,34,3,,,,False,False,False,missgene,juan_work,almondoyealmond,13.3333333333333,31.0
602,663c7f3a5a2df19a7846ecc1,2024-05-09T07:46:02.280000Z,moeshehab#0,greenbee9327,for deploying trading bot and integrating dockerization to the repo,8.0,3,34,,,,False,False,False,karmaticacid,ramin,steffansteetweets9260,15.0,31.0
894,665dbb1eff1f4b2e6e461e92,2024-06-03T12:46:22.852000Z,glou4u,snakey_jakey.,"for showing interest in our CRM system, looking forward to chatting with ya in our video call later this week",3.0,8,34,,,,False,False,False,karmaticacid,whyldwanderer,almondoyealmond,15.0,31.0
160,661ded61641e997eec4f9524,2024-04-16T03:15:45.529000Z,rachelopolis,hanners717#0,for joining the team! It's so wonderful to see how many small world connections we have as she send me photos over the weekend while she attended Funding The Commons in SF.,3.0,34,34,,,,False,False,False,nikola_creatrix,forestkeeperio,steffansteetweets9260,23.6666666666667,31.0
621,663e39c95a2df19a78486b78,2024-05-10T15:14:17.913000Z,nikolacreatrix#0,freshelle,"for a productive and collaborative DAO Ops bi-monthly sync! We covered important topics such as PTO increase proposal,  hours/cost charging concerns, new work agreement terms, offer letter terms, conflict resolution concerns, and a lot more! GREAT WORK TEAM!!",3.0,8,34,,,,False,False,False,karmaticacid,whyldwanderer,freshelle,15.0,31.0
996,6666faabff1f4b2e6e4aa05b,2024-06-10T13:07:55.647000Z,Maryjaf#2478,moeshehab#0,For jumping in and testing our subgraph migration. You guys helped with keeping giveth alive when it comes to all Giveconomy Features. I appreciate it :),8.0,3,34,,,,False,False,False,missgene,cherrywiner,paslar,15.0,31.0
341,662f3f43d769970d098cbc84,2024-04-29T06:33:39.338000Z,marcelorefi,snakey_jakey.,"for all that he is doing every week with the Giveth fundraising team. He is a one man wrecking ball, with a super positive vibe and a know it all (in a good way) attitude about the grant ecosystem. He is teaching me a lot about web3 :)",34.0,5,3,,,,False,False,False,divine_comedian,ramin,almondoyealmond,14.0,31.0
477,66354bff5a2df19a7840dd77,2024-05-03T20:41:35.667000Z,moeshehab#0,greenbee9327,for actively troubleshooting production issues and supporting devs through query monitoring and analysis,34.0,3,34,,,,False,False,False,karmaticacid,ramin,steffansteetweets9260,23.6666666666667,31.0
245,662798fbd769970d0986679a,2024-04-23T11:18:19.099000Z,moeshehab#0,greenbee9327,for identifying categories of expense in devops which can be cut down and coming up with action plan to systematically and carefully reducing devops costs without affecting all services we cater to. Thanks for discussing and strategizing on the next steps and monitoring for same.,8.0,3,34,,,,False,False,False,karmaticacid,ramin,steffansteetweets9260,15.0,31.0
626,663e47c05a2df19a78487768,2024-05-10T16:13:52.594000Z,oyealmond#0,koday.eth,For being the mastermind behind the 2nd galactic giving twitter space! You made it super smooth 😀,3.0,8,34,,,,False,False,False,karmaticacid,cherrywiner,freshelle,15.0,31.0
254,66279d78d769970d098673c8,2024-04-23T11:37:28.867000Z,moeshehab#0,geleeroyale,for fixing the resulting bugs from prior fixes 😅,8.0,3,34,,,,False,False,False,karmaticacid,ramin,steffansteetweets9260,15.0,31.0
513,6639db0b5a2df19a78440b16,2024-05-07T07:40:59.331000Z,marcelorefi,snakey_jakey.,for his hard core diligence and effort for the Giveth fundraising team. Its been a joy having you 1-2 this thing with me and all your work is showing through...soon the money will be raining in from them too.,34.0,5,3,,,,False,False,False,divine_comedian,ramin,almondoyealmond,14.0,31.0
1071,66703712ff1f4b2e6e4f549a,2024-06-17T13:16:02.798000Z,moeshehab#0,greenbee9327,for promptly setting up infra for market order bot with Youssef and being flexible working across weekends for this p0,8.0,3,34,,,,False,False,False,karmaticacid,ramin,steffansteetweets9260,15.0,31.0
787,664ce1bc9a2014b9394510bc,2024-05-21T18:02:36.583000Z,divine_comedian#0,karmaticacid#0,for collaborating to convert all our galactic giving matching funds to usdglo on arbitrum in preparation for sending funds out to projects!,5.0,21,34,,,,False,False,False,nikola_creatrix,whyldwanderer,almondoyealmond,20.0,29.0
792,664cfde99a2014b939452211,2024-05-21T20:02:49.151000Z,nikolacreatrix#0,divine_comedian#0,for reviewing the equity preferences typeform and leaving me some feedback on how to improve it,5.0,13,34,,,,False,False,False,karmaticacid,whyldwanderer,freshelle,17.3333333333333,29.0
677,66421f639a2014b9393df69e,2024-05-13T14:10:43.002000Z,annakaic,parrachia#0,thanks for pushing for better client portals!,5.0,5,34,,,,False,False,False,missgene,whyldwanderer,freshelle,14.6666666666667,29.0
739,664b3ff99a2014b9394358fa,2024-05-20T12:20:09.061000Z,Steffan | SteeTweets#9260,snakey_jakey.,for his jump in and chat and do good attitude. Love the relationship we are building with Kyoto and hopeful for the good returns out of it,5.0,13,34,,,,False,False,False,missgene,whyldwanderer,freshelle,17.3333333333333,29.0
79,661554d4641e997eec48cfa4,2024-04-09T14:46:44.602000Z,divine_comedian#0,snakey_jakey.,for taking some vacation but its time to come back. We all miss your stewardness and your vacations really show us all how much you do around here.,34.0,5,5,,,,False,False,False,nikola_creatrix,whyldwanderer,almondoyealmond,14.6666666666667,29.0
683,664220769a2014b9393dfcb8,2024-05-13T14:15:18.259000Z,marcelorefi,gg7027,for matchmaking calls and improving applications proccess,21.0,5,34,66421fb59a2014b9393df7aa,,,False,False,False,divine_comedian,ramin,almondoyealmond,13.0,29.0
199,6622bc5cd769970d0982a353,2024-04-19T18:47:56.396000Z,giantkin#0,sky.mine,for helping the world understand how to use Praise!,5.0,13,34,,,,False,False,False,nikola_creatrix,forestkeeperio,steffansteetweets9260,17.3333333333333,29.0
126,6619622c641e997eec4c1cf3,2024-04-12T16:32:44.882000Z,divine_comedian#0,oyealmond#0,"for coming after vacation, and jumping right in to host the GIVtalk X Space, even tho he's so tired.",34.0,5,5,,,,False,False,False,nikola_creatrix,whyldwanderer,almondoyealmond,14.6666666666667,29.0
224,6627541cd769970d0985f27a,2024-04-23T06:24:28.266000Z,divine_comedian#0,snakey_jakey.,for their last gasps at pushing this SF<>GIV release out. Everyday its so close and cant wait to cut the ribbon on it,5.0,8,34,,,,False,False,False,nikola_creatrix,whyldwanderer,almondoyealmond,15.6666666666667,29.0
504,6639da035a2df19a78440530,2024-05-07T07:36:35.148000Z,greenbee9327,snakey_jakey.,for all their amazing speed and hard work to get the dApp up and running this past weekend.  Just brilliant work and you are all the superhero's of Giveth,13.0,5,34,,,,False,False,False,nikola_creatrix,cherrywiner,paslar,17.3333333333333,29.0
1134,66740b9b4ed52c91f5a48547,2024-06-20T10:59:39.365000Z,bmeriem,mohammad_ranjbar_z,For review PRs and her great feedbacks on the PRs,5.0,21,34,,,,False,False,False,missgene,whyldwanderer,steffansteetweets9260,20.0,29.0
207,66265f6bd769970d0984ee00,2024-04-22T13:00:27.005000Z,oyealmond#0,Steffan | SteeTweets#9260,for  regular amazing content for Giveth. The account looks professional and inviting.,13.0,5,34,,,,False,False,False,karmaticacid,cherrywiner,freshelle,17.3333333333333,29.0
487,6638e39a5a2df19a784326c4,2024-05-06T14:05:14.128000Z,annakaic,marcelorefi,for taking on the Office Hours task and killing it!,5.0,13,34,,,,False,False,False,missgene,whyldwanderer,freshelle,17.3333333333333,29.0
771,664b76f39a2014b93943a3f0,2024-05-20T16:14:43.374000Z,helpersfoundation#4702,oyealmond#0,For joining the GIVTalk with Metagame and Giveth conversation! 😻 You're all great.,34.0,5,8,,,,False,False,False,karmaticacid,cherrywiner,mateodaza,15.6666666666667,29.0
1193,667d830b4ed52c91f5a97094,2024-06-27T15:19:39.260000Z,Steffan | SteeTweets#9260,wmb81321,Because his X Account is full of alphas and valuable info!,5.0,5,34,,,,False,False,False,missgene,whyldwanderer,freshelle,14.6666666666667,29.0
1222,667d9a3e4ed52c91f5a98df4,2024-06-27T16:58:38.960000Z,oyealmond#0,koday.eth,For helping to run the first GIV-Earth X space!,5.0,5,34,,,,False,False,False,karmaticacid,cherrywiner,freshelle,14.6666666666667,29.0
1186,667d80954ed52c91f5a96a57,2024-06-27T15:09:09.342000Z,hanners717#0,missgene#0,for sharing their insights on the accommodation concerns for ETHCC!,8.0,5,34,,,,False,False,False,chuygarcia.eth,whyldwanderer,almondoyealmond,15.6666666666667,29.0
489,66390ce95a2df19a78434086,2024-05-06T17:01:29.449000Z,oyealmond#0,karmaticacid#0,for yet another fantastic twitter space management. coordinating all the projects & work in the backend... you are a shadowy superhero!,5.0,13,34,,,,False,False,False,karmaticacid,cherrywiner,freshelle,17.3333333333333,29.0
167,661e75a9641e997eec4fec3f,2024-04-16T12:57:13.332000Z,rachelopolis,snakey_jakey.,for jumping right in with Giveth and taking on some much needed external driving force. Pump and Push!,5.0,13,34,,,,False,False,False,nikola_creatrix,forestkeeperio,steffansteetweets9260,17.3333333333333,29.0
775,664b76f39a2014b93943a3f4,2024-05-20T16:14:43.375000Z,wasabinetwork,oyealmond#0,For joining the GIVTalk with Metagame and Giveth conversation! 😻 You're all great.,34.0,5,8,,,,False,False,False,karmaticacid,cherrywiner,mateodaza,15.6666666666667,29.0
685,66422d949a2014b9393e0bcc,2024-05-13T15:11:16.117000Z,oyealmond#0,koday.eth,For creating twitter space scripts and being the brains behind the operation every time!,5.0,5,34,,,,False,False,False,karmaticacid,cherrywiner,freshelle,14.6666666666667,29.0
1192,667d82eb4ed52c91f5a96fb3,2024-06-27T15:19:07.207000Z,Steffan | SteeTweets#9260,wmb81321,for showing us Binance Listing Program which we go to look a big LISTING this year!,8.0,5,34,,,,False,False,False,missgene,whyldwanderer,freshelle,15.6666666666667,29.0
527,6639dc555a2df19a78441657,2024-05-07T07:46:29.858000Z,whyldwanderer#0,snakey_jakey.,for quickly putting together some much needed CELO info prior to our tight deadline for the CELO RetroPGF0 grant today / tomorrow,8.0,5,34,,,,False,False,False,missgene,cherrywiner,paslar,15.6666666666667,29.0
273,6628540dd769970d0987326d,2024-04-24T00:36:29.805000Z,divine_comedian#0,oyealmond#0,for bringing the Medium posting to the table.,5.0,34,5,,,,False,False,False,nikola_creatrix,whyldwanderer,almondoyealmond,14.6666666666667,29.0
583,663b8a075a2df19a7845c157,2024-05-08T14:19:51.929000Z,NicoBals#2154,freshelle,for his comms support and working with me in drafting announcements and responses to contributors regarding payments/contributor support concerns. He is such a reliable teammate and I'm so grateful for your support always!,5.0,13,34,,,,False,False,False,chuygarcia.eth,forestkeeperio,mateodaza,17.3333333333333,29.0
313,662a7556d769970d0988fa2c,2024-04-25T15:23:02.321000Z,whyldwanderer#0,koday.eth,for staying on top of nominations and killing it with sponsors for the Galactic Giving round!,8.0,5,34,,,,False,False,False,missgene,cherrywiner,paslar,15.6666666666667,29.0
924,665dd29bff1f4b2e6e464acd,2024-06-03T14:26:35.540000Z,mohammad_ranjbar_z,greenbee9327,for migrating staging subgraphs to studio,34.0,8,5,,,,False,False,False,chuygarcia.eth,nicbals,mateodaza,15.6666666666667,29.0
614,663d16515a2df19a78476a00,2024-05-09T18:30:41.412000Z,carlosjmelgar,DiogoJ,for stressing the need for impact in the rounds 🐝,5.0,13,34,,,,False,False,False,chuygarcia.eth,whyldwanderer,almondoyealmond,17.3333333333333,29.0
839,664f5e299a2014b93946ae21,2024-05-23T15:18:01.409000Z,danidiabella#0,juankbell,"For remaining active in the Giveth community for so many years! You were in my first call on Discord, almost 5 years ago, and I love how time has passed but the motivation is there.",5.0,34,13,,,,False,False,False,missgene,forestkeeperio,mateodaza,17.3333333333333,29.0
888,665db917ff1f4b2e6e46188b,2024-06-03T12:37:43.084000Z,marcelorefi,snakey_jakey.,"where do I begin week after week with this guy, he is the ying to my yang, the bread to our fundraising butter and lamb to my tunafish...wait thats a bad one, but what Im trying to say is without your grease our gears don't turn. You are getting it done and learning more and more about Giveth everyday. We are getting there, keep plugging",34.0,5,8,,,,False,False,False,divine_comedian,ramin,almondoyealmond,15.6666666666667,29.0
27,660d5e3ddc75ca6645bf036e,2024-04-03T13:48:45.134000Z,freshelle,NicoBals#2154,"for joining our HR monthly call and for adding valuable information and resolutions to our action items. This call is really important for us to make sure all our contributors are supported and also for us to be updated with contributor status, new policies, and other HR-related issues.",13.0,5,34,,,,False,False,False,nikola_creatrix,forestkeeperio,mateodaza,17.3333333333333,29.0
584,663b8b2a5a2df19a7845c3fa,2024-05-08T14:24:42.594000Z,NicoBals#2154,giantkin#0,"Listening to my ramblings, reassuring my wild thoughts are accurate, and always open for feedback.",5.0,13,34,,,,False,False,False,chuygarcia.eth,forestkeeperio,mateodaza,17.3333333333333,29.0
989,6661d3c0ff1f4b2e6e4842f5,2024-06-06T15:20:32.882000Z,ghaemian,nikolacreatrix#0,"for our weekly sync call, for all the care, thought, intention, love and effort we all put into the leadership review process to make it work and help everyone in the process feel supported.",5.0,34,34,,,,False,False,False,missgene,forestkeeperio,paslar,24.3333333333333,29.0
530,6639dc7d5a2df19a78441836,2024-05-07T07:47:09.826000Z,Steffan | SteeTweets#9260,snakey_jakey.,"for all your hard, and at all hours of the night, work to pump the $GIV token. Once it hits $1, we will all know who and why!",5.0,13,34,,,,False,False,False,missgene,whyldwanderer,freshelle,17.3333333333333,29.0
369,66316d66d769970d098ec8f5,2024-04-30T22:15:02.178000Z,oyealmond#0,karmaticacid#0,for drafting loads of beautiful content for the galactic giving qf round,21.0,5,34,,,,False,False,False,karmaticacid,cherrywiner,freshelle,20.0,29.0
370,66316d7ad769970d098ec9d6,2024-04-30T22:15:22.557000Z,whyldwanderer#0,karmaticacid#0,"for incredible project curation work in the galactic giving round... keeping track of everyone, emailing nominees who need updates etc etc",8.0,5,34,,,,False,False,False,missgene,cherrywiner,paslar,15.6666666666667,29.0
62,6615508c641e997eec48c1d4,2024-04-09T14:28:28.584000Z,hanners717#0,snakey_jakey.,"for helping me to arrange a call with our new contributor Roberto. I love seeing messages from you, as they are always positive and happy filled",34.0,13,5,,,,False,False,False,chuygarcia.eth,whyldwanderer,almondoyealmond,17.3333333333333,29.0
554,663a69c45a2df19a7844b976,2024-05-07T17:49:56.862000Z,aabugosh,greenbee9327,for regularly coordinating on preparing the estimates for FreeDAO and presenting the proposal in less than a day !!,5.0,34,5,,,,False,False,False,karmaticacid,whyldwanderer,almondoyealmond,14.6666666666667,29.0
568,663a996f5a2df19a7844f7c5,2024-05-07T21:13:19.050000Z,Steffan | SteeTweets#9260,wmb81321,For drop such cool Xposts about GIVEconomy and profound problems solved by $GIV: https://www.youtube.com/watch?v=lGI8_58ZtrY,5.0,13,34,,,,False,False,False,missgene,whyldwanderer,freshelle,17.3333333333333,29.0
60,66155008641e997eec48bd71,2024-04-09T14:26:16.541000Z,marcelorefi,snakey_jakey.,for all his continued relentless efforts towards Giveth grants. Hope to see some integrations for our team in the coming weeks :),21.0,5,34,,,,False,False,False,divine_comedian,ramin,almondoyealmond,20.0,29.0
1015,66670a41ff1f4b2e6e4aafd3,2024-06-10T14:14:25.170000Z,alireza7612#0,greenbee9327,"for owning up, coding, deploying and following up on Nounspace smart contract. 🙌",21.0,5,34,,,,False,False,False,nikola_creatrix,ramin,almondoyealmond,20.0,29.0
423,66340b505a2df19a783ff560,2024-05-02T21:53:20.358000Z,oyealmond#0,karmaticacid#0,for her incredible comms support helping me wrap up the ENS round emails & final content all so quick!,13.0,5,34,,,,False,False,False,karmaticacid,cherrywiner,freshelle,17.3333333333333,29.0
320,662a773ed769970d098908e9,2024-04-25T15:31:10.556000Z,brichis,rubeola,for greath support and nominated Platohedro,5.0,8,34,,,,False,False,False,nikola_creatrix,whyldwanderer,freshelle,15.6666666666667,29.0
495,6639216e5a2df19a7843731f,2024-05-06T18:29:02.542000Z,oyealmond#0,koday.eth,For hosting and helping me out with the first Galactic Giving twitter space!,5.0,8,34,,,,False,False,False,karmaticacid,cherrywiner,freshelle,15.6666666666667,29.0
813,664d41339a2014b93945546e,2024-05-22T00:49:55.369000Z,whyldwanderer#0,karmaticacid#0,for working so hard to put together all the info we need for sending givbacks out to qf sponsors and missed addresses,8.0,5,34,,,,False,False,False,missgene,cherrywiner,paslar,15.6666666666667,29.0
650,6641bae39a2014b9393d7fff,2024-05-13T07:01:55.109000Z,alireza7612#0,greenbee9327,for successfully completing Solidity bootcamp. We have another blockchain engineer in our team! 👏👏,34.0,5,34,,,,False,False,False,nikola_creatrix,ramin,almondoyealmond,24.3333333333333,29.0
522,6639dbc25a2df19a78440f2e,2024-05-07T07:44:02.416000Z,greenbee9327,snakey_jakey.,"for her amazing ability to juggle everything that is coming with her CTO duties, plus be overly responsive, helpful and kind. Really a pleasuer to interact with you",8.0,5,34,,,,False,False,False,nikola_creatrix,cherrywiner,paslar,15.6666666666667,29.0
