,index,ID,DATE,TO USER ACCOUNT,FROM USER ACCOUNT,REASON,DISMISSED 1,DISMISSED 2,DISMISSED 3,QUANTIFIER 1 USERNAME,QUANTIFIER 2 USERNAME,QUANTIFIER 3 USERNAME,AVG SCORE,MAX SCORE,DISMISSAL AGREED,ORIGINAL MSG
200,492,6427418c6c81534462072603,2023-03-31T22:24:44,Whyld Wanderer#0784,ClaraZi#5313,for updating the home page for Earth Day. It’s really refreshing  to see a new set of projects in focus and will help these environmental projects raise funds with this campaign.,False,False,True,nikola_creatrix,divine_comedian,cuidadopeligro,7.0,21.0,False,for updating the home page for Earth Day. It’s really refreshing  to see a new set of projects in focus and will help these environmental projects raise funds with this campaign.
279,388,64259fe86c81534462072093,2023-03-30T16:42:48,carlos096#0,Amin#2164,for fixing chainvine issues and supporting testers,True,True,False,nikola_creatrix,whyldwanderer,karmaticacid,0.0,13.0,False,for fixing chainvine issues and supporting testers
290,124,641c596165b606599e16c220,2023-03-23T14:51:29,Amin#2164,mohammad_ranjbar_z#0,For small gathering for new persian year,True,False,False,clarazi,divine_comedian,cuidadopeligro,6.0,13.0,False,For small gathering for new persian year
334,140,641c59f065b606599e16c2d1,2023-03-23T14:53:52,Amin#2164,alireza7612#0,for new persian year's gathering.,True,False,False,clarazi,divine_comedian,cuidadopeligro,0.0,13.0,False,for new persian year's gathering.
384,125,641c596265b606599e16c227,2023-03-23T14:51:30,alireza7612#0,mohammad_ranjbar_z#0,For small gathering for new persian year,True,False,False,clarazi,whyldwanderer,karmaticacid,3.6666666666666665,8.0,False,For small gathering for new persian year
414,463,6425f2836c8153446207246d,2023-03-30T22:35:15,moenick#0,moeshehab#0,For an awesome in person meetup yestrday. Always good to see some of you away from the screen 🧐,True,False,False,clarazi,whyldwanderer,karmaticacid,2.6666666666666665,5.0,False,For an awesome in person meetup yestrday. Always good to see some of you away from the screen 🧐
444,142,641c59f165b606599e16c2df,2023-03-23T14:53:53,mohammad_ranjbar_z#0,alireza7612#0,for new persian year's gathering.,True,False,False,clarazi,divine_comedian,karmaticacid,0.3333333333333333,1.0,False,for new persian year's gathering.
445,421,6425a7576c81534462072262,2023-03-30T17:14:31,freshelle#0,hanners717#0,"and her sister for hanging out in person, showing me around Queens, eating so much Chinese food, and all the giggles.",True,False,False,clarazi,divine_comedian,karmaticacid,0.3333333333333333,1.0,False,"and her sister for hanging out in person, showing me around Queens, eating so much Chinese food, and all the giggles."
