,index,ID,DATE,TO USER ACCOUNT,FROM USER ACCOUNT,REASON,DISMISSED 1,DISMISSED 2,DISMISSED 3,QUANTIFIER 1 USERNAME,QUANTIFIER 2 USERNAME,QUANTIFIER 3 USERNAME,AVG SCORE,MAX SCORE,DISMISSAL AGREED,ORIGINAL MSG
430,891,63d29ad5741cc4197ada2f63,2023-01-26T16:23:01,cotabe#0,oyealmond#0,"for sharing a pizza with me , and for being great humans in Web3 and outside of Web3 too.",False,True,False,nicbals,clarazi,nikola_creatrix,11.333333333333334,21,False,"for sharing a pizza with me , and for being great humans in Web3 and outside of Web3 too."
718,114,63b6e7b1741cc4197ada0b01,2023-01-05T16:07:29,divine_comedian#0,carlos096#0,for getting together and deciding on chainvine moving forward!,False,True,False,ramin,clarazi,missgene,4.333333333333333,8,False,for getting together and deciding on chainvine moving forward!
739,160,63b6eb29741cc4197ada0d14,2023-01-05T16:22:17,divine_comedian#0,mateodazab#0,"for getting to an agreement on the chainvine situation, we'll do better in the future with future integrations for sure",False,True,False,ramin,clarazi,missgene,1.6666666666666667,8,False,"for getting to an agreement on the chainvine situation, we'll do better in the future with future integrations for sure"
820,852,63d29664741cc4197ada2d56,2023-01-26T16:04:04,divine_comedian#0,Juankbell#7458,for his rad AI pic!,False,True,False,ramin,clarazi,missgene,2.0,5,False,for his rad AI pic!
821,251,63be3810741cc4197ada114d,2023-01-11T05:16:16,Kurt_M#9803,hanners717#0,for being friends outside of work 🤗,False,True,False,geleeroyale,clarazi,toraif,2.6666666666666665,5,False,for being friends outside of work 🤗
832,890,63d29ad5741cc4197ada2f5c,2023-01-26T16:23:01,divine_comedian#0,oyealmond#0,"for sharing a pizza with me , and for being great humans in Web3 and outside of Web3 too.",False,True,False,ramin,clarazi,missgene,2.0,5,False,"for sharing a pizza with me , and for being great humans in Web3 and outside of Web3 too."
836,875,63d2994f741cc4197ada2e82,2023-01-26T16:16:31,divine_comedian#0,oyealmond#0,because he FINALLY changed he's profile picture for a more modern one.,False,True,False,ramin,clarazi,missgene,2.0,5,False,because he FINALLY changed he's profile picture for a more modern one.
