index,ID,DATE,TO USER ACCOUNT,FROM USER ACCOUNT,REASON,SCORE 1,SCORE 2,SCORE 3,DUPLICATE ID 1,DUPLICATE ID 2,DUPLICATE ID 3,DISMISSED 1,DISMISSED 2,DISMISSED 3,QUANTIFIER 1 USERNAME,QUANTIFIER 2 USERNAME,QUANTIFIER 3 USERNAME,AVG SCORE,SPREAD
116,66997d7e9b533b9d8ff4f5b5,2024-07-18T20:39:26.381000Z,nikolacreatrix#0,divine_comedian#0,"for taking on the extra user support tasks while Ashley is out on vacay, super important that we keep engaging with users in our discord and you guys are doing a great job!",13,21,5,,,,False,False,False,paslar,cherrywiner,ramin,13.0,16
3,668555d54ed52c91f5ad4cb8,2024-07-03T13:44:53.672000Z,ramramez#0,kkechy#2713,for being always online,8,5,21,,,,False,False,False,forestkeeperio,cherrywiner,geleeroyale,11.3333333333333,16
109,66997bf19b533b9d8ff4eef0,2024-07-18T20:32:49.135000Z,rolazo,divine_comedian#0,"for responding to infra & devops needs, taking the necessary steps to coordinate with developers and providing thoughtful responses to me when I request resources or raise an issue or incident that needs to be adressed",21,21,5,,,,False,False,False,forestkeeperio,cherrywiner,ramin,15.6666666666667,16
1,66831be04ed52c91f5ac0f91,2024-07-01T21:13:04.329000Z,divine_comedian#0,forestkeeperio,for helping me set up everything :D,21,13,5,,,,False,False,False,paslar,freshelle,nicbals,13.0,16
266,66a8f529a0f1486352942341,2024-07-30T14:14:01.433000Z,dearhaija,Maryjaf#2478,for working hard on QF release,21,21,8,,,,False,False,False,forestkeeperio,freshelle,nicbals,16.6666666666667,13
83,669645fe9b533b9d8ff28ebe,2024-07-16T10:05:50.405000Z,markop#2007,snakey_jakey.,"for keeping his word and scheduling a call with a potential design client, could be a nice little pick up for the galaxy",13,0,5,,,,False,True,False,paslar,freshelle,ramin,6.0,13
84,6696683b9b533b9d8ff2a296,2024-07-16T12:31:55.365000Z,oyealmond#0,hanners717#0,"for taking vacation, to enjoy herself in the countryside surrounded by nature and friends!",8,8,21,,,,False,False,False,divine_comedian,work_0xj4an,geleeroyale,12.3333333333333,13
128,669a9824a0f148635285604d,2024-07-19T16:45:24.392000Z,missgene#0,karmaticacid#0,"for giving me great, detailed, supportive & constructive feedback for my buddy review. I can tell you all put a lot of love and thought into your responses and I hope I can do you proud by integrating your words & being better 🫡",21,34,21,,,,False,False,False,forestkeeperio,freshelle,geleeroyale,25.3333333333333,13
251,66a83023a0f148635293a3f4,2024-07-30T00:13:23.796000Z,karmaticacid#0,greenbee9327,for the war room pushing through the QF hotfixes in time for Arbitrum QF round,21,21,8,,,,False,False,False,paslar,cherrywiner,nicbals,16.6666666666667,13
276,66aa5c3c476b50fa6989921d,2024-07-31T15:46:04.643000Z,whyldwanderer#0,kohx,"Her kindness, expanse of knowledge in the giveth ecosystem and dedicated is amazing! Definitely setting the bar high 🥰",34,34,21,,,,False,False,False,paslar,freshelle,geleeroyale,29.6666666666667,13
2,66853ea34ed52c91f5ad43d4,2024-07-03T12:05:55.313000Z,mohammad_ranjbar_z,kkechy#2713,for fast feedback about stagging administration ;),21,34,34,,,,False,False,False,divine_comedian,freshelle,geleeroyale,29.6666666666667,13
79,669643a19b533b9d8ff289cc,2024-07-16T09:55:45.852000Z,divine_comedian#0,snakey_jakey.,for continuing to push this endoament partnership. Its so huge for Giveth and Im glad he is taking point on this to get it across the finish line and with excellent professionalism,21,34,21,,,,False,False,False,paslar,freshelle,nicbals,25.3333333333333,13
0,66828e044ed52c91f5abbcb4,2024-07-01T11:07:48.554000Z,whyldwanderer#0,iviangita#0,for always being ready to help with the q/acc comms. I appreciate you! 🙏🏽,21,34,34,,,,False,False,False,paslar,freshelle,geleeroyale,29.6666666666667,13
148,669eed7ca0f14863528932e6,2024-07-22T23:38:36.223000Z,divine_comedian#0,forestkeeperio,"For helping me on all my questions, giving me feedback and continously check in and helping me with everything about Giveth!",21,21,8,,,,False,False,False,paslar,freshelle,nicbals,16.6666666666667,13
179,66a240aea0f14863528dd6f1,2024-07-25T12:10:22.989000Z,ramramez#0,snakey_jakey.,"for receiving a gold medal in Giveth diving, as he dove head first into our analytics and helped me secure the metrics i needed to find 🥇",8,21,21,,,,False,False,False,forestkeeperio,cherrywiner,geleeroyale,16.6666666666667,13
157,669ff5eda0f14863528a01a3,2024-07-23T18:26:53.371000Z,karmaticacid#0,nikolacreatrix#0,"for providing me with beautiful, constructive, encouraging, and appreciative feedback! It means a lot and I want to take all your insights to my heart and work on improving my contributions. 🙏",21,34,21,,,,False,False,False,paslar,cherrywiner,nicbals,25.3333333333333,13
50,6690e0199b533b9d8fec562d,2024-07-12T07:49:45.737000Z,whyldwanderer#0,mohammad_ranjbar_z,"For working close with me for givback calculation and report bugs, help to troubleshoot them , ...",21,34,21,,,,False,False,False,paslar,freshelle,geleeroyale,25.3333333333333,13
241,66a7a71fa0f1486352932849,2024-07-29T14:28:47.137000Z,tamarandom,karmaticacid#0,"for coming all the way to barcelona to have some IRL meetings about q/acc and gurves!! it was so awesome to have all that in person connection time, I wish we could do it always!",21,34,34,,,,False,False,False,divine_comedian,freshelle,nicbals,29.6666666666667,13
74,6696427f9b533b9d8ff28569,2024-07-16T09:50:55.473000Z,0xjustice.eth,snakey_jakey.,for amazing q/acc presentations and being a real treat to meet IRL. So cool to have him running the GIV / qacc program,34,34,21,,,,False,False,False,forestkeeperio,freshelle,geleeroyale,29.6666666666667,13
199,66a26b97a0f14863528e0688,2024-07-25T15:13:27.286000Z,mosaeedi#0,karmaticacid#0,"for amazing support on last-minute improvements to the MBD / passport system for QF, he is really there when I need him!!",21,34,21,,,,False,False,False,forestkeeperio,cherrywiner,nicbals,25.3333333333333,13
238,66a75cf6a0f148635292cc77,2024-07-29T09:12:22.636000Z,mosaeedi#0,moenick,"for exploraion, design and thinking of UX flow for Stellar grant. it was a special case.",8,21,21,,,,False,False,False,forestkeeperio,cherrywiner,nicbals,16.6666666666667,13
58,6690e1199b533b9d8fec5c86,2024-07-12T07:54:01.545000Z,karmaticacid#0,mohammad_ranjbar_z,"For always sort everythin out about the giv economy, making agenda for the calls, and being nice and freindly in the calls",21,21,8,,,,False,False,False,paslar,cherrywiner,nicbals,16.6666666666667,13
70,6696419c9b533b9d8ff282aa,2024-07-16T09:47:08.887000Z,lordgriffi,snakey_jakey.,Gardner and Russell (since I don't think they follow the Giveth discord) for all their hard work IRL for the Unicorn wallet. Really great stuff coming out of the conference for the wallet,13,0,13,,,,False,True,False,paslar,freshelle,geleeroyale,8.66666666666667,13
244,66a7ad9ca0f148635293303b,2024-07-29T14:56:28.556000Z,Maryjaf#2478,karmaticacid#0,working super hard & super coordinated to get our issues fixed for the upcoming QF round and merge changes to production,21,34,34,,,,False,False,False,divine_comedian,cherrywiner,geleeroyale,29.6666666666667,13
214,66a26ee3a0f14863528e1531,2024-07-25T15:27:31.682000Z,ae2079,nikolacreatrix#0,"for joining the Giveth town hall, dishing their first praise, and becoming part of the Giveth community! Welcome!!! 🤗 🎉",3,13,5,,,,False,False,False,divine_comedian,freshelle,ramin,7.0,10
72,669642329b533b9d8ff28395,2024-07-16T09:49:38.390000Z,hanners717#0,snakey_jakey.,for not only being an incredible HR steward but for being an incredible road dog. We have such a great time IRL and really happy that she is there with me at these events,13,13,3,,,,False,False,False,divine_comedian,cherrywiner,ramin,9.66666666666667,10
170,66a23b9fa0f14863528dcc63,2024-07-25T11:48:47.575000Z,lordgriffi,snakey_jakey.,"for receiving a gold medal in Giveth tennis, as he made a great serve to me with NEAR 🥇",13,21,21,,,,False,False,False,paslar,freshelle,geleeroyale,18.3333333333333,8
219,66a26ee3a0f14863528e1534,2024-07-25T15:27:31.682000Z,dearhaija,nikolacreatrix#0,"for joining the Giveth town hall, dishing their first praise, and becoming part of the Giveth community! Welcome!!! 🤗 🎉",21,13,13,,,,False,False,False,forestkeeperio,freshelle,nicbals,15.6666666666667,8
216,66a26ee3a0f14863528e1533,2024-07-25T15:27:31.682000Z,frunjyan,nikolacreatrix#0,"for joining the Giveth town hall, dishing their first praise, and becoming part of the Giveth community! Welcome!!! 🤗 🎉",13,13,5,,,,False,False,False,paslar,cherrywiner,ramin,10.3333333333333,8
120,669a5f7e9b533b9d8ff5924d,2024-07-19T12:43:42.331000Z,kkechy#2713,mohammad_ranjbar_z,For helping me run Dapp on my machine,8,13,5,,,,False,False,False,divine_comedian,cherrywiner,ramin,8.66666666666667,8
57,6690e0ee9b533b9d8fec5b94,2024-07-12T07:53:18.031000Z,hanners717#0,mohammad_ranjbar_z,For working a lot to interview the full stack postition candidates and make a shortlist from lots of send applications,0,0,3,,,,True,True,False,divine_comedian,cherrywiner,ramin,1.0,3
273,66aa406a476b50fa6989773f,2024-07-31T13:47:22.759000Z,kkechy#2713,Amin#2164,for being a nice guy and care about parenting :),5,8,5,,,,False,False,False,divine_comedian,cherrywiner,ramin,6.0,3
123,669a97379b533b9d8ff5c487,2024-07-19T16:41:27.861000Z,divine_comedian#0,karmaticacid#0,for being an awesome buddy and talking TWO HOURS to hash through all my buddy review feedback and listen to all my musings and ramblings. you are such an awesome friend,34,34,34,,,,False,False,False,paslar,freshelle,nicbals,34.0,0
125,669a9824a0f1486352856046,2024-07-19T16:45:24.391000Z,divine_comedian#0,karmaticacid#0,"for giving me great, detailed, supportive & constructive feedback for my buddy review. I can tell you all put a lot of love and thought into your responses and I hope I can do you proud by integrating your words & being better 🫡",34,34,34,,,,False,False,False,paslar,freshelle,nicbals,34.0,0
59,669240239b533b9d8fecfdf9,2024-07-13T08:51:47.066000Z,mohammad_ranjbar_z,geleeroyale,for raising an immediate warning about our production subgraphs. All is working again,34,34,34,,,,False,False,False,divine_comedian,freshelle,geleeroyale,34.0,0
32,668e38669b533b9d8feb0bf3,2024-07-10T07:29:42.292000Z,cherrywiner,freshelle,"for all the support on catherding - confirming monthly hours, following up on time reports, updating on PTO computations and questions.",34,34,34,,,,False,False,False,paslar,freshelle,nicbals,34.0,0
269,66a938c3476b50fa69889c32,2024-07-30T19:02:27.492000Z,whyldwanderer#0,oyealmond#0,"for being a communications rockstart. I know she always says she's not in marketing and comms, but she's so efficient helping with emails, and catching typos, and making texts better, that Im starting to believe that's. not entirely true.",34,34,34,,,,False,False,False,paslar,freshelle,geleeroyale,34.0,0
35,668e396e9b533b9d8feb11ac,2024-07-10T07:34:06.758000Z,cherrywiner,freshelle,"for doing the monthly closing of accounting figures, checking Clockify vs. actual amounts paid, and getting the allocated cost across all working groups.",34,34,34,,,,False,False,False,paslar,freshelle,nicbals,34.0,0
5,668568034ed52c91f5ad7208,2024-07-03T15:02:27.599000Z,karmaticacid#0,hanners717#0,"for putting so much time, sweat, love, blood, and tears into the multiple documents she prepares for trial reviews. The docs are completely comprehensive, with detailed examples, clear expectations, and timelines for execution. Helping us as grow as an organization.",55,55,55,,,,False,False,False,paslar,cherrywiner,nicbals,55.0,0
19,668bafed9b533b9d8fe9d38c,2024-07-08T09:22:53.705000Z,cherrywiner,freshelle,"for computing PTO balances for June 2024, following up on contributors with recording, updating Clockify status and balances. Thanks for keeping our records up to date!",34,34,34,,,,False,False,False,paslar,freshelle,nicbals,34.0,0
