index,ID,DATE,TO USER ACCOUNT,FROM USER ACCOUNT,REASON,SCORE 1,SCORE 2,SCORE 3,DUPLICATE ID 1,DUPLICATE ID 2,DUPLICATE ID 3,DISMISSED 1,DISMISSED 2,DISMISSED 3,QUANTIFIER 1 USERNAME,QUANTIFIER 2 USERNAME,QUANTIFIER 3 USERNAME,AVG SCORE,SPREAD
112,66997c7d9b533b9d8ff4f0ca,2024-07-18T20:35:09.670000Z,Maryjaf#2478,divine_comedian#0,"for being a dynamic and thorough tester. She has such a great knowledge of Giveth and can handle any testing related task, BE or FE or even infra testing. She is handling testing on multiple projects and somehow she does it all in a thorough and professional manner",55,55,89,,,,False,False,False,divine_comedian,cherrywiner,geleeroyale,66.3333333333333,34
12,6685bbc84ed52c91f5adbb61,2024-07-03T20:59:52.254000Z,oyealmond#0,koday.eth,For putting together an agenda and hosting the impromptu X space with the $REGEN team today!,21,55,34,,,,False,False,False,divine_comedian,work_0xj4an,geleeroyale,36.6666666666667,34
141,669d12d1a0f1486352872f50,2024-07-21T13:53:21.013000Z,mohammad_ranjbar_z,greenbee9327,for flagging the solana issue and debugging with speed ⚡ ⚡,21,34,55,,,,False,False,False,divine_comedian,freshelle,geleeroyale,36.6666666666667,34
254,66a8c15da0f148635293f976,2024-07-30T10:33:01.565000Z,whyldwanderer#0,greenbee9327,for refering the documentation and tagging the relevant area tech lead 👏. This helps tech leads communicate  and prioritize effectively,55,21,34,,,,False,False,False,paslar,freshelle,geleeroyale,36.6666666666667,34
164,66a1be79a0f14863528cd52c,2024-07-25T02:54:49.570000Z,koday.eth,lumina.envision,"being such awesome QF WG, hosting X spaces where all of us had a change to shine light on our projects, for support to everyone during the round and great timings of all the reports regarding the round. Highly appreciating the organization process",13,34,3,,,,False,False,False,forestkeeperio,freshelle,ramin,16.6666666666667,31
52,6690e0799b533b9d8fec5955,2024-07-12T07:51:21.135000Z,hanners717#0,mohammad_ranjbar_z,For working a lot  to interview the full stack postition candidates and make a shortlist from lots of send applications,21,34,3,,,,False,False,False,divine_comedian,cherrywiner,ramin,19.3333333333333,31
41,668fd79d9b533b9d8febd92e,2024-07-11T13:01:17.691000Z,koday.eth,greenbee9327,"for coordinating on open Giveth Issues, regularly meeting devs and tracking progress and moving issues to completion after verification 👏",13,34,3,,,,False,False,False,forestkeeperio,freshelle,ramin,16.6666666666667,31
11,6685aa8f4ed52c91f5adb224,2024-07-03T19:46:23.800000Z,koday.eth,oyealmond#0,"for hosting the impromptu $REGEN X Space . Ask great questions, and clarify more around REGEN and the GIV-Earth Round.",34,34,3,,,,False,False,False,forestkeeperio,freshelle,ramin,23.6666666666667,31
132,669a9824a0f1486352856048,2024-07-19T16:45:24.392000Z,koday.eth,karmaticacid#0,"for giving me great, detailed, supportive & constructive feedback for my buddy review. I can tell you all put a lot of love and thought into your responses and I hope I can do you proud by integrating your words & being better 🫡",5,34,3,,,,False,False,False,forestkeeperio,freshelle,ramin,14.0,31
174,66a23cdca0f14863528dd138,2024-07-25T11:54:04.243000Z,koday.eth,snakey_jakey.,"for receiving a gold medal in Giveth surfing, as he paddles, stands and surfs around all his GIV-Earth QF round tasks with ease! 🥇",13,34,3,,,,False,False,False,forestkeeperio,freshelle,ramin,16.6666666666667,31
33,668e38a79b533b9d8feb0cd4,2024-07-10T07:30:47.146000Z,koday.eth,freshelle,"for providing more information on the Arbitrum QF sponsorship and fundraising details, and explaining the fee structure for this specific partner. Thanks for taking the time to explain it to me 🙏🏽",34,34,3,,,,False,False,False,forestkeeperio,freshelle,ramin,23.6666666666667,31
78,669643489b533b9d8ff288ea,2024-07-16T09:54:16.004000Z,koday.eth,snakey_jakey.,"for running another amazing and super successfull QF round, and especially while a majority of the other Giveth stewards were out and about, so it fell soley on him to crush it...and HE DID!",21,34,3,,,,False,False,False,forestkeeperio,freshelle,ramin,19.3333333333333,31
73,6696425b9b533b9d8ff28476,2024-07-16T09:50:19.423000Z,Anamarija#6349,snakey_jakey.,for working hard at the event spreading the galaxy word and for putting in a couple good words with Vitalik for us haha,34,34,5,,,,False,False,False,forestkeeperio,freshelle,ramin,24.3333333333333,29
154,669ff583a0f14863528a009f,2024-07-23T18:25:07.621000Z,Anamarija#6349,nikolacreatrix#0,"for jumping into verification and helping out the team during many new incoming verification applications during Ashley's vaca, lots of ARB projects! Thank you for your help!",34,34,5,,,,False,False,False,forestkeeperio,freshelle,ramin,24.3333333333333,29
186,66a26a4ba0f14863528dfe9e,2024-07-25T15:07:55.516000Z,aubtoshi,griffgreen#0,Taking on GIVbacks v2 (the lottery style GIVbacks program) and bringing it forward! We are in good hands,21,34,5,,,,False,False,False,paslar,freshelle,ramin,20.0,29
147,669ee1e1a0f14863528922c2,2024-07-22T22:49:05.270000Z,juankbell,oyealmond#0,for coordinating a comms consultancy between Gravity - Giveth. Gravity has so much potential on doing amazing things on a comms perspective.,21,34,5,,,,False,False,False,paslar,freshelle,ramin,20.0,29
188,66a26ae4a0f14863528e0083,2024-07-25T15:10:28.810000Z,aubtoshi,griffgreen#0,"for, despite being on the edge of the world, conforming their life style to our team meetings... its HEROIC and heart warming.",21,34,5,,,,False,False,False,paslar,freshelle,ramin,20.0,29
138,669cffe9a0f1486352872061,2024-07-21T12:32:41.774000Z,Maryjaf#2478,kkechy#2713,for finding bugs ;),5,13,34,,,,False,False,False,divine_comedian,cherrywiner,geleeroyale,17.3333333333333,29
191,66a26b5ea0f14863528e0472,2024-07-25T15:12:30.871000Z,aubtoshi,karmaticacid#0,"for an incredibly animated discussion about GIVbacks V2 lottery marketing, I feel like we made super incredible progress and it is such a breath of fresh air to have all the new energy in the marketing sector!!",21,34,5,,,,False,False,False,paslar,freshelle,ramin,20.0,29
88,66979a639b533b9d8ff36c44,2024-07-17T10:18:11.970000Z,ae2079,greenbee9327,for preparing and monitoring release status,5,34,5,,,,False,False,False,divine_comedian,freshelle,ramin,14.6666666666667,29
55,6690e0e29b533b9d8fec5a99,2024-07-12T07:53:06.512000Z,rolazo,mohammad_ranjbar_z,"For gathering information about the failing donations on celo chain, their informatin really helped",13,34,5,,,,False,False,False,forestkeeperio,cherrywiner,ramin,17.3333333333333,29
196,66a26b5ea0f14863528e0475,2024-07-25T15:12:30.876000Z,cordurboi,karmaticacid#0,"for an incredibly animated discussion about GIVbacks V2 lottery marketing, I feel like we made super incredible progress and it is such a breath of fresh air to have all the new energy in the marketing sector!!",5,34,5,,,,False,False,False,divine_comedian,freshelle,ramin,14.6666666666667,29
197,66a26b76a0f14863528e059e,2024-07-25T15:12:54.069000Z,cordurboi,karmaticacid#0,for joining the team STRONG with tons of great marketing ideas and plans for execution,13,34,5,,,,False,False,False,divine_comedian,freshelle,ramin,17.3333333333333,29
198,66a26b76a0f14863528e059d,2024-07-25T15:12:54.069000Z,aubtoshi,karmaticacid#0,for joining the team STRONG with tons of great marketing ideas and plans for execution,13,34,5,,,,False,False,False,paslar,freshelle,ramin,17.3333333333333,29
115,66997d4b9b533b9d8ff4f4c0,2024-07-18T20:38:35.827000Z,kkechy#2713,divine_comedian#0,for working with me on a feature related to google analytics allowing us to track conversion values from donations on the app. he implemented the feature and assisted me with being able to test it properly,34,21,5,,,,False,False,False,divine_comedian,cherrywiner,ramin,20.0,29
114,66997d079b533b9d8ff4f3e0,2024-07-18T20:37:27.329000Z,ae2079,divine_comedian#0,for working through the analytics issues and slowly getting them all into the QA process. Often these new analytics features encountered complex issues and bugs. He worked dilligently to find the cause and imeplement solutions to them.,34,34,5,,,,False,False,False,divine_comedian,freshelle,ramin,24.3333333333333,29
46,6690df759b533b9d8fec52a9,2024-07-12T07:47:01.457000Z,ae2079,mohammad_ranjbar_z,For his patience to work on the issues and being positive about feedbacks on his PRs,13,34,5,,,,False,False,False,divine_comedian,freshelle,ramin,17.3333333333333,29
106,66997bad9b533b9d8ff4edd6,2024-07-18T20:31:41.645000Z,nikolacreatrix#0,divine_comedian#0,"for their continued work on the leadership review, processing reports, creating loom videos and putting delicate thought into each step of the process and also their forward thinking in analyzing how this can be optimized for future reviews",34,34,5,,,,False,False,False,paslar,cherrywiner,ramin,24.3333333333333,29
131,669a9824a0f1486352856049,2024-07-19T16:45:24.392000Z,mohammad_ranjbar_z,karmaticacid#0,"for giving me great, detailed, supportive & constructive feedback for my buddy review. I can tell you all put a lot of love and thought into your responses and I hope I can do you proud by integrating your words & being better 🫡",5,34,21,,,,False,False,False,divine_comedian,freshelle,geleeroyale,20.0,29
86,66979a639b533b9d8ff36c43,2024-07-17T10:18:11.969000Z,Maryjaf#2478,greenbee9327,for preparing and monitoring release status,5,13,34,,,,False,False,False,divine_comedian,cherrywiner,geleeroyale,17.3333333333333,29
135,669aab1ea0f14863528625bf,2024-07-19T18:06:22.126000Z,divine_comedian#0,Amin#2164,for making the first draft of upgradable devouch resolve,34,21,5,,,,False,False,False,paslar,freshelle,nicbals,20.0,29
31,668cfa0c9b533b9d8fea8213,2024-07-09T08:51:24.795000Z,ae2079,geleeroyale,for merging updates to staging that effectively stopped our frequent and concerning CPU spikes. Why did they stop though?,21,34,5,,,,False,False,False,divine_comedian,freshelle,ramin,20.0,29
180,66a251cfa0f14863528ddd35,2024-07-25T13:23:27.792000Z,ae2079,divine_comedian#0,"for their great work in developing all of the enhancements to our analytics dasbhboard. Thanks to their work we are now able to track in realtime useage statistics around some of our biggest dapp features, giving us better product & marketing insights",34,34,5,,,,False,False,False,divine_comedian,freshelle,ramin,24.3333333333333,29
137,669cffd9a0f1486352871f7f,2024-07-21T12:32:25.013000Z,ramramez#0,kkechy#2713,for fast reviews and deploy,13,5,34,,,,False,False,False,forestkeeperio,cherrywiner,geleeroyale,17.3333333333333,29
168,66a23af1a0f14863528dcaa3,2024-07-25T11:45:53.121000Z,parrachia#0,snakey_jakey.,"for receiving a gold medal in archery, as he is always on point with his actions and results at GM GM, plus is another great buddy 🥇",8,5,34,,,,False,False,False,divine_comedian,freshelle,geleeroyale,15.6666666666667,29
237,66a6249ca0f148635291f568,2024-07-28T10:59:40.076000Z,ae2079,ramramez#0,for his great efforts for optimizing SQL queries,13,34,5,,,,False,False,False,divine_comedian,freshelle,ramin,17.3333333333333,29
30,668cf9749b533b9d8fea7fa6,2024-07-09T08:48:52.808000Z,rolazo,geleeroyale,for his in depth analysis of a recent crash in staging (https://github.com/Giveth/devops/issues/242) 🚀,13,34,5,,,,False,False,False,forestkeeperio,cherrywiner,ramin,17.3333333333333,29
218,66a26ee3a0f14863528e1530,2024-07-25T15:27:31.682000Z,spacemonk5821,nikolacreatrix#0,"for joining the Giveth town hall, dishing their first praise, and becoming part of the Giveth community! Welcome!!! 🤗 🎉",34,21,8,,,,False,False,False,forestkeeperio,cherrywiner,geleeroyale,21.0,26
24,668c02749b533b9d8fea0068,2024-07-08T15:15:00.921000Z,divine_comedian#0,nikolacreatrix#0,for inventing such a cool DAO tool as the season voting simulator! Super helpful for the final overall assessment picture!,34,34,8,,,,False,False,False,paslar,freshelle,nicbals,25.3333333333333,26
49,6690dff39b533b9d8fec554c,2024-07-12T07:49:07.906000Z,divine_comedian#0,mohammad_ranjbar_z,"For trying to unblock everyone in the team, he does everything he can , a lot more than his responsibilites, I really thank him for his great attitude",34,34,8,,,,False,False,False,paslar,freshelle,nicbals,25.3333333333333,26
121,669a970e9b533b9d8ff5c39a,2024-07-19T16:40:46.112000Z,divine_comedian#0,karmaticacid#0,for all the effort they put into catherding folks to give me feedback for my buddy review. it was amazing to have 11 feedbacks to go through! thank you so much!,34,21,8,,,,False,False,False,paslar,freshelle,nicbals,21.0,26
43,668ff9ef9b533b9d8febedd0,2024-07-11T15:27:43.853000Z,ramramez#0,kkechy#2713,once again I praise Ramin for being such a nice guy and fast in response and reviewing PRs 💯,8,13,34,,,,False,False,False,forestkeeperio,cherrywiner,geleeroyale,18.3333333333333,26
60,669500299b533b9d8ff1ce78,2024-07-15T10:55:37.705000Z,ramramez#0,mohammad_ranjbar_z,For his great solution for hotfixes and working a lot on the Backend side,8,13,34,,,,False,False,False,forestkeeperio,cherrywiner,geleeroyale,18.3333333333333,26
232,66a3e9d7a0f148635290cf00,2024-07-26T18:24:23.424000Z,karmaticacid#0,karmaticacid#0,for the amazing last minute rallying to get the GIV-arb round set up and ready to go!!,34,34,8,,,,False,False,False,paslar,cherrywiner,nicbals,25.3333333333333,26
176,66a23db5a0f14863528dd2fa,2024-07-25T11:57:41.267000Z,freshelle,snakey_jakey.,"for receiving a gold medal in Giveth sailing, as she sets sail to all my financial questions 🥇",13,34,8,,,,False,False,False,paslar,cherrywiner,ramin,18.3333333333333,26
124,669a9824a0f1486352856045,2024-07-19T16:45:24.390000Z,wmb81321,karmaticacid#0,"for giving me great, detailed, supportive & constructive feedback for my buddy review. I can tell you all put a lot of love and thought into your responses and I hope I can do you proud by integrating your words & being better 🫡",8,34,34,,,,False,False,False,divine_comedian,cherrywiner,nicbals,25.3333333333333,26
234,66a3e9d7a0f148635290ceff,2024-07-26T18:24:23.424000Z,Maryjaf#2478,karmaticacid#0,for the amazing last minute rallying to get the GIV-arb round set up and ready to go!!,8,34,34,,,,False,False,False,divine_comedian,cherrywiner,geleeroyale,25.3333333333333,26
20,668bd1049b533b9d8fe9e63e,2024-07-08T11:44:04.586000Z,karmaticacid#0,Amin#2164,for completing the buddy review form and providing such impressive constructive feedback. Your insights not only uplift my spirits but also offer invaluable guidance for me to make a better version of myself. I'm supper happy by seeing how much my colleagues care about me.,55,34,55,,,,False,False,False,paslar,cherrywiner,nicbals,48.0,21
40,668fd79d9b533b9d8febd92d,2024-07-11T13:01:17.691000Z,divine_comedian#0,greenbee9327,"for coordinating on open Giveth Issues, regularly meeting devs and tracking progress and moving issues to completion after verification 👏",34,34,13,,,,False,False,False,paslar,freshelle,nicbals,27.0,21
224,66a2a979a0f14863528e53f9,2024-07-25T19:37:29.093000Z,karmaticacid#0,Amin#2164,for learning who to work with Dune and doing most of dashboard tuning and renaming.,34,21,13,,,,False,False,False,paslar,cherrywiner,nicbals,22.6666666666667,21
250,66a8201ea0f14863529394f9,2024-07-29T23:05:02.971000Z,karmaticacid#0,ramramez#0,for testing QF and passport score issues and fixing them until late at night and making app ready for the next QF round. You are Giveth heros!,34,21,13,,,,False,False,False,paslar,cherrywiner,nicbals,22.6666666666667,21
267,66a91b80476b50fa69888eba,2024-07-30T16:57:36.038000Z,whyldwanderer#0,lumina.envision,being such awesome support with all regarding QF applications and project verification. Thank you for always being there with individual support of each and other coming with their questions 🙏  and I know there are a lot! 🖤,55,34,34,,,,False,False,False,paslar,freshelle,geleeroyale,41.0,21
240,66a7a701a0f1486352932761,2024-07-29T14:28:17.238000Z,tamarandom,karmaticacid#0,"for inspiring my devcon talk and helping me to get some cool ideas together for a ""leadership"" talk that I think could be really fun and funny! just submitted and I'm feeling good about it!",13,21,34,,,,False,False,False,divine_comedian,freshelle,nicbals,22.6666666666667,21
15,66870c424ed52c91f5ae6dc6,2024-07-04T20:55:30.221000Z,whyldwanderer#0,senryu,for helping me move/bridge/swap to get some USDGLO on CELO for the Giv-EARTH round,34,21,13,,,,False,False,False,paslar,freshelle,geleeroyale,22.6666666666667,21
6,668568184ed52c91f5ad72eb,2024-07-03T15:02:48.496000Z,divine_comedian#0,hanners717#0,for being super involved in the hiring process for the marketing and community building. He’s everywhere in the Recruitee notes and interviewing candidates,21,34,13,,,,False,False,False,paslar,freshelle,nicbals,22.6666666666667,21
21,668bd1049b533b9d8fe9e63d,2024-07-08T11:44:04.586000Z,divine_comedian#0,Amin#2164,for completing the buddy review form and providing such impressive constructive feedback. Your insights not only uplift my spirits but also offer invaluable guidance for me to make a better version of myself. I'm supper happy by seeing how much my colleagues care about me.,55,34,55,,,,False,False,False,paslar,freshelle,nicbals,48.0,21
4,668567f24ed52c91f5ad7129,2024-07-03T15:02:10.543000Z,karmaticacid#0,hanners717#0,"for our 1-on-1 syncs that have been super productive for HR topics, leading to clearer decisions making, planning, and contributor success. Plus it’s always fun to hang out!",34,55,34,,,,False,False,False,paslar,cherrywiner,nicbals,41.0,21
233,66a3e9d7a0f148635290cf01,2024-07-26T18:24:23.424000Z,whyldwanderer#0,karmaticacid#0,for the amazing last minute rallying to get the GIV-arb round set up and ready to go!!,55,34,34,,,,False,False,False,paslar,freshelle,geleeroyale,41.0,21
242,66a7ad9ca0f148635293303c,2024-07-29T14:56:28.556000Z,ramramez#0,karmaticacid#0,working super hard & super coordinated to get our issues fixed for the upcoming QF round and merge changes to production,13,34,34,,,,False,False,False,forestkeeperio,cherrywiner,geleeroyale,27.0,21
102,66997afe9b533b9d8ff4eb10,2024-07-18T20:28:46.647000Z,mohammad_ranjbar_z,divine_comedian#0,"for making great progress on the endaoment integration, integrating the projects into our database, configuring notifications, writing migrations and taking on the front-end work to get this integration ready for QA in a very efficient manner",34,34,55,,,,False,False,False,divine_comedian,freshelle,geleeroyale,41.0,21
75,6696429d9b533b9d8ff28648,2024-07-16T09:51:25.878000Z,missgene#0,snakey_jakey.,for all her hard work organizing the accomodations for all of us. It was no easy feat but she knocked it out the park,34,34,55,,,,False,False,False,forestkeeperio,freshelle,geleeroyale,41.0,21
54,6690e0e29b533b9d8fec5a9a,2024-07-12T07:53:06.512000Z,carlos096,mohammad_ranjbar_z,"For gathering information about the failing donations on celo chain, their informatin really helped",34,34,55,,,,False,False,False,paslar,cherrywiner,geleeroyale,41.0,21
177,66a23ffda0f14863528dd3da,2024-07-25T12:07:25.495000Z,karmaticacid#0,snakey_jakey.,"for receiving a gold medal in Giveth triatholon, as she has been crushes it within the GIVeconomy, dApp, and  QF groups 🥇",21,34,13,,,,False,False,False,paslar,cherrywiner,nicbals,22.6666666666667,21
152,669f2d9ca0f1486352895aa7,2024-07-23T04:12:12.063000Z,karmaticacid#0,wmb81321,For providing me with real and detailed feedback on my trial period. I sincerely appreciate it because it helps me improve my value to Giveth. Outside perspectives and respectful feedback are invaluable for understanding and clarifying concerns about performance 🙏,55,34,34,,,,False,False,False,paslar,cherrywiner,nicbals,41.0,21
183,66a269e4a0f14863528dfd95,2024-07-25T15:06:12.577000Z,robertointech,griffgreen#0,for taking GIVbacks recirc review out of my hands... you are doing incredible work and i can't tell you how much i appreciate it,55,34,34,,,,False,False,False,divine_comedian,freshelle,geleeroyale,41.0,21
187,66a26ae4a0f14863528e0085,2024-07-25T15:10:28.810000Z,missgene#0,griffgreen#0,"for, despite being on the edge of the world, conforming their life style to our team meetings... its HEROIC and heart warming.",55,34,55,,,,False,False,False,forestkeeperio,freshelle,geleeroyale,48.0,21
101,66997aa19b533b9d8ff4ea31,2024-07-18T20:27:13.540000Z,dearhaija,divine_comedian#0,"for coming into Giveth QA testing learning all the ropes and navigating how to test Giveth features. In the absence of clear documentation or unclear instructions she has done her best to provide punctual and well written test result reporting. She asks questsions and takes on new tasks in an efficient manner, great to have her!",34,34,55,,,,False,False,False,forestkeeperio,freshelle,nicbals,41.0,21
194,66a26b5ea0f14863528e0474,2024-07-25T15:12:30.876000Z,karmaticacid#0,karmaticacid#0,"for an incredibly animated discussion about GIVbacks V2 lottery marketing, I feel like we made super incredible progress and it is such a breath of fresh air to have all the new energy in the marketing sector!!",34,55,34,,,,False,False,False,paslar,cherrywiner,nicbals,41.0,21
118,66997dbc9b533b9d8ff4f6a1,2024-07-18T20:40:28.863000Z,karmaticacid#0,divine_comedian#0,"for facilitating the GIVeconomy call today and pushing forward on a wide variety of issues and making sure nothing slips through the cracks for GIV token and GIVeconomy issues, bugs and feature planning",55,55,34,,,,False,False,False,paslar,cherrywiner,nicbals,48.0,21
211,66a26cb6a0f14863528e0e27,2024-07-25T15:18:14.685000Z,robertointech,karmaticacid#0,"for all the great work onboarding to our GIVbacks recirculation review team, it's so nice to be loading this off of Griff and you guys have been great communicators!",55,34,34,66a269e4a0f14863528dfd95,,66a269e4a0f14863528dfd95,False,False,False,divine_comedian,freshelle,geleeroyale,11.3333333333333,21
222,66a28caea0f14863528e3491,2024-07-25T17:34:38.836000Z,hanners717#0,koday.eth,"For being a great HR contact, a kind soul, and listening intently!",13,21,3,,,,False,False,False,divine_comedian,cherrywiner,ramin,12.3333333333333,18
76,669642c89b533b9d8ff28729,2024-07-16T09:52:08.672000Z,parrachia#0,snakey_jakey.,"for working hard to line up a couple new clients, and not only for GM GM but looking even bigger for the needs now. Plus he is just a great joy to be around and never dissapoints IRL",5,3,21,,,,False,False,False,divine_comedian,freshelle,geleeroyale,9.66666666666667,18
26,668c8ba89b533b9d8fea4b5f,2024-07-09T01:00:24.478000Z,hanners717#0,cherrywiner,"for checking in on me and for sharing knowledge on the web3 communities all over the world, I was so hooked!",8,21,3,,,,False,False,False,divine_comedian,cherrywiner,ramin,10.6666666666667,18
129,669a9824a0f148635285604a,2024-07-19T16:45:24.392000Z,hanners717#0,karmaticacid#0,"for giving me great, detailed, supportive & constructive feedback for my buddy review. I can tell you all put a lot of love and thought into your responses and I hope I can do you proud by integrating your words & being better 🫡",8,21,3,,,,False,False,False,divine_comedian,cherrywiner,ramin,10.6666666666667,18
169,66a23b3aa0f14863528dcb84,2024-07-25T11:47:06.933000Z,hanners717#0,snakey_jakey.,"for receiving a gold medal in AIDS conference panel discussion badminton, as she went to the conference and rep'd Giveth hard. 🥇",21,21,3,,,,False,False,False,divine_comedian,cherrywiner,ramin,15.0,18
96,669950c59b533b9d8ff4d4a8,2024-07-18T17:28:37.212000Z,divine_comedian#0,.paslar,for prompting me to sign upo for Praise on Giveth,21,13,3,,,,False,False,False,paslar,freshelle,nicbals,12.3333333333333,18
16,6687ef474ed52c91f5aed90c,2024-07-05T13:04:07.618000Z,rolazo,kkechy#2713,for providing me key adn isntruction for use vpn for administration,13,21,5,,,,False,False,False,forestkeeperio,cherrywiner,ramin,13.0,16
85,66978f339b533b9d8ff36730,2024-07-17T09:30:27.713000Z,ae2079,mohammad_ranjbar_z,"For creating release PRs, it really helped",21,21,5,,,,False,False,False,divine_comedian,freshelle,ramin,15.6666666666667,16
215,66a26ee3a0f14863528e1532,2024-07-25T15:27:31.682000Z,forestkeeperio,nikolacreatrix#0,"for joining the Giveth town hall, dishing their first praise, and becoming part of the Giveth community! Welcome!!! 🤗 🎉",13,21,5,,,,False,False,False,paslar,freshelle,ramin,13.0,16
87,66979a639b533b9d8ff36c46,2024-07-17T10:18:11.970000Z,kkechy#2713,greenbee9327,for preparing and monitoring release status,8,21,5,,,,False,False,False,divine_comedian,cherrywiner,ramin,11.3333333333333,16
263,66a8f529a0f148635294233d,2024-07-30T14:14:01.432000Z,karmaticacid#0,Maryjaf#2478,for working hard on QF release,21,21,5,,,,False,False,False,paslar,cherrywiner,nicbals,15.6666666666667,16
217,66a26ee3a0f14863528e152f,2024-07-25T15:27:31.682000Z,aubtoshi,nikolacreatrix#0,"for joining the Giveth town hall, dishing their first praise, and becoming part of the Giveth community! Welcome!!! 🤗 🎉",13,21,5,,,,False,False,False,paslar,freshelle,ramin,13.0,16
119,66997f3d9b533b9d8ff4f782,2024-07-18T20:46:53.086000Z,nikolacreatrix#0,giantkin#0,"Giving full credit for support coverage here. i seldom get in, or know the answer.  others do all the lift here.",8,21,5,,,,False,False,False,paslar,cherrywiner,ramin,11.3333333333333,16
150,669eedf3a0f14863528934a9,2024-07-22T23:40:35.386000Z,nikolacreatrix#0,forestkeeperio,For helping me get a better understanding of how giveth support ticket works and by helping me with all my questions about project verification,8,21,5,,,,False,False,False,paslar,cherrywiner,ramin,11.3333333333333,16
156,669ff5eda0f14863528a01a1,2024-07-23T18:26:53.371000Z,ghaemian,nikolacreatrix#0,"for providing me with beautiful, constructive, encouraging, and appreciative feedback! It means a lot and I want to take all your insights to my heart and work on improving my contributions. 🙏",21,21,5,,,,False,False,False,forestkeeperio,cherrywiner,ramin,15.6666666666667,16
