65c47c1e7a231cf482e4cd21,2024-02-08T07:00:46.087000Z,Amin#2164,63344aa8144cdd9b89d1a234,0xF23eA0b5F14afcbe532A1df273F7B233EBe41C78,greenbee9327,65280d5f5b301983ec9805bc,0x44AC194359fA44eCe6Cb2E53E8c90547BCCb95a0,for working on automating common GivEconomy and post QF tasks in adminBro.,DISCORD:679428761438912522:759816279623467023,DISCORD:Giveth:%F0%9F%92%B9%E2%94%8Bgiv-economy,21,21,8,,,,False,False,False,whyldwanderer,0xed8DB37778804A913670d9367aAf4F043AAd938b,hanners717,0x711CDABCFdEDEf2c82D9dA533268D8bB6b7468f8,nicbals,0xd9D5d85B2682830aC58A78c279E0C177953738b4,16.6666666666667,0.001603592046183454,101.11866581141777
65c48a3f7a231cf482e4d5d6,2024-02-08T08:01:03.927000Z,divine_comedian#0,63330f21144cdd9b89d11bff,0x826976d7C600d45FB8287CA1d7c76FC8eb732030,moenick,63335999144cdd9b89d13d4a,0xA4D506434445Bb7303eA34A07bc38484cdC64a95,for leading the projet quality improvements epic,DISCORD:679428761438912522:823570903219568700,DISCORD:Giveth:%F0%9F%92%9C%E2%94%8Bpraise,3,3,8,,,,False,False,False,ramin,0x10a84b835C5df26f2A380B3E00bCC84A66cD2d34,almondoyealmond,0x0D22735DE6d34DC2ed5efDbC2f30D7Aa8e2B9F8e,andrealomelin,0xd91B4Ca4159cFDF90453B3fDb6405a9DFee4B88c,4.66666666666667,0.0004490057729313665,28.313226427196938
65c4b9f87a231cf482e4fc3d,2024-02-08T11:24:40.705000Z,moenick,63335999144cdd9b89d13d4a,0xA4D506434445Bb7303eA34A07bc38484cdC64a95,greenbee9327,65280d5f5b301983ec9805bc,0x44AC194359fA44eCe6Cb2E53E8c90547BCCb95a0,for regularly assigning me in on the new development requests as github tasks with relevant priority labels. This is helping bring a lot of clarity and predictability in the development plan. Huge praise for their regular and consistent efforts ðŸ‘ ðŸ’œ,DISCORD:679428761438912522:823570903219568700,DISCORD:Giveth:%F0%9F%92%9C%E2%94%8Bpraise,13,55,55,,,,False,False,False,divine_comedian,0x826976d7C600d45FB8287CA1d7c76FC8eb732030,almondoyealmond,0x0D22735DE6d34DC2ed5efDbC2f30D7Aa8e2B9F8e,juan_work,0xFEF5A1A2b3754A2F53161EaaAcb3EB889F004d4a,41.0,0.003944836433611289,248.75191789608724
65c4b9f87a231cf482e4fc3b,2024-02-08T11:24:40.705000Z,divine_comedian#0,63330f21144cdd9b89d11bff,0x826976d7C600d45FB8287CA1d7c76FC8eb732030,greenbee9327,65280d5f5b301983ec9805bc,0x44AC194359fA44eCe6Cb2E53E8c90547BCCb95a0,for regularly assigning me in on the new development requests as github tasks with relevant priority labels. This is helping bring a lot of clarity and predictability in the development plan. Huge praise for their regular and consistent efforts ðŸ‘ ðŸ’œ,DISCORD:679428761438912522:823570903219568700,DISCORD:Giveth:%F0%9F%92%9C%E2%94%8Bpraise,3,8,55,,,,False,False,False,ramin,0x10a84b835C5df26f2A380B3E00bCC84A66cD2d34,almondoyealmond,0x0D22735DE6d34DC2ed5efDbC2f30D7Aa8e2B9F8e,andrealomelin,0xd91B4Ca4159cFDF90453B3fDb6405a9DFee4B88c,22.0,0.002116741500962155,133.4766388710712
65c4b9f87a231cf482e4fc3c,2024-02-08T11:24:40.705000Z,karmaticacid#0,63333aed144cdd9b89d12f9d,0xC46c67Bb7E84490D7EbdD0b8ecDaca68Cf3823F4,greenbee9327,65280d5f5b301983ec9805bc,0x44AC194359fA44eCe6Cb2E53E8c90547BCCb95a0,for regularly assigning me in on the new development requests as github tasks with relevant priority labels. This is helping bring a lot of clarity and predictability in the development plan. Huge praise for their regular and consistent efforts ðŸ‘ ðŸ’œ,DISCORD:679428761438912522:823570903219568700,DISCORD:Giveth:%F0%9F%92%9C%E2%94%8Bpraise,21,55,13,,,,False,False,False,whyldwanderer,0xed8DB37778804A913670d9367aAf4F043AAd938b,almondoyealmond,0x0D22735DE6d34DC2ed5efDbC2f30D7Aa8e2B9F8e,nikola_creatrix,0x9924285ff2207D6e36642B6832A515A6a3aedCAB,29.6666666666667,0.0028543938422065456,179.99122514432347
65c4f8507a231cf482e56dba,2024-02-08T15:50:40.040000Z,karmaticacid#0,63333aed144cdd9b89d12f9d,0xC46c67Bb7E84490D7EbdD0b8ecDaca68Cf3823F4,Steffan | SteeTweets#9260,635a84588622e4e2bd2ed9ad,0xdb7a41e39807E8C988859f150296Db92674b7dc7,"for handling all of GCC QF round questions with finesse. Looks like weâ€™re about to start a long-term sponsorship for Giveth. And welcome a new language group, Chinese, to the Giveth community. Super excited for this development.",DISCORD:679428761438912522:823570903219568700,DISCORD:Giveth:%F0%9F%92%9C%E2%94%8Bpraise,13,21,8,,,,False,False,False,whyldwanderer,0xed8DB37778804A913670d9367aAf4F043AAd938b,almondoyealmond,0x0D22735DE6d34DC2ed5efDbC2f30D7Aa8e2B9F8e,nikola_creatrix,0x9924285ff2207D6e36642B6832A515A6a3aedCAB,14.0,0.0013470173187940988,84.93967928159076
65c507547a231cf482e584bf,2024-02-08T16:54:44.456000Z,oyealmond#0,63335947144cdd9b89d13d13,0x0D22735DE6d34DC2ed5efDbC2f30D7Aa8e2B9F8e,divine_comedian#0,63330f21144cdd9b89d11bff,0x826976d7C600d45FB8287CA1d7c76FC8eb732030,"for all of the constant work they have done in reaching out to project building on Solana and onboarding them onto Giveth, tons and tons of very tedious outreaching work and I appreciate the efforts",DISCORD:679428761438912522:823570903219568700,DISCORD:Giveth:%F0%9F%92%9C%E2%94%8Bpraise,34,13,55,,,,False,False,False,divine_comedian,0x826976d7C600d45FB8287CA1d7c76FC8eb732030,karmaticacid,0xC46c67Bb7E84490D7EbdD0b8ecDaca68Cf3823F4,juan_work,0xFEF5A1A2b3754A2F53161EaaAcb3EB889F004d4a,34.0,0.0032713277742142397,206.28207825529182
65c507547a231cf482e584c0,2024-02-08T16:54:44.456000Z,nikolacreatrix#0,63331e93144cdd9b89d1232a,0x9924285ff2207D6e36642B6832A515A6a3aedCAB,divine_comedian#0,63330f21144cdd9b89d11bff,0x826976d7C600d45FB8287CA1d7c76FC8eb732030,"for all of the constant work they have done in reaching out to project building on Solana and onboarding them onto Giveth, tons and tons of very tedious outreaching work and I appreciate the efforts",DISCORD:679428761438912522:823570903219568700,DISCORD:Giveth:%F0%9F%92%9C%E2%94%8Bpraise,0,21,13,65c2796f7a231cf482e24f43,,,False,False,False,whyldwanderer,0xed8DB37778804A913670d9367aAf4F043AAd938b,hanners717,0x711CDABCFdEDEf2c82D9dA533268D8bB6b7468f8,andrealomelin,0xd91B4Ca4159cFDF90453B3fDb6405a9DFee4B88c,11.3333333333333,0.0010904425914047434,68.76069275176374
65c507547a231cf482e584be,2024-02-08T16:54:44.456000Z,whyldwanderer#0,63332c97144cdd9b89d1295c,0xed8DB37778804A913670d9367aAf4F043AAd938b,divine_comedian#0,63330f21144cdd9b89d11bff,0x826976d7C600d45FB8287CA1d7c76FC8eb732030,"for all of the constant work they have done in reaching out to project building on Solana and onboarding them onto Giveth, tons and tons of very tedious outreaching work and I appreciate the efforts",DISCORD:679428761438912522:823570903219568700,DISCORD:Giveth:%F0%9F%92%9C%E2%94%8Bpraise,3,13,34,,,,False,False,False,ramin,0x10a84b835C5df26f2A380B3E00bCC84A66cD2d34,karmaticacid,0xC46c67Bb7E84490D7EbdD0b8ecDaca68Cf3823F4,nicbals,0xd9D5d85B2682830aC58A78c279E0C177953738b4,16.6666666666667,0.001603592046183454,101.11866581141777
65c507827a231cf482e585b7,2024-02-08T16:55:30.335000Z,moenick,63335999144cdd9b89d13d4a,0xA4D506434445Bb7303eA34A07bc38484cdC64a95,divine_comedian#0,63330f21144cdd9b89d11bff,0x826976d7C600d45FB8287CA1d7c76FC8eb732030,"for PMing the Solana integration, a huge milestone for Giveth and received with massive applause! I still can't believe he did it with the dev crew, great work!",DISCORD:679428761438912522:823570903219568700,DISCORD:Giveth:%F0%9F%92%9C%E2%94%8Bpraise,55,21,34,,,,False,False,False,divine_comedian,0x826976d7C600d45FB8287CA1d7c76FC8eb732030,almondoyealmond,0x0D22735DE6d34DC2ed5efDbC2f30D7Aa8e2B9F8e,juan_work,0xFEF5A1A2b3754A2F53161EaaAcb3EB889F004d4a,36.6666666666667,0.003527902501603595,222.46106478511885
65c514c57a231cf482e5a166,2024-02-08T17:52:05.887000Z,whyldwanderer#0,63332c97144cdd9b89d1295c,0xed8DB37778804A913670d9367aAf4F043AAd938b,luxumbra.eth,64206f18098fd1f9393cb354,0x78Ec73423B222cB225549bab0d0a812d58808Ffd,for helping with getting our project verified.  ðŸ™  ðŸ’š,DISCORD:679428761438912522:823570903219568700,DISCORD:Giveth:%F0%9F%92%9C%E2%94%8Bpraise,3,3,5,,,,False,False,False,ramin,0x10a84b835C5df26f2A380B3E00bCC84A66cD2d34,karmaticacid,0xC46c67Bb7E84490D7EbdD0b8ecDaca68Cf3823F4,nicbals,0xd9D5d85B2682830aC58A78c279E0C177953738b4,3.66666666666667,0.0003527902501603595,22.246106478511884
65c527d47a231cf482e5f28c,2024-02-08T19:13:24.623000Z,giantkin#0,63332451144cdd9b89d1258f,0xff75E131c711e4310C045317779d39B3B4f718C4,griffgreen#0,633339fe144cdd9b89d12f30,0x839395e20bbB182fa440d08F850E6c7A8f6F0780,For being really proactive on signing the donation multisig to claim the Octant funds!,DISCORD:679428761438912522:773912257368817684,DISCORD:Giveth:%F0%9F%94%91%E2%94%8Bmultisigs,13,34,21,,,,False,False,False,whyldwanderer,0xed8DB37778804A913670d9367aAf4F043AAd938b,hanners717,0x711CDABCFdEDEf2c82D9dA533268D8bB6b7468f8,andrealomelin,0xd91B4Ca4159cFDF90453B3fDb6405a9DFee4B88c,22.6666666666667,0.0021808851828094963,137.52138550352808
65c527d47a231cf482e5f28d,2024-02-08T19:13:24.623000Z,divine_comedian#0,63330f21144cdd9b89d11bff,0x826976d7C600d45FB8287CA1d7c76FC8eb732030,griffgreen#0,633339fe144cdd9b89d12f30,0x839395e20bbB182fa440d08F850E6c7A8f6F0780,For being really proactive on signing the donation multisig to claim the Octant funds!,DISCORD:679428761438912522:773912257368817684,DISCORD:Giveth:%F0%9F%94%91%E2%94%8Bmultisigs,3,34,34,,,,False,False,False,ramin,0x10a84b835C5df26f2A380B3E00bCC84A66cD2d34,almondoyealmond,0x0D22735DE6d34DC2ed5efDbC2f30D7Aa8e2B9F8e,andrealomelin,0xd91B4Ca4159cFDF90453B3fDb6405a9DFee4B88c,23.6666666666667,0.0022771007055805035,143.58850545221316
65c527d47a231cf482e5f28e,2024-02-08T19:13:24.624000Z,freshelle,63345c87144cdd9b89d1aaae,0x38f80f8f76B1C44B2beeFB63bb561F570fb6ddB6,griffgreen#0,633339fe144cdd9b89d12f30,0x839395e20bbB182fa440d08F850E6c7A8f6F0780,For being really proactive on signing the donation multisig to claim the Octant funds!,DISCORD:679428761438912522:773912257368817684,DISCORD:Giveth:%F0%9F%94%91%E2%94%8Bmultisigs,13,21,5,,,,False,False,False,whyldwanderer,0xed8DB37778804A913670d9367aAf4F043AAd938b,almondoyealmond,0x0D22735DE6d34DC2ed5efDbC2f30D7Aa8e2B9F8e,nicbals,0xd9D5d85B2682830aC58A78c279E0C177953738b4,13.0,0.0012508017960230916,78.8725593329057
65c548247a231cf482e63919,2024-02-08T21:31:16.086000Z,divine_comedian#0,63330f21144cdd9b89d11bff,0x826976d7C600d45FB8287CA1d7c76FC8eb732030,karmaticacid#0,63333aed144cdd9b89d12f9d,0xC46c67Bb7E84490D7EbdD0b8ecDaca68Cf3823F4,"for making so many multisig txs for me. tbh, multisig tx creation for me is soo confusing, so I always go to him when I need important stuff for QF and it's SO nice to have him be so reliable, precise & consistent, and prompt for creating all kinds of txs from matching funds dispersal to moving funds to pay for sybil analysis or for round fees, it's just soo great",DISCORD:679428761438912522:823570903219568700,DISCORD:Giveth:%F0%9F%92%9C%E2%94%8Bpraise,3,55,89,,,,False,False,False,ramin,0x10a84b835C5df26f2A380B3E00bCC84A66cD2d34,almondoyealmond,0x0D22735DE6d34DC2ed5efDbC2f30D7Aa8e2B9F8e,andrealomelin,0xd91B4Ca4159cFDF90453B3fDb6405a9DFee4B88c,49.0,0.0047145606157793455,297.28887748556764
65c548647a231cf482e63c8e,2024-02-08T21:32:20.739000Z,greenbee9327,65280d5f5b301983ec9805bc,0x44AC194359fA44eCe6Cb2E53E8c90547BCCb95a0,karmaticacid#0,63333aed144cdd9b89d12f9d,0xC46c67Bb7E84490D7EbdD0b8ecDaca68Cf3823F4,"for the INCREDIBLE work she is doing managing developers and issues accross so many Giveth & GM products. She started quiet & observing and now I see her acting as such an epic powerhouse, really finding her flow within Giveth & bringing so much order, precision & expertise to our work. Damn, it is good to have a CTO!",DISCORD:679428761438912522:823570903219568700,DISCORD:Giveth:%F0%9F%92%9C%E2%94%8Bpraise,5,34,34,,,,False,False,False,ramin,0x10a84b835C5df26f2A380B3E00bCC84A66cD2d34,karmaticacid,0xC46c67Bb7E84490D7EbdD0b8ecDaca68Cf3823F4,nicbals,0xd9D5d85B2682830aC58A78c279E0C177953738b4,24.3333333333333,0.002341244387427835,147.63325208466946
65c548997a231cf482e63da6,2024-02-08T21:33:13.273000Z,moenick,63335999144cdd9b89d13d4a,0xA4D506434445Bb7303eA34A07bc38484cdC64a95,karmaticacid#0,63333aed144cdd9b89d12f9d,0xC46c67Bb7E84490D7EbdD0b8ecDaca68Cf3823F4,for supporting me on estimating costs for various parts of the QF WG proposal. this proposal was long overdue so I really needed all your help so much!,DISCORD:679428761438912522:823570903219568700,DISCORD:Giveth:%F0%9F%92%9C%E2%94%8Bpraise,21,55,55,,,,False,False,False,divine_comedian,0x826976d7C600d45FB8287CA1d7c76FC8eb732030,almondoyealmond,0x0D22735DE6d34DC2ed5efDbC2f30D7Aa8e2B9F8e,juan_work,0xFEF5A1A2b3754A2F53161EaaAcb3EB889F004d4a,43.6666666666667,0.004201411161000645,264.93090442591426
65c548997a231cf482e63da5,2024-02-08T21:33:13.273000Z,whyldwanderer#0,63332c97144cdd9b89d1295c,0xed8DB37778804A913670d9367aAf4F043AAd938b,karmaticacid#0,63333aed144cdd9b89d12f9d,0xC46c67Bb7E84490D7EbdD0b8ecDaca68Cf3823F4,for supporting me on estimating costs for various parts of the QF WG proposal. this proposal was long overdue so I really needed all your help so much!,DISCORD:679428761438912522:823570903219568700,DISCORD:Giveth:%F0%9F%92%9C%E2%94%8Bpraise,3,8,13,,,,False,False,False,ramin,0x10a84b835C5df26f2A380B3E00bCC84A66cD2d34,karmaticacid,0xC46c67Bb7E84490D7EbdD0b8ecDaca68Cf3823F4,nicbals,0xd9D5d85B2682830aC58A78c279E0C177953738b4,8.0,0.0007697241821680564,48.53695958948043
65c548997a231cf482e63da8,2024-02-08T21:33:13.274000Z,nikolacreatrix#0,63331e93144cdd9b89d1232a,0x9924285ff2207D6e36642B6832A515A6a3aedCAB,karmaticacid#0,63333aed144cdd9b89d12f9d,0xC46c67Bb7E84490D7EbdD0b8ecDaca68Cf3823F4,for supporting me on estimating costs for various parts of the QF WG proposal. this proposal was long overdue so I really needed all your help so much!,DISCORD:679428761438912522:823570903219568700,DISCORD:Giveth:%F0%9F%92%9C%E2%94%8Bpraise,21,21,13,,,,False,False,False,whyldwanderer,0xed8DB37778804A913670d9367aAf4F043AAd938b,hanners717,0x711CDABCFdEDEf2c82D9dA533268D8bB6b7468f8,andrealomelin,0xd91B4Ca4159cFDF90453B3fDb6405a9DFee4B88c,18.3333333333333,0.0017639512508017927,111.23053239255911
65c548997a231cf482e63da7,2024-02-08T21:33:13.274000Z,oyealmond#0,63335947144cdd9b89d13d13,0x0D22735DE6d34DC2ed5efDbC2f30D7Aa8e2B9F8e,karmaticacid#0,63333aed144cdd9b89d12f9d,0xC46c67Bb7E84490D7EbdD0b8ecDaca68Cf3823F4,for supporting me on estimating costs for various parts of the QF WG proposal. this proposal was long overdue so I really needed all your help so much!,DISCORD:679428761438912522:823570903219568700,DISCORD:Giveth:%F0%9F%92%9C%E2%94%8Bpraise,13,8,34,,,,False,False,False,divine_comedian,0x826976d7C600d45FB8287CA1d7c76FC8eb732030,karmaticacid,0xC46c67Bb7E84490D7EbdD0b8ecDaca68Cf3823F4,juan_work,0xFEF5A1A2b3754A2F53161EaaAcb3EB889F004d4a,18.3333333333333,0.0017639512508017927,111.23053239255911
65c548a67a231cf482e63eac,2024-02-08T21:33:26.833000Z,divine_comedian#0,63330f21144cdd9b89d11bff,0x826976d7C600d45FB8287CA1d7c76FC8eb732030,giantkin#0,63332451144cdd9b89d1258f,0xff75E131c711e4310C045317779d39B3B4f718C4,Still putting up Tx creations while 'resting' Take it easy!,DISCORD:679428761438912522:823570903219568700,DISCORD:Giveth:%F0%9F%92%9C%E2%94%8Bpraise,3,55,21,,,,False,False,False,ramin,0x10a84b835C5df26f2A380B3E00bCC84A66cD2d34,almondoyealmond,0x0D22735DE6d34DC2ed5efDbC2f30D7Aa8e2B9F8e,andrealomelin,0xd91B4Ca4159cFDF90453B3fDb6405a9DFee4B88c,26.3333333333333,0.002533675432969849,159.76749198203956
65c548d17a231cf482e63f8d,2024-02-08T21:34:09.840000Z,snakey_jakey.,63331841144cdd9b89d12069,0xB9573982875b83aaDc1296726E2ae77D13D9B98F,karmaticacid#0,63333aed144cdd9b89d12f9d,0xC46c67Bb7E84490D7EbdD0b8ecDaca68Cf3823F4,for super quickly putting together a giveth grant audit so we can be sure we're making good on our promises & meeting milestones. Him taking over fundraising as a steward is just soo incredible because he is so epicly reliable and quick!!,DISCORD:679428761438912522:823570903219568700,DISCORD:Giveth:%F0%9F%92%9C%E2%94%8Bpraise,34,5,55,,,,False,False,False,divine_comedian,0x826976d7C600d45FB8287CA1d7c76FC8eb732030,mateodaza,0x00d18ca9782bE1CaEF611017c2Fbc1a39779A57C,nicbals,0xd9D5d85B2682830aC58A78c279E0C177953738b4,31.3333333333333,0.0030147530468248845,190.10309172546482
65c54e9f7a231cf482e641b7,2024-02-08T21:58:55.951000Z,ramramez#0,63344d5e144cdd9b89d1a3ab,0x10a84b835C5df26f2A380B3E00bCC84A66cD2d34,divine_comedian#0,63330f21144cdd9b89d11bff,0x826976d7C600d45FB8287CA1d7c76FC8eb732030,for making great progress on the development of the email service migration! He's getting his hands dirty in back-end work and doing a great job!,DISCORD:679428761438912522:823570903219568700,DISCORD:Giveth:%F0%9F%92%9C%E2%94%8Bpraise,34,21,21,,,,False,False,False,whyldwanderer,0xed8DB37778804A913670d9367aAf4F043AAd938b,hanners717,0x711CDABCFdEDEf2c82D9dA533268D8bB6b7468f8,nicbals,0xd9D5d85B2682830aC58A78c279E0C177953738b4,25.3333333333333,0.002437459910198842,153.70037203335448
65c5eb467a231cf482e6acf3,2024-02-09T09:07:18.901000Z,karmaticacid#0,63333aed144cdd9b89d12f9d,0xC46c67Bb7E84490D7EbdD0b8ecDaca68Cf3823F4,snakey_jakey.,63331841144cdd9b89d12069,0xB9573982875b83aaDc1296726E2ae77D13D9B98F,for finding yet another QF round to participate in with Glo / GCG. Truly the Queen of QF ðŸ‘‘,DISCORD:679428761438912522:823570903219568700,DISCORD:Giveth:%F0%9F%92%9C%E2%94%8Bpraise,34,13,13,,,,False,False,False,whyldwanderer,0xed8DB37778804A913670d9367aAf4F043AAd938b,almondoyealmond,0x0D22735DE6d34DC2ed5efDbC2f30D7Aa8e2B9F8e,nikola_creatrix,0x9924285ff2207D6e36642B6832A515A6a3aedCAB,20.0,0.001924310455420141,121.34239897370108
65c5eb857a231cf482e6add3,2024-02-09T09:08:21.943000Z,whyldwanderer#0,63332c97144cdd9b89d1295c,0xed8DB37778804A913670d9367aAf4F043AAd938b,snakey_jakey.,63331841144cdd9b89d12069,0xB9573982875b83aaDc1296726E2ae77D13D9B98F,for being a rock of Giveth. She isnt afraid to speak up for her beliefs and not just to stir the pot or bring drama but real core issues that need to be addressed ðŸª¨,DISCORD:679428761438912522:823570903219568700,DISCORD:Giveth:%F0%9F%92%9C%E2%94%8Bpraise,3,8,13,,,,False,False,False,ramin,0x10a84b835C5df26f2A380B3E00bCC84A66cD2d34,karmaticacid,0xC46c67Bb7E84490D7EbdD0b8ecDaca68Cf3823F4,nicbals,0xd9D5d85B2682830aC58A78c279E0C177953738b4,8.0,0.0007697241821680564,48.53695958948043
65c5ebb37a231cf482e6aeb5,2024-02-09T09:09:07.339000Z,divine_comedian#0,63330f21144cdd9b89d11bff,0x826976d7C600d45FB8287CA1d7c76FC8eb732030,snakey_jakey.,63331841144cdd9b89d12069,0xB9573982875b83aaDc1296726E2ae77D13D9B98F,"for taking on the ""Donorship"" partnership and really running with it. I think there is real potential for Giveth there and he is owning it ðŸ«³ðŸ»",DISCORD:679428761438912522:823570903219568700,DISCORD:Giveth:%F0%9F%92%9C%E2%94%8Bpraise,3,89,21,,,,False,False,False,ramin,0x10a84b835C5df26f2A380B3E00bCC84A66cD2d34,almondoyealmond,0x0D22735DE6d34DC2ed5efDbC2f30D7Aa8e2B9F8e,andrealomelin,0xd91B4Ca4159cFDF90453B3fDb6405a9DFee4B88c,37.6666666666667,0.003624118024374602,228.5281847338039
65c5ebe87a231cf482e6af95,2024-02-09T09:10:00.207000Z,marcelorefi,65b124a0794ccb911d45b324,0x16204069922fc4242FbbC5c664970c9601015865,snakey_jakey.,63331841144cdd9b89d12069,0xB9573982875b83aaDc1296726E2ae77D13D9B98F,for taking on some new L2 grants for Giveth and championing the grant writing / fundraising in general for Giveth âœðŸ»,DISCORD:679428761438912522:823570903219568700,DISCORD:Giveth:%F0%9F%92%9C%E2%94%8Bpraise,13,55,8,,,,False,False,False,whyldwanderer,0xed8DB37778804A913670d9367aAf4F043AAd938b,almondoyealmond,0x0D22735DE6d34DC2ed5efDbC2f30D7Aa8e2B9F8e,nicbals,0xd9D5d85B2682830aC58A78c279E0C177953738b4,25.3333333333333,0.002437459910198842,153.70037203335448
65c5ec1a7a231cf482e6b09a,2024-02-09T09:10:50.402000Z,oyealmond#0,63335947144cdd9b89d13d13,0x0D22735DE6d34DC2ed5efDbC2f30D7Aa8e2B9F8e,snakey_jakey.,63331841144cdd9b89d12069,0xB9573982875b83aaDc1296726E2ae77D13D9B98F,"for working incredibly hard with an incredibly hard task of finding Solana projects for the Giveth incentive. Your work is noticed and appreciated, hope you hit the finish line ðŸŽï¸",DISCORD:679428761438912522:823570903219568700,DISCORD:Giveth:%F0%9F%92%9C%E2%94%8Bpraise,0,8,55,65c507547a231cf482e584bf,,,False,False,False,divine_comedian,0x826976d7C600d45FB8287CA1d7c76FC8eb732030,karmaticacid,0xC46c67Bb7E84490D7EbdD0b8ecDaca68Cf3823F4,juan_work,0xFEF5A1A2b3754A2F53161EaaAcb3EB889F004d4a,21.0,0.002020525978191148,127.40951892238613
65c5ec1a7a231cf482e6b099,2024-02-09T09:10:50.402000Z,whyldwanderer#0,63332c97144cdd9b89d1295c,0xed8DB37778804A913670d9367aAf4F043AAd938b,snakey_jakey.,63331841144cdd9b89d12069,0xB9573982875b83aaDc1296726E2ae77D13D9B98F,"for working incredibly hard with an incredibly hard task of finding Solana projects for the Giveth incentive. Your work is noticed and appreciated, hope you hit the finish line ðŸŽï¸",DISCORD:679428761438912522:823570903219568700,DISCORD:Giveth:%F0%9F%92%9C%E2%94%8Bpraise,3,13,13,,,,False,False,False,ramin,0x10a84b835C5df26f2A380B3E00bCC84A66cD2d34,karmaticacid,0xC46c67Bb7E84490D7EbdD0b8ecDaca68Cf3823F4,nicbals,0xd9D5d85B2682830aC58A78c279E0C177953738b4,9.66666666666667,0.0009300833867864018,58.64882617062221
65c5ec1a7a231cf482e6b09b,2024-02-09T09:10:50.402000Z,nikolacreatrix#0,63331e93144cdd9b89d1232a,0x9924285ff2207D6e36642B6832A515A6a3aedCAB,snakey_jakey.,63331841144cdd9b89d12069,0xB9573982875b83aaDc1296726E2ae77D13D9B98F,"for working incredibly hard with an incredibly hard task of finding Solana projects for the Giveth incentive. Your work is noticed and appreciated, hope you hit the finish line ðŸŽï¸",DISCORD:679428761438912522:823570903219568700,DISCORD:Giveth:%F0%9F%92%9C%E2%94%8Bpraise,0,21,34,65c2796f7a231cf482e24f43,,,False,False,False,whyldwanderer,0xed8DB37778804A913670d9367aAf4F043AAd938b,hanners717,0x711CDABCFdEDEf2c82D9dA533268D8bB6b7468f8,andrealomelin,0xd91B4Ca4159cFDF90453B3fDb6405a9DFee4B88c,18.3333333333333,0.0017639512508017927,111.23053239255911
65c5ec677a231cf482e6b2df,2024-02-09T09:12:07.035000Z,griffgreen#0,633339fe144cdd9b89d12f30,0x839395e20bbB182fa440d08F850E6c7A8f6F0780,snakey_jakey.,63331841144cdd9b89d12069,0xB9573982875b83aaDc1296726E2ae77D13D9B98F,"for being a creative contributor, always trying to find solutions when sometimes no one else is, but most importantly he truly believes in each and everyone of us. He doesn't try to find faults but directs by our strengths. A true leader! <:GIV:923418911511281715>",DISCORD:679428761438912522:823570903219568700,DISCORD:Giveth:%F0%9F%92%9C%E2%94%8Bpraise,5,5,144,,,,False,False,False,ramin,0x10a84b835C5df26f2A380B3E00bCC84A66cD2d34,mateodaza,0x00d18ca9782bE1CaEF611017c2Fbc1a39779A57C,andrealomelin,0xd91B4Ca4159cFDF90453B3fDb6405a9DFee4B88c,51.3333333333333,0.0049390635022450256,311.44549069916593
65c5ecaa7a231cf482e6b3d3,2024-02-09T09:13:14.670000Z,oyealmond#0,63335947144cdd9b89d13d13,0x0D22735DE6d34DC2ed5efDbC2f30D7Aa8e2B9F8e,snakey_jakey.,63331841144cdd9b89d12069,0xB9573982875b83aaDc1296726E2ae77D13D9B98F,"for being my go to's for most things Giveth. If I have questions about any comms or project building issues, they have the answer, the right answer and the timely answer. Respect! âœŠðŸ»",DISCORD:679428761438912522:823570903219568700,DISCORD:Giveth:%F0%9F%92%9C%E2%94%8Bpraise,21,13,55,,,,False,False,False,divine_comedian,0x826976d7C600d45FB8287CA1d7c76FC8eb732030,karmaticacid,0xC46c67Bb7E84490D7EbdD0b8ecDaca68Cf3823F4,juan_work,0xFEF5A1A2b3754A2F53161EaaAcb3EB889F004d4a,29.6666666666667,0.0028543938422065456,179.99122514432347
65c5ecaa7a231cf482e6b3d2,2024-02-09T09:13:14.670000Z,whyldwanderer#0,63332c97144cdd9b89d1295c,0xed8DB37778804A913670d9367aAf4F043AAd938b,snakey_jakey.,63331841144cdd9b89d12069,0xB9573982875b83aaDc1296726E2ae77D13D9B98F,"for being my go to's for most things Giveth. If I have questions about any comms or project building issues, they have the answer, the right answer and the timely answer. Respect! âœŠðŸ»",DISCORD:679428761438912522:823570903219568700,DISCORD:Giveth:%F0%9F%92%9C%E2%94%8Bpraise,3,34,13,,,,False,False,False,ramin,0x10a84b835C5df26f2A380B3E00bCC84A66cD2d34,karmaticacid,0xC46c67Bb7E84490D7EbdD0b8ecDaca68Cf3823F4,nicbals,0xd9D5d85B2682830aC58A78c279E0C177953738b4,16.6666666666667,0.001603592046183454,101.11866581141777
65c5ecf77a231cf482e6b4bd,2024-02-09T09:14:31.466000Z,divine_comedian#0,63330f21144cdd9b89d11bff,0x826976d7C600d45FB8287CA1d7c76FC8eb732030,snakey_jakey.,63331841144cdd9b89d12069,0xB9573982875b83aaDc1296726E2ae77D13D9B98F,"for being crazy active in the Forum. He really is DAO at heart and support the DAO by supporting the DAO mechanism. A leader by doing, not just saying! ðŸ•Šï¸",DISCORD:679428761438912522:823570903219568700,DISCORD:Giveth:%F0%9F%92%9C%E2%94%8Bpraise,3,55,89,,,,False,False,False,ramin,0x10a84b835C5df26f2A380B3E00bCC84A66cD2d34,almondoyealmond,0x0D22735DE6d34DC2ed5efDbC2f30D7Aa8e2B9F8e,andrealomelin,0xd91B4Ca4159cFDF90453B3fDb6405a9DFee4B88c,49.0,0.0047145606157793455,297.28887748556764
65c646a77a231cf482e72275,2024-02-09T15:37:11.487000Z,parrachia#0,6490456235a11ee830abcd04,0x144c4E5027B69f7798B2B162D924BcAE5c149f15,marcelorefi,65b124a0794ccb911d45b324,0x16204069922fc4242FbbC5c664970c9601015865,for helping me to navigate!,DISCORD:679428761438912522:823570903219568700,DISCORD:Giveth:%F0%9F%92%9C%E2%94%8Bpraise,8,13,5,,,,False,False,False,whyldwanderer,0xed8DB37778804A913670d9367aAf4F043AAd938b,hanners717,0x711CDABCFdEDEf2c82D9dA533268D8bB6b7468f8,nicbals,0xd9D5d85B2682830aC58A78c279E0C177953738b4,8.66666666666667,0.0008338678640153947,52.581706221937154
