65ce25f6c465d413c5a93dae,2024-02-15T14:55:50.821000Z,carlos096,6335b3878622e4e2bd1f199c,0x317bbc1927Be411CD05615d2Ffdf8d320C6C4052,greenbee9327,65280d5f5b301983ec9805bc,0x44AC194359fA44eCe6Cb2E53E8c90547BCCb95a0,for creating BE table for Sybil address upload.,DISCORD:679428761438912522:759816279623467023,DISCORD:Giveth:%F0%9F%92%B9%E2%94%8Bgiv-economy,21,13,13,,,,False,False,False,geleeroyale,0x701d0ECB3BA780De7b2b36789aEC4493A426010a,hanners717,0x711CDABCFdEDEf2c82D9dA533268D8bB6b7468f8,andrealomelin,0xd91B4Ca4159cFDF90453B3fDb6405a9DFee4B88c,15.6666666666667,0.001507376523412447,95.05154586273271
65ce261dc465d413c5a93e8e,2024-02-15T14:56:29.703000Z,_cherik#0,63333b26144cdd9b89d12fc4,0x8F48094a12c8F99d616AE8F3305D5eC73cBAA6b6,greenbee9327,65280d5f5b301983ec9805bc,0x44AC194359fA44eCe6Cb2E53E8c90547BCCb95a0,for finishing FE tasks related to Metapool Round. Cant wait to see it deployed on sunday.,DISCORD:679428761438912522:759816279623467023,DISCORD:Giveth:%F0%9F%92%B9%E2%94%8Bgiv-economy,21,8,55,,,,False,False,False,divine_comedian,0x826976d7C600d45FB8287CA1d7c76FC8eb732030,karmaticacid,0xC46c67Bb7E84490D7EbdD0b8ecDaca68Cf3823F4,juan_work,0xFEF5A1A2b3754A2F53161EaaAcb3EB889F004d4a,28.0,0.0026940346375881976,169.8793585631815
65ce2637c465d413c5a93f71,2024-02-15T14:56:55.943000Z,Maryjaf#2478,6335b25e8622e4e2bd1f183c,0x756A78077A06493b9ff0Ed18B50Df695DFA5e0d9,greenbee9327,65280d5f5b301983ec9805bc,0x44AC194359fA44eCe6Cb2E53E8c90547BCCb95a0,"for spending time verifying different fixes related to QF, Giveconomy and Metapool round",DISCORD:679428761438912522:759816279623467023,DISCORD:Giveth:%F0%9F%92%B9%E2%94%8Bgiv-economy,34,34,13,,,,False,False,False,divine_comedian,0x826976d7C600d45FB8287CA1d7c76FC8eb732030,almondoyealmond,0x0D22735DE6d34DC2ed5efDbC2f30D7Aa8e2B9F8e,juan_work,0xFEF5A1A2b3754A2F53161EaaAcb3EB889F004d4a,27.0,0.0025978191148171904,163.81223861449647
65ce4158c465d413c5a96ae9,2024-02-15T16:52:40.208000Z,aabugosh,633311ce144cdd9b89d11d66,0x33878e070db7f70D2953Fe0278Cd32aDf8104572,oyealmond#0,63335947144cdd9b89d13d13,0x0D22735DE6d34DC2ed5efDbC2f30D7Aa8e2B9F8e,for all his support in the marketing hiring process,DISCORD:679428761438912522:823570903219568700,DISCORD:Giveth:%F0%9F%92%9C%E2%94%8Bpraise,21,5,8,,,,False,False,False,divine_comedian,0x826976d7C600d45FB8287CA1d7c76FC8eb732030,karmaticacid,0xC46c67Bb7E84490D7EbdD0b8ecDaca68Cf3823F4,andrealomelin,0xd91B4Ca4159cFDF90453B3fDb6405a9DFee4B88c,11.3333333333333,0.0010904425914047434,68.76069275176374
65ce75a9c465d413c5a9b048,2024-02-15T20:35:53.854000Z,Maryjaf#2478,6335b25e8622e4e2bd1f183c,0x756A78077A06493b9ff0Ed18B50Df695DFA5e0d9,greenbee9327,65280d5f5b301983ec9805bc,0x44AC194359fA44eCe6Cb2E53E8c90547BCCb95a0,for stretching beyond her work time for verifying additional fixes for the upcoming release.,DISCORD:679428761438912522:861692942645067777,DISCORD:Giveth:%F0%9F%91%8C%E2%94%8Ball-dev,21,89,34,,,,False,False,False,divine_comedian,0x826976d7C600d45FB8287CA1d7c76FC8eb732030,almondoyealmond,0x0D22735DE6d34DC2ed5efDbC2f30D7Aa8e2B9F8e,juan_work,0xFEF5A1A2b3754A2F53161EaaAcb3EB889F004d4a,48.0,0.004618345093008338,291.2217575368826
65ce75f0c465d413c5a9b13a,2024-02-15T20:37:04.890000Z,carlos096,6335b3878622e4e2bd1f199c,0x317bbc1927Be411CD05615d2Ffdf8d320C6C4052,greenbee9327,65280d5f5b301983ec9805bc,0x44AC194359fA44eCe6Cb2E53E8c90547BCCb95a0,for being available to pick up tasks on the spot and try to resolve as many dependencies as possible to unblock upcoming release,DISCORD:679428761438912522:861692942645067777,DISCORD:Giveth:%F0%9F%91%8C%E2%94%8Ball-dev,34,34,21,,,,False,False,False,geleeroyale,0x701d0ECB3BA780De7b2b36789aEC4493A426010a,hanners717,0x711CDABCFdEDEf2c82D9dA533268D8bB6b7468f8,andrealomelin,0xd91B4Ca4159cFDF90453B3fDb6405a9DFee4B88c,29.6666666666667,0.0028543938422065456,179.99122514432347
65ce75f0c465d413c5a9b13b,2024-02-15T20:37:04.891000Z,mateodazab#0,6335afb18622e4e2bd1f15cb,0x00d18ca9782bE1CaEF611017c2Fbc1a39779A57C,greenbee9327,65280d5f5b301983ec9805bc,0x44AC194359fA44eCe6Cb2E53E8c90547BCCb95a0,for being available to pick up tasks on the spot and try to resolve as many dependencies as possible to unblock upcoming release,DISCORD:679428761438912522:861692942645067777,DISCORD:Giveth:%F0%9F%91%8C%E2%94%8Ball-dev,8,21,8,,,,False,False,False,divine_comedian,0x826976d7C600d45FB8287CA1d7c76FC8eb732030,hanners717,0x711CDABCFdEDEf2c82D9dA533268D8bB6b7468f8,andrealomelin,0xd91B4Ca4159cFDF90453B3fDb6405a9DFee4B88c,12.3333333333333,0.0011866581141757504,74.8278127004488
65ce7626c465d413c5a9b228,2024-02-15T20:37:58.818000Z,rolazo,64d0d46e49fdcebef2bb8df5,0xd929F5975A58E086D76229Bdb384627408b38D96,greenbee9327,65280d5f5b301983ec9805bc,0x44AC194359fA44eCe6Cb2E53E8c90547BCCb95a0,for his prompt responses and for being available to support deployments for the upcoming release,DISCORD:679428761438912522:861692942645067777,DISCORD:Giveth:%F0%9F%91%8C%E2%94%8Ball-dev,21,13,34,,,,False,False,False,whyldwanderer,0xed8DB37778804A913670d9367aAf4F043AAd938b,karmaticacid,0xC46c67Bb7E84490D7EbdD0b8ecDaca68Cf3823F4,juan_work,0xFEF5A1A2b3754A2F53161EaaAcb3EB889F004d4a,22.6666666666667,0.0021808851828094963,137.52138550352808
65ce767bc465d413c5a9b308,2024-02-15T20:39:23.881000Z,greenbee9327,65280d5f5b301983ec9805bc,0x44AC194359fA44eCe6Cb2E53E8c90547BCCb95a0,moenick,63335999144cdd9b89d13d4a,0xA4D506434445Bb7303eA34A07bc38484cdC64a95,for following up release while it's too late for her. Really in her midnight,DISCORD:679428761438912522:861692942645067777,DISCORD:Giveth:%F0%9F%91%8C%E2%94%8Ball-dev,5,21,5,,,,False,False,False,ramin,0x10a84b835C5df26f2A380B3E00bCC84A66cD2d34,karmaticacid,0xC46c67Bb7E84490D7EbdD0b8ecDaca68Cf3823F4,nicbals,0xd9D5d85B2682830aC58A78c279E0C177953738b4,10.3333333333333,0.0009942270686337364,62.693572803078695
65cf013fc465d413c5aa0936,2024-02-16T06:31:27.693000Z,divine_comedian#0,63330f21144cdd9b89d11bff,0x826976d7C600d45FB8287CA1d7c76FC8eb732030,snakey_jakey.,63331841144cdd9b89d12069,0xB9573982875b83aaDc1296726E2ae77D13D9B98F,for continuing to push the back end on the SuperFluid integration. Its going to be a thing of beauty for Giveth once its finally complete and we will have him to thank for grinding hard on i t,DISCORD:679428761438912522:823570903219568700,DISCORD:Giveth:%F0%9F%92%9C%E2%94%8Bpraise,3,34,55,,,,False,False,False,ramin,0x10a84b835C5df26f2A380B3E00bCC84A66cD2d34,almondoyealmond,0x0D22735DE6d34DC2ed5efDbC2f30D7Aa8e2B9F8e,andrealomelin,0xd91B4Ca4159cFDF90453B3fDb6405a9DFee4B88c,30.6666666666667,0.002950609364977553,186.05834509300854
65cf01f7c465d413c5aa0a25,2024-02-16T06:34:31.526000Z,griffgreen#0,633339fe144cdd9b89d12f30,0x839395e20bbB182fa440d08F850E6c7A8f6F0780,snakey_jakey.,63331841144cdd9b89d12069,0xB9573982875b83aaDc1296726E2ae77D13D9B98F,our resident fire fighters ðŸ‘¨ðŸ»â€ðŸš’ ðŸš’ for putting out some massive fires before they were even started with Trustalabs sybil feedback on the last QF rounds. They were completely wrong and these two caught them before they went to the sponsor. That's what working hard for the cause looks like,DISCORD:679428761438912522:823570903219568700,DISCORD:Giveth:%F0%9F%92%9C%E2%94%8Bpraise,5,13,55,,,,False,False,False,ramin,0x10a84b835C5df26f2A380B3E00bCC84A66cD2d34,mateodaza,0x00d18ca9782bE1CaEF611017c2Fbc1a39779A57C,andrealomelin,0xd91B4Ca4159cFDF90453B3fDb6405a9DFee4B88c,24.3333333333333,0.002341244387427835,147.63325208466946
65cf01f7c465d413c5aa0a26,2024-02-16T06:34:31.527000Z,karmaticacid#0,63333aed144cdd9b89d12f9d,0xC46c67Bb7E84490D7EbdD0b8ecDaca68Cf3823F4,snakey_jakey.,63331841144cdd9b89d12069,0xB9573982875b83aaDc1296726E2ae77D13D9B98F,our resident fire fighters ðŸ‘¨ðŸ»â€ðŸš’ ðŸš’ for putting out some massive fires before they were even started with Trustalabs sybil feedback on the last QF rounds. They were completely wrong and these two caught them before they went to the sponsor. That's what working hard for the cause looks like,DISCORD:679428761438912522:823570903219568700,DISCORD:Giveth:%F0%9F%92%9C%E2%94%8Bpraise,34,21,55,,,,False,False,False,whyldwanderer,0xed8DB37778804A913670d9367aAf4F043AAd938b,almondoyealmond,0x0D22735DE6d34DC2ed5efDbC2f30D7Aa8e2B9F8e,nikola_creatrix,0x9924285ff2207D6e36642B6832A515A6a3aedCAB,36.6666666666667,0.003527902501603595,222.46106478511885
65cf0234c465d413c5aa0b16,2024-02-16T06:35:32.897000Z,karmaticacid#0,63333aed144cdd9b89d12f9d,0xC46c67Bb7E84490D7EbdD0b8ecDaca68Cf3823F4,snakey_jakey.,63331841144cdd9b89d12069,0xB9573982875b83aaDc1296726E2ae77D13D9B98F,"for taking the time out of her busy schedule to review my Giveth grants audit, and not only review but offer really great feedback and action items. Nice to not only have feedback but then to have the way out of the issues.",DISCORD:679428761438912522:823570903219568700,DISCORD:Giveth:%F0%9F%92%9C%E2%94%8Bpraise,21,34,13,,,,False,False,False,whyldwanderer,0xed8DB37778804A913670d9367aAf4F043AAd938b,almondoyealmond,0x0D22735DE6d34DC2ed5efDbC2f30D7Aa8e2B9F8e,nikola_creatrix,0x9924285ff2207D6e36642B6832A515A6a3aedCAB,22.6666666666667,0.0021808851828094963,137.52138550352808
65cf027dc465d413c5aa0bf7,2024-02-16T06:36:45.176000Z,divine_comedian#0,63330f21144cdd9b89d11bff,0x826976d7C600d45FB8287CA1d7c76FC8eb732030,snakey_jakey.,63331841144cdd9b89d12069,0xB9573982875b83aaDc1296726E2ae77D13D9B98F,again but for his hard work with the future donorship widget revenue generator. He is really involved with as I see hundreds of back n forth messages being sent on the daily. It will be a nice and needed revenue stream for Giveth once completed,DISCORD:679428761438912522:823570903219568700,DISCORD:Giveth:%F0%9F%92%9C%E2%94%8Bpraise,3,89,89,,,,False,False,False,ramin,0x10a84b835C5df26f2A380B3E00bCC84A66cD2d34,almondoyealmond,0x0D22735DE6d34DC2ed5efDbC2f30D7Aa8e2B9F8e,andrealomelin,0xd91B4Ca4159cFDF90453B3fDb6405a9DFee4B88c,60.3333333333333,0.005805003207184089,366.0495702373314
65cf02adc465d413c5aa0cd8,2024-02-16T06:37:33.286000Z,marcelorefi,65b124a0794ccb911d45b324,0x16204069922fc4242FbbC5c664970c9601015865,snakey_jakey.,63331841144cdd9b89d12069,0xB9573982875b83aaDc1296726E2ae77D13D9B98F,"for jumping right in, then stepping back and then arranging a call to truly understand the fundraising needs of Giveth. I love people that can hold themselves back and then feel comfortable enough with themselves to ask for help or guidance when needed",DISCORD:679428761438912522:823570903219568700,DISCORD:Giveth:%F0%9F%92%9C%E2%94%8Bpraise,21,34,55,,,,False,False,False,whyldwanderer,0xed8DB37778804A913670d9367aAf4F043AAd938b,almondoyealmond,0x0D22735DE6d34DC2ed5efDbC2f30D7Aa8e2B9F8e,nicbals,0xd9D5d85B2682830aC58A78c279E0C177953738b4,36.6666666666667,0.003527902501603595,222.46106478511885
65cf02f2c465d413c5aa0dcc,2024-02-16T06:38:42.073000Z,nikolacreatrix#0,63331e93144cdd9b89d1232a,0x9924285ff2207D6e36642B6832A515A6a3aedCAB,snakey_jakey.,63331841144cdd9b89d12069,0xB9573982875b83aaDc1296726E2ae77D13D9B98F,"for their continued hard work trying to locate and add Solana projects, as well as verifying a great amount of Metapool projects for that upcoming QF round. They love projects and take the time to show it",DISCORD:679428761438912522:823570903219568700,DISCORD:Giveth:%F0%9F%92%9C%E2%94%8Bpraise,13,21,55,,,,False,False,False,whyldwanderer,0xed8DB37778804A913670d9367aAf4F043AAd938b,hanners717,0x711CDABCFdEDEf2c82D9dA533268D8bB6b7468f8,andrealomelin,0xd91B4Ca4159cFDF90453B3fDb6405a9DFee4B88c,29.6666666666667,0.0028543938422065456,179.99122514432347
65cf02f2c465d413c5aa0dcb,2024-02-16T06:38:42.073000Z,whyldwanderer#0,63332c97144cdd9b89d1295c,0xed8DB37778804A913670d9367aAf4F043AAd938b,snakey_jakey.,63331841144cdd9b89d12069,0xB9573982875b83aaDc1296726E2ae77D13D9B98F,"for their continued hard work trying to locate and add Solana projects, as well as verifying a great amount of Metapool projects for that upcoming QF round. They love projects and take the time to show it",DISCORD:679428761438912522:823570903219568700,DISCORD:Giveth:%F0%9F%92%9C%E2%94%8Bpraise,3,5,55,,,,False,False,False,ramin,0x10a84b835C5df26f2A380B3E00bCC84A66cD2d34,karmaticacid,0xC46c67Bb7E84490D7EbdD0b8ecDaca68Cf3823F4,nicbals,0xd9D5d85B2682830aC58A78c279E0C177953738b4,21.0,0.002020525978191148,127.40951892238613
65cf031ec465d413c5aa0eb7,2024-02-16T06:39:26.428000Z,griffgreen#0,633339fe144cdd9b89d12f30,0x839395e20bbB182fa440d08F850E6c7A8f6F0780,snakey_jakey.,63331841144cdd9b89d12069,0xB9573982875b83aaDc1296726E2ae77D13D9B98F,the big guy for another great week of lots of 1:1 time. Doesn't have a calendly anymore so it really shows how much our 1:1 time means to me. All the feels,DISCORD:679428761438912522:823570903219568700,DISCORD:Giveth:%F0%9F%92%9C%E2%94%8Bpraise,5,5,34,,,,False,False,False,ramin,0x10a84b835C5df26f2A380B3E00bCC84A66cD2d34,mateodaza,0x00d18ca9782bE1CaEF611017c2Fbc1a39779A57C,andrealomelin,0xd91B4Ca4159cFDF90453B3fDb6405a9DFee4B88c,14.6666666666667,0.00141116100064144,88.98442591404766
65cf0352c465d413c5aa0faa,2024-02-16T06:40:18.612000Z,elizardwizzard,635a84578622e4e2bd2ed397,,snakey_jakey.,63331841144cdd9b89d12069,0xB9573982875b83aaDc1296726E2ae77D13D9B98F,for really putting her heart and soul into the comms work needed for the Giveth GLO QF round coming up on GCG. Taking information from the team in stread and I know she will produce,DISCORD:679428761438912522:823570903219568700,DISCORD:Giveth:%F0%9F%92%9C%E2%94%8Bpraise,3,34,21,,,,False,False,False,ramin,0x10a84b835C5df26f2A380B3E00bCC84A66cD2d34,hanners717,0x711CDABCFdEDEf2c82D9dA533268D8bB6b7468f8,nicbals,0xd9D5d85B2682830aC58A78c279E0C177953738b4,19.3333333333333,0.0018601667735727997,117.29765234124417
65cf0393c465d413c5aa108b,2024-02-16T06:41:23.422000Z,divine_comedian#0,63330f21144cdd9b89d11bff,0x826976d7C600d45FB8287CA1d7c76FC8eb732030,snakey_jakey.,63331841144cdd9b89d12069,0xB9573982875b83aaDc1296726E2ae77D13D9B98F,one more time for really caring about everyone's rGIV and ensuring the community and maybe even the galaxy is here to support with Aragon votes,DISCORD:679428761438912522:823570903219568700,DISCORD:Giveth:%F0%9F%92%9C%E2%94%8Bpraise,3,21,55,,,,False,False,False,ramin,0x10a84b835C5df26f2A380B3E00bCC84A66cD2d34,almondoyealmond,0x0D22735DE6d34DC2ed5efDbC2f30D7Aa8e2B9F8e,andrealomelin,0xd91B4Ca4159cFDF90453B3fDb6405a9DFee4B88c,26.3333333333333,0.002533675432969849,159.76749198203956
65cf5237c465d413c5aa5635,2024-02-16T12:16:55.968000Z,geleeroyale,63330ed2144cdd9b89d11bc7,0x701d0ECB3BA780De7b2b36789aEC4493A426010a,NicoBals#2154,6335aa8b8622e4e2bd1f134f,0xd9D5d85B2682830aC58A78c279E0C177953738b4,"for the wonderful call today about the updates on the Buddy bot system. Making sure that it's working soon for our buddy call reminders automations and also for everyone to have the best buddy review call experience. Thank you, Kay!",DISCORD:679428761438912522:823570903219568700,DISCORD:Giveth:%F0%9F%92%9C%E2%94%8Bpraise,34,13,21,,,,False,False,False,divine_comedian,0x826976d7C600d45FB8287CA1d7c76FC8eb732030,karmaticacid,0xC46c67Bb7E84490D7EbdD0b8ecDaca68Cf3823F4,andrealomelin,0xd91B4Ca4159cFDF90453B3fDb6405a9DFee4B88c,22.6666666666667,0.0021808851828094963,137.52138550352808
65cf69d4c465d413c5aa6727,2024-02-16T13:57:40.872000Z,griffgreen#0,633339fe144cdd9b89d12f30,0x839395e20bbB182fa440d08F850E6c7A8f6F0780,karmaticacid#0,63333aed144cdd9b89d12f9d,0xC46c67Bb7E84490D7EbdD0b8ecDaca68Cf3823F4,"for pushing the giving season rd to get more donation on Optimism, then pushing data processing so we could get over $100k donations, report to Optimism and in the nick of time, meet the final milestone of our grant! It's because of his work that we're getting a bunch of giv liquidity paired w op on optimism!!",DISCORD:679428761438912522:823570903219568700,DISCORD:Giveth:%F0%9F%92%9C%E2%94%8Bpraise,5,8,144,,,,False,False,False,ramin,0x10a84b835C5df26f2A380B3E00bCC84A66cD2d34,mateodaza,0x00d18ca9782bE1CaEF611017c2Fbc1a39779A57C,andrealomelin,0xd91B4Ca4159cFDF90453B3fDb6405a9DFee4B88c,52.3333333333333,0.005035279025016033,317.512610647851
65cfbaccc465d413c5aa935f,2024-02-16T19:43:08.139000Z,aabugosh,633311ce144cdd9b89d11d66,0x33878e070db7f70D2953Fe0278Cd32aDf8104572,hanners717#0,6335b56e8622e4e2bd1f1bff,0x711CDABCFdEDEf2c82D9dA533268D8bB6b7468f8,for our async hacking a whole new different type of offer letter than we are used to!! It's so fun being a thought partner with you!,DISCORD:679428761438912522:823570903219568700,DISCORD:Giveth:%F0%9F%92%9C%E2%94%8Bpraise,34,13,13,,,,False,False,False,divine_comedian,0x826976d7C600d45FB8287CA1d7c76FC8eb732030,karmaticacid,0xC46c67Bb7E84490D7EbdD0b8ecDaca68Cf3823F4,andrealomelin,0xd91B4Ca4159cFDF90453B3fDb6405a9DFee4B88c,20.0,0.001924310455420141,121.34239897370108
65d1c75fc465d413c5abb4ed,2024-02-18T09:01:19.243000Z,_cherik#0,63333b26144cdd9b89d12fc4,0x8F48094a12c8F99d616AE8F3305D5eC73cBAA6b6,alireza7612#0,63344b46144cdd9b89d1a2a9,0xd5Bd8da424Af4c9eb87Bc9eB94A8478365366Fa3,for working on fii,DISCORD:679428761438912522:861692942645067777,DISCORD:Giveth:%F0%9F%91%8C%E2%94%8Ball-dev,0,3,21,,,,True,False,False,divine_comedian,0x826976d7C600d45FB8287CA1d7c76FC8eb732030,karmaticacid,0xC46c67Bb7E84490D7EbdD0b8ecDaca68Cf3823F4,juan_work,0xFEF5A1A2b3754A2F53161EaaAcb3EB889F004d4a,8.0,0.0007697241821680564,48.53695958948043
65d1c7aac465d413c5abb5cf,2024-02-18T09:02:34.065000Z,_cherik#0,63333b26144cdd9b89d12fc4,0x8F48094a12c8F99d616AE8F3305D5eC73cBAA6b6,alireza7612#0,63344b46144cdd9b89d1a2a9,0xd5Bd8da424Af4c9eb87Bc9eB94A8478365366Fa3,for working on fixes of broken branches.,DISCORD:679428761438912522:861692942645067777,DISCORD:Giveth:%F0%9F%91%8C%E2%94%8Ball-dev,21,5,13,,,,False,False,False,divine_comedian,0x826976d7C600d45FB8287CA1d7c76FC8eb732030,karmaticacid,0xC46c67Bb7E84490D7EbdD0b8ecDaca68Cf3823F4,juan_work,0xFEF5A1A2b3754A2F53161EaaAcb3EB889F004d4a,13.0,0.0012508017960230916,78.8725593329057
65d26b69c465d413c5ac164a,2024-02-18T20:41:13.796000Z,carlos096,6335b3878622e4e2bd1f199c,0x317bbc1927Be411CD05615d2Ffdf8d320C6C4052,greenbee9327,65280d5f5b301983ec9805bc,0x44AC194359fA44eCe6Cb2E53E8c90547BCCb95a0,for helping release QF improvements and helping get Metapool round ready ðŸ‘ðŸ»,DISCORD:679428761438912522:861692942645067777,DISCORD:Giveth:%F0%9F%91%8C%E2%94%8Ball-dev,34,21,21,,,,False,False,False,geleeroyale,0x701d0ECB3BA780De7b2b36789aEC4493A426010a,hanners717,0x711CDABCFdEDEf2c82D9dA533268D8bB6b7468f8,andrealomelin,0xd91B4Ca4159cFDF90453B3fDb6405a9DFee4B88c,25.3333333333333,0.002437459910198842,153.70037203335448
65d26b69c465d413c5ac1649,2024-02-18T20:41:13.796000Z,Maryjaf#2478,6335b25e8622e4e2bd1f183c,0x756A78077A06493b9ff0Ed18B50Df695DFA5e0d9,greenbee9327,65280d5f5b301983ec9805bc,0x44AC194359fA44eCe6Cb2E53E8c90547BCCb95a0,for helping release QF improvements and helping get Metapool round ready ðŸ‘ðŸ»,DISCORD:679428761438912522:861692942645067777,DISCORD:Giveth:%F0%9F%91%8C%E2%94%8Ball-dev,21,34,34,,,,False,False,False,divine_comedian,0x826976d7C600d45FB8287CA1d7c76FC8eb732030,almondoyealmond,0x0D22735DE6d34DC2ed5efDbC2f30D7Aa8e2B9F8e,juan_work,0xFEF5A1A2b3754A2F53161EaaAcb3EB889F004d4a,29.6666666666667,0.0028543938422065456,179.99122514432347
65d26b69c465d413c5ac164b,2024-02-18T20:41:13.797000Z,_cherik#0,63333b26144cdd9b89d12fc4,0x8F48094a12c8F99d616AE8F3305D5eC73cBAA6b6,greenbee9327,65280d5f5b301983ec9805bc,0x44AC194359fA44eCe6Cb2E53E8c90547BCCb95a0,for helping release QF improvements and helping get Metapool round ready ðŸ‘ðŸ»,DISCORD:679428761438912522:861692942645067777,DISCORD:Giveth:%F0%9F%91%8C%E2%94%8Ball-dev,13,5,21,,,,False,False,False,divine_comedian,0x826976d7C600d45FB8287CA1d7c76FC8eb732030,karmaticacid,0xC46c67Bb7E84490D7EbdD0b8ecDaca68Cf3823F4,juan_work,0xFEF5A1A2b3754A2F53161EaaAcb3EB889F004d4a,13.0,0.0012508017960230916,78.8725593329057
65d26b69c465d413c5ac164e,2024-02-18T20:41:13.797000Z,moenick,63335999144cdd9b89d13d4a,0xA4D506434445Bb7303eA34A07bc38484cdC64a95,greenbee9327,65280d5f5b301983ec9805bc,0x44AC194359fA44eCe6Cb2E53E8c90547BCCb95a0,for helping release QF improvements and helping get Metapool round ready ðŸ‘ðŸ»,DISCORD:679428761438912522:861692942645067777,DISCORD:Giveth:%F0%9F%91%8C%E2%94%8Ball-dev,13,21,55,,,,False,False,False,divine_comedian,0x826976d7C600d45FB8287CA1d7c76FC8eb732030,almondoyealmond,0x0D22735DE6d34DC2ed5efDbC2f30D7Aa8e2B9F8e,juan_work,0xFEF5A1A2b3754A2F53161EaaAcb3EB889F004d4a,29.6666666666667,0.0028543938422065456,179.99122514432347
65d26b69c465d413c5ac164d,2024-02-18T20:41:13.797000Z,mohammad_ranjbar_z#0,6334498b144cdd9b89d1a1a2,0x2Ea846Dc38C6b6451909F1E7ff2bF613a96DC1F3,greenbee9327,65280d5f5b301983ec9805bc,0x44AC194359fA44eCe6Cb2E53E8c90547BCCb95a0,for helping release QF improvements and helping get Metapool round ready ðŸ‘ðŸ»,DISCORD:679428761438912522:861692942645067777,DISCORD:Giveth:%F0%9F%91%8C%E2%94%8Ball-dev,13,21,55,,,,False,False,False,divine_comedian,0x826976d7C600d45FB8287CA1d7c76FC8eb732030,hanners717,0x711CDABCFdEDEf2c82D9dA533268D8bB6b7468f8,juan_work,0xFEF5A1A2b3754A2F53161EaaAcb3EB889F004d4a,29.6666666666667,0.0028543938422065456,179.99122514432347
65d26b69c465d413c5ac164c,2024-02-18T20:41:13.797000Z,mateodazab#0,6335afb18622e4e2bd1f15cb,0x00d18ca9782bE1CaEF611017c2Fbc1a39779A57C,greenbee9327,65280d5f5b301983ec9805bc,0x44AC194359fA44eCe6Cb2E53E8c90547BCCb95a0,for helping release QF improvements and helping get Metapool round ready ðŸ‘ðŸ»,DISCORD:679428761438912522:861692942645067777,DISCORD:Giveth:%F0%9F%91%8C%E2%94%8Ball-dev,13,21,13,,,,False,False,False,divine_comedian,0x826976d7C600d45FB8287CA1d7c76FC8eb732030,hanners717,0x711CDABCFdEDEf2c82D9dA533268D8bB6b7468f8,andrealomelin,0xd91B4Ca4159cFDF90453B3fDb6405a9DFee4B88c,15.6666666666667,0.001507376523412447,95.05154586273271
65d26be7c465d413c5ac1766,2024-02-18T20:43:19.814000Z,mohammad_ranjbar_z#0,6334498b144cdd9b89d1a1a2,0x2Ea846Dc38C6b6451909F1E7ff2bF613a96DC1F3,greenbee9327,65280d5f5b301983ec9805bc,0x44AC194359fA44eCe6Cb2E53E8c90547BCCb95a0,for fixing several important QF issues back to back and owning the backend release. Many of these issues were transferred to him at the last day and he delivered in time for the release with high focus ðŸ‘ðŸ»ðŸ‘ðŸ»,DISCORD:679428761438912522:861692942645067777,DISCORD:Giveth:%F0%9F%91%8C%E2%94%8Ball-dev,55,34,89,,,,False,False,False,divine_comedian,0x826976d7C600d45FB8287CA1d7c76FC8eb732030,hanners717,0x711CDABCFdEDEf2c82D9dA533268D8bB6b7468f8,juan_work,0xFEF5A1A2b3754A2F53161EaaAcb3EB889F004d4a,59.3333333333333,0.005708787684413082,359.9824502886463
65d26c20c465d413c5ac1886,2024-02-18T20:44:16.147000Z,Maryjaf#2478,6335b25e8622e4e2bd1f183c,0x756A78077A06493b9ff0Ed18B50Df695DFA5e0d9,greenbee9327,65280d5f5b301983ec9805bc,0x44AC194359fA44eCe6Cb2E53E8c90547BCCb95a0,"for being available, testing and verifying several issues for the QF release. She also stretched Thursday and today in order to ensure every task was deployed with great quality ðŸ‘ðŸ»ðŸ‘ðŸ»",DISCORD:679428761438912522:861692942645067777,DISCORD:Giveth:%F0%9F%91%8C%E2%94%8Ball-dev,55,5,55,,,,False,False,False,divine_comedian,0x826976d7C600d45FB8287CA1d7c76FC8eb732030,almondoyealmond,0x0D22735DE6d34DC2ed5efDbC2f30D7Aa8e2B9F8e,juan_work,0xFEF5A1A2b3754A2F53161EaaAcb3EB889F004d4a,38.3333333333333,0.0036882617062219338,232.5729313662602
65d26c20c465d413c5ac1928,2024-02-18T20:44:16.948000Z,Maryjaf#2478,6335b25e8622e4e2bd1f183c,0x756A78077A06493b9ff0Ed18B50Df695DFA5e0d9,greenbee9327,65280d5f5b301983ec9805bc,0x44AC194359fA44eCe6Cb2E53E8c90547BCCb95a0,"for being available, testing and verifying several issues for the QF release. She also stretched Thursday and today in order to ensure every task was deployed with great quality ðŸ‘ðŸ»ðŸ‘ðŸ»",DISCORD:679428761438912522:861692942645067777,DISCORD:Giveth:%F0%9F%91%8C%E2%94%8Ball-dev,0,5,0,,,65d26c20c465d413c5ac1886,True,False,False,divine_comedian,0x826976d7C600d45FB8287CA1d7c76FC8eb732030,almondoyealmond,0x0D22735DE6d34DC2ed5efDbC2f30D7Aa8e2B9F8e,juan_work,0xFEF5A1A2b3754A2F53161EaaAcb3EB889F004d4a,1.66666666666667,0.0001603592046183454,10.111866581141777
65d26c8ac465d413c5ac1a09,2024-02-18T20:46:02.048000Z,_cherik#0,63333b26144cdd9b89d12fc4,0x8F48094a12c8F99d616AE8F3305D5eC73cBAA6b6,greenbee9327,65280d5f5b301983ec9805bc,0x44AC194359fA44eCe6Cb2E53E8c90547BCCb95a0,for fixing several key FE issues as part of todayâ€™s release in addition to the p0 issues. He went above and beyond to fix as many issues as possible. He also owned FE release and was available to take up any last minute requests too ðŸ‘ðŸ»ðŸ‘ðŸ»,DISCORD:679428761438912522:861692942645067777,DISCORD:Giveth:%F0%9F%91%8C%E2%94%8Ball-dev,55,34,34,,,,False,False,False,divine_comedian,0x826976d7C600d45FB8287CA1d7c76FC8eb732030,karmaticacid,0xC46c67Bb7E84490D7EbdD0b8ecDaca68Cf3823F4,juan_work,0xFEF5A1A2b3754A2F53161EaaAcb3EB889F004d4a,41.0,0.003944836433611289,248.75191789608724
65d26dbdc465d413c5ac1aea,2024-02-18T20:51:09.357000Z,karmaticacid#0,63333aed144cdd9b89d12f9d,0xC46c67Bb7E84490D7EbdD0b8ecDaca68Cf3823F4,greenbee9327,65280d5f5b301983ec9805bc,0x44AC194359fA44eCe6Cb2E53E8c90547BCCb95a0,"for working with the team, sharing information to set the right priority and expectations for the release tasks and also verifying the correctness of implemented solution",DISCORD:679428761438912522:861692942645067777,DISCORD:Giveth:%F0%9F%91%8C%E2%94%8Ball-dev,21,34,8,,,,False,False,False,whyldwanderer,0xed8DB37778804A913670d9367aAf4F043AAd938b,almondoyealmond,0x0D22735DE6d34DC2ed5efDbC2f30D7Aa8e2B9F8e,nikola_creatrix,0x9924285ff2207D6e36642B6832A515A6a3aedCAB,21.0,0.002020525978191148,127.40951892238613
